"id";"tipo";"disciplina";"tema";"subtema";"dificuldade";"fonte";"ano";"enunciado";"alternativa_a";"alternativa_b";"alternativa_c";"alternativa_d";"alternativa_e";"resposta_correta";"explicacao";"resposta"
"6201";"multipla";"Quimica";"Estrutura Atomica";"Particulas subatomicas";"Facil";"ENEM";"2023";"O nucleo atomico e composto por:";"Protons e neutrons";"Protons e eletrons";"Eletrons e neutrons";"Apenas protons";"Apenas eletrons";"a";"O nucleo contem protons (carga +) e neutrons (neutros). Os eletrons orbitam ao redor do nucleo.";""
"6202";"multipla";"Quimica";"Estrutura Atomica";"Numero atomico e massa";"Facil";"ENEM";"2023";"O numero atomico (Z) de um elemento e igual ao numero de:";"Protons (e igual ao numero de eletrons no atomo neutro)";"Neutrons";"Eletrons mais neutrons";"Protons mais neutrons";"Nucleons";"a";"Z = numero de protons = numero de eletrons (no atomo neutro). A = Z + N (neutrons).";""
"6203";"multipla";"Quimica";"Estrutura Atomica";"Isotopos";"Medio";"ENEM";"2022";"Isotopos sao atomos do mesmo elemento que diferem no numero de:";"Neutrons";"Protons";"Eletrons";"Protons e eletrons";"Protons e neutrons";"a";"Isotopos: mesmo Z (mesmo elemento), diferente N (neutrons), portanto diferente massa atomica.";""
"6204";"multipla";"Quimica";"Ligacoes Quimicas";"Ligacao ionica";"Facil";"ENEM";"2023";"A ligacao ionica ocorre entre:";"Metal e nao metal (transferencia de eletrons)";"Dois nao metais (compartilhamento)";"Dois metais";"Metal e gas nobre";"Dois gases nobres";"a";"Na ligacao ionica, um metal perde eletrons (cation) e um nao metal ganha (anion), formando ions de cargas opostas.";""
"6205";"multipla";"Quimica";"Ligacoes Quimicas";"Ligacao covalente";"Facil";"ENEM";"2023";"A ligacao covalente envolve:";"Compartilhamento de pares de eletrons entre nao metais";"Transferencia total de eletrons";"Nuvem eletronica livre";"Apenas metais";"Ions positivos";"a";"Na ligacao covalente, atomos compartilham pares de eletrons para completar o octeto.";""
"6206";"multipla";"Quimica";"Ligacoes Quimicas";"Ligacao metalica";"Facil";"ENEM";"2023";"A ligacao metalica explica propriedades como condutividade eletrica e maleabilidade porque:";"Os eletrons livres circulam entre os captions metalicos";"Os atomos compartilham eletrons em pares definidos";"Ions se repelem";"Os eletrons estao fixos nos atomos";"Ha transferencia completa de eletrons";"a";"Nos metais, eletrons de valencia formam um mar de eletrons livres, conferindo condutividade e maleabilidade.";""
"6207";"multipla";"Quimica";"Funcoes Inorganicas";"Acidos";"Facil";"ENEM";"2023";"De acordo com a teoria de Arrhenius, um acido e uma substancia que, em agua, libera ions:";"H+ (hidrogenio)";"OH-";"Na+";"Cl-";"O2-";"a";"Segundo Arrhenius, acido libera H+ em agua. Exemplo: HCl -> H+ + Cl-.";""
"6208";"multipla";"Quimica";"Funcoes Inorganicas";"Bases";"Facil";"ENEM";"2023";"Uma base, segundo Arrhenius, e uma substancia que em agua libera ions:";"OH- (hidroxila)";"H+";"SO4 2-";"Na+";"Ca2+";"a";"Segundo Arrhenius, base libera OH- em agua. Exemplo: NaOH -> Na+ + OH-.";""
"6209";"multipla";"Quimica";"Funcoes Inorganicas";"pH";"Medio";"ENEM";"2022";"Uma solucao com pH 4 e considerada:";"Acida";"Basica";"Neutra";"Alcalina";"Indeterminada";"a";"pH < 7: acida. pH = 7: neutra. pH > 7: basica. pH 4 e acida.";""
"6210";"multipla";"Quimica";"Estequiometria";"Mol e numero de Avogadro";"Facil";"ENEM";"2023";"Um mol de qualquer substancia contem aproximadamente:";"6,02 x 10^23 entidades (numero de Avogadro)";"12 gramas";"22,4 gramas";"1 grama";"1000 entidades";"a";"1 mol = 6,02 x 10^23 particulas (atomo, molec, ions), independente da substancia.";""
"6211";"multipla";"Quimica";"Estequiometria";"Calculo estequiometrico";"Medio";"ENEM";"2022";"Na reacao 2H2 + O2 -> 2H2O, quantos moles de H2O sao produzidos a partir de 4 moles de H2?";"4 moles";"2 moles";"8 moles";"1 mol";"6 moles";"a";"Proporcao: 2 H2 : 2 H2O. Para 4 H2: 4 H2O.";""
"6212";"multipla";"Quimica";"Solucoes";"Concentracao molar";"Medio";"ENEM";"2022";"Dissolve-se 1 mol de NaCl em agua ate completar 1 litro. A concentracao molar e:";"1 mol/L";"0,5 mol/L";"2 mol/L";"1,5 mol/L";"0,1 mol/L";"a";"Molaridade (M) = n moles / volume em litros = 1/1 = 1 mol/L.";""
"6213";"multipla";"Quimica";"Solucoes";"Solubilidade";"Facil";"ENEM";"2023";"Uma solucao saturada e aquela que:";"Nao consegue dissolver mais soluto a determinada temperatura";"Tem menos soluto que o maximo possivel";"Esta em ebulicao";"Tem pH neutro";"Contem apenas gas dissolvido";"a";"Solucao saturada: contendo a quantidade maxima de soluto possivel a dada temperatura.";""
"6214";"multipla";"Quimica";"Termoquimica";"Reacao exotermica";"Facil";"ENEM";"2023";"Uma reacao exotermica e aquela que:";"Libera calor para o ambiente (delta H < 0)";"Absorve calor do ambiente (delta H > 0)";"Nao envolve variacao de energia";"Ocorre so em altas temperaturas";"Produz frio";"a";"Exotermica: libera energia (deltaH < 0). Endotermica: absorve (deltaH > 0).";""
"6215";"multipla";"Quimica";"Termoquimica";"Lei de Hess";"Medio";"Vestibular";"2023";"A Lei de Hess afirma que a variacao de entalpia de uma reacao:";"Independe do caminho reacional, dependendo apenas do estado inicial e final";"Depende do catalisador utilizado";"E sempre negativa";"Depende da velocidade da reacao";"Muda conforme a pressao";"a";"Lei de Hess: DeltaH total e igual a soma dos DeltaH das etapas, independente do caminho.";""
"6216";"multipla";"Quimica";"Cinetica Quimica";"Fatores que influenciam a velocidade";"Facil";"ENEM";"2023";"Aumentar a temperatura de uma reacao quimica normalmente:";"Aumenta a velocidade da reacao";"Reduz a velocidade";"Nao afeta a velocidade";"Para a reacao";"Aumenta o pH";"a";"O aumento de temperatura aumenta a energia cinetica das particulas, aumentando colisoes efetivas.";""
"6217";"multipla";"Quimica";"Cinetica Quimica";"Catalisador";"Facil";"ENEM";"2023";"Um catalisador aumenta a velocidade de uma reacao porque:";"Diminui a energia de ativacao necessaria";"Fornece mais energia para as moleculas";"Aumenta a concentracao dos reagentes";"Aumenta a temperatura do sistema";"Altera os produtos da reacao";"a";"Catalisador abre um caminho alternativo com menor energia de ativacao, acelerando a reacao sem ser consumido.";""
"6218";"multipla";"Quimica";"Equilibrio Quimico";"Principio de Le Chatelier";"Medio";"ENEM";"2022";"O Principio de Le Chatelier afirma que, ao se pertrubar um equilibrio, o sistema:";"Reage de forma a minimizar a perturbacao e atingir novo equilibrio";"Para a reacao";"Acelera sempre para a direita";"Permanece inalterado";"Aumenta a temperatura sempre";"a";"Le Chatelier: um sistema em equilibrio ao sofrer perturbacao (pressao, temp, conc) evolui para compensar.";""
"6219";"multipla";"Quimica";"Eletroquimica";"Pilha galvanica";"Medio";"Vestibular";"2023";"Em uma pilha galvanica (eletroquimica), o anodo e o polo onde ocorre:";"Oxidacao (perda de eletrons)";"Reducao (ganho de eletrons)";"Producao de gas hidrogenio";"Deposicao de metal";"Nenhuma reacao";"a";"Mnemonica: AnOx (Anodo-Oxidacao) e RedCat (Reducao-Catodo).";""
"6220";"multipla";"Quimica";"Eletroquimica";"Eletrolicidade";"Facil";"ENEM";"2022";"A corrosao de metais e um processo de:";"Oxidacao";"Reducao";"Neutralizacao";"Sintese";"Decomposicao";"a";"Corrosao e a oxidacao espontanea do metal pelo ambiente, principalmente pelo oxigenio e agua.";""
"6221";"multipla";"Quimica";"Quimica Organica";"Hidrocarb - funcoes organicas";"Facil";"ENEM";"2023";"Os alcanos sao hidrocarbonetos caracterizados por:";"Possuirem apenas ligacoes simples entre os carbonos (C-C)";"Terem uma ligacao dupla";"Terem ligacao tripla";"Conterem nitrogenio";"Serem aromaticos";"a";"Alcanos: CnH(2n+2), apenas ligacoes simples. Sao saturados. Ex: metano, etano, propano.";""
"6222";"multipla";"Quimica";"Quimica Organica";"Isomeria";"Medio";"Vestibular";"2022";"Isomeros sao compostos que possuem:";"A mesma formula molecular mas estruturas diferentes";"A mesma estrutura e formulas iguais";"Formulas moleculares diferentes";"Os mesmos pontos de fusao";"Os mesmos nomes IUPAC";"a";"Isomeros: mesma formula molecular (ex: C2H6O), mas estruturas e propriedades diferentes.";""
"6223";"multipla";"Quimica";"Polimeros";"Polimeros sinteticos";"Facil";"ENEM";"2023";"O plastico e formado por longas cadeias de moleculas chamadas:";"Polimeros";"Monomeros";"Isomeros";"Catalisadores";"Eletrolitons";"a";"Polimeros sao macromoleculas formadas por repeticao de monomeros. Plasticos sao polimeros sinteticos.";""
"6224";"multipla";"Quimica";"Quimica Ambiental";"Chuva acida";"Medio";"ENEM";"2022";"A chuva acida e causada principalmente pelas emissoes de:";"SO2 e NOx que formam acidos ao reagirem com a agua da chuva";"CO2 e metano";"Gas nobre e vapor d agua";"Oxigenio e nitrogenio";"CFC e ozonio";"a";"SO2 (queima de combustiveis) e NOx formam H2SO4 e HNO3 na atmosfera, causando chuva acida.";""
"6225";"multipla";"Quimica";"Quimica Ambiental";"Camada de ozonio";"Facil";"ENEM";"2023";"A destruicao da camada de ozonio e causada principalmente pelo gas:";"CFC (clorofluorcarbono)";"CO2";"SO2";"Metano";"Vapor d agua";"a";"O CFC libera cloro que catalisa a decomposicao do ozonio (O3) na estratosfera.";""
"6226";"multipla";"Biologia";"Citologia";"Celula procariontica e eucariontica";"Facil";"ENEM";"2023";"A principal diferenca entre celulas procarionticas e eucarionticas e:";"As eucarionticas possuem nucleo definido por membrana e as procarionticas nao";"As procarionticas sao maiores";"As eucarionticas nao possuem DNA";"As procarionticas possuem mitocondrias";"Ambas possuem nucleo definido";"a";"Procarionte: sem nucleo envolto por membrana (bacteria). Eucarionte: com nucleo verdadeiro.";""
"6227";"multipla";"Biologia";"Citologia";"Membrana plasmatica";"Facil";"ENEM";"2023";"A membrana plasmatica e composta principalmente por:";"Bicamada fosfolipidica com proteinas inseridas";"Polissacarideos e lipidios";"DNA e proteinas";"Celulose e lignina";"Calda de silica";"a";"Modelo do mosaico fluido: bicamada de fosfolipidios com proteinas perifericas e integrais.";""
"6228";"multipla";"Biologia";"Citologia";"Mitocondria";"Facil";"ENEM";"2023";"A mitocondria e conhecida como a usina de energia da celula porque:";"Realiza a respiracao celular e produz ATP";"Faz a fotossintese";"Sintetiza proteinas";"Armazena DNA nuclear";"Forma o citoesqueleto";"a";"A mitocondria realiza a respiracao aerobica, produzindo ATP (energia quimica) a partir de glicose e O2.";""
"6229";"multipla";"Biologia";"Bioquimica";"Proteinas";"Facil";"ENEM";"2023";"As proteinas sao formadas por unidades basicas chamadas:";"Aminoacidos";"Glicerol";"Nucleotideos";"Glicose";"Acidos graxos";"a";"Proteinas = cadeias de aminoacidos ligados por ligacoes peptidicas. Existem 20 aminoacidos essenciais.";""
"6230";"multipla";"Biologia";"Bioquimica";"DNA e RNA";"Facil";"ENEM";"2023";"O DNA e composto por nucleotideos que contem as bases nitrogenadas:";"Adenina, Timina, Guanina e Citosina";"Adenina, Uracila, Guanina e Citosina";"Glicose, Fosfato, Adenina e Guanina";"Aminoacidos e bases nitrogenadas";"Ribose, Uracila e Adenina";"a";"DNA: A, T, G, C (Timina e exclusiva do DNA). RNA: A, U, G, C (Uracila no lugar de Timina).";""
"6231";"multipla";"Biologia";"Genetica";"1a Lei de Mendel";"Medio";"ENEM";"2022";"A Primeira Lei de Mendel (segregacao) afirma que:";"Os alelos de um par se segregam na formacao dos gametas";"Genes de cromossomos diferentes se distribuem de forma independente";"O alelo dominante sempre aparece no fenot.";"Todos os filhos F1 sao identicos";"O DNA e transmitido apenas pela mae";"a";"1a Lei: cada individuo diploid. tem dois alelos para cada gene, que se separam na meiose (gametas haploides).";""
"6232";"multipla";"Biologia";"Genetica";"Cruzamento Mendeliano";"Medio";"ENEM";"2022";"No cruzamento entre dois individuos heterozigotos Aa x Aa, a proporcao fenotipica esperada e:";"3 dominantes para 1 recessivo";"1:1";"todos dominantes";"todos recessivos";"2:2";"a";"Aa x Aa => AA:Aa:aa = 1:2:1 (genotipica). Fenotipica: 3 com A_ (dominante) : 1 com aa.";""
"6233";"multipla";"Biologia";"Genetica";"Mutacao";"Medio";"ENEM";"2022";"A radiacao UV pode causar mutacoes no DNA porque:";"Provoca dimerizacao de timina, alterando a sequencia do DNA";"Desnatura as proteinas";"Destroi o nucleo celular";"Impede a fotossintese";"Aumenta a taxa de meiose";"a";"A UV causa ligacoes cruzadas entre bases de timina adjacentes, gerando mutacoes se nao reparadas.";""
"6234";"multipla";"Biologia";"Evolucao";"Selecao natural";"Facil";"ENEM";"2023";"O principal mecanismo de evolucao proposto por Darwin e Wallace e:";"Selecao natural";"Mutacao dirigida";"Heranca de caracteres adquiridos";"Deriva genetica";"Recombinacao";"a";"Darwin: selecao natural - individuos com caracteristicas vantajosas sobrevivem e se reproduzem mais.";""
"6235";"multipla";"Biologia";"Evolucao";"Evidencias de evolucao";"Facil";"ENEM";"2023";"Orgaos vestigiais (como o cocix humano) sao evidencias de evolucao porque:";"Indicam ancestrais comuns e perda de funcao ao longo da evolucao";"Sao estruturas sem origem biologica";"Provam a criacao especial";"Nao tem relacao com outros grupos";"Sao exclusivos de mamiferos";"a";"Orgaos vestigiais sao estruturas reduzidas sem funcao atual, mas funcionais em ancestrais.";""
"6236";"multipla";"Biologia";"Ecologia";"Cadeia alimentar";"Facil";"ENEM";"2023";"Em uma cadeia alimentar capim -> gafanhoto -> sapo -> cobra -> gaviao, os produtores sao:";"O capim";"Os gafanhotos";"Os sapos";"As cobras";"Os gaviaes";"a";"Produtores sao os autotrofos (realizam fotossintese). Na cadeia: capim e o produtor.";""
"6237";"multipla";"Biologia";"Ecologia";"Biomas brasileiros";"Facil";"ENEM";"2023";"A Mata Atlantica e um dos biomas mais ameacados do Brasil. Hoje, restam aproximadamente:";"12 a 15% da cobertura original";"50%";"70%";"30%";"80%";"a";"A Mata Atlantica perdeu mais de 85% de sua area original; restam apenas 12-15% de remanescentes.";""
"6238";"multipla";"Biologia";"Ecologia";"Ciclos biogeoquimicos";"Medio";"ENEM";"2022";"A decomposicao de materia organica devolve nutrientes ao solo e e realizada principalmente por:";"Bacterias e fungos decompositores";"Herbivoros";"Carnivoros";"Vegetais";"Algas marinhas";"a";"Decompositores (bacterias e fungos) reciclam a materia organica, devolvendo minerais ao solo.";""
"6239";"multipla";"Biologia";"Ecologia";"Desmatamento e impacto";"Facil";"ENEM";"2023";"O desmatamento aumenta o efeito estufa principalmente porque:";"Reduz a absorcao de CO2 e libera carbono estocado nas arvores";"Aumenta a producao de O2";"Nao afeta os gases atmosfericos";"Aumenta a biodiversidade";"Resfria o planeta";"a";"As arvores absorvem CO2; ao serem derrubadas, liberam o carbono estocado e reduzem a captura futura.";""
"6240";"multipla";"Biologia";"Fisiologia Humana";"Sistema digestivo";"Facil";"ENEM";"2023";"A digestao quimica de proteinas comeca no:";"Estomago (pela pepsina em meio acido)";"Boca";"Intestino delgado";"Intestino grosso";"Esofago";"a";"No estomago, a pepsina (ativada pelo HCl) inicia a digestao proteica. Na boca so ha digestao de amido.";""
"6241";"multipla";"Biologia";"Fisiologia Humana";"Sistema circulatorio";"Facil";"ENEM";"2023";"A circulacao pulmonar transporta sangue do coracao para os pulmoes para:";"Oxigenar o sangue e eliminar CO2";"Levar nutrientes aos pulmoes";"Filtrar o sangue";"Produzir hormonios";"Distribuir calor";"a";"Na circulacao pulmonar, o sangue venoso vai do VD aos pulmoes, onde recebe O2 e libera CO2.";""
"6242";"multipla";"Biologia";"Botanica";"Fotossintese";"Facil";"ENEM";"2023";"A fotossintese ocorre principalmente nos cloroplastos e transforma:";"Luz solar, CO2 e agua em glicose e O2";"Glicose e O2 em CO2 e agua";"Proteinas em aminoacidos";"O2 em CO2";"Solo em nutrientes";"a";"Equacao geral: 6CO2 + 6H2O + luz -> C6H12O6 + 6O2. Organismos autotrofos fixam o carbono atmosferico.";""
"6243";"multipla";"Biologia";"Biotecnologia";"DNA recombinante";"Medio";"ENEM";"2022";"A tecnologia do DNA recombinante permite:";"Inserir genes de um organismo em outro para produzir proteinas uteis (ex: insulina)";"Clonar orgaos naturais sem alteracao genetica";"Criar vida do zero";"Eliminar todas as doencas geneticas";"Aumentar a biodiversidade sem intervencao";"a";"DNA recombinante: unir DNA de diferentes origens. Usado para producao de insulina, vacinas, etc.";""
"6244";"multipla";"Biologia";"Saude";"Vacinacao";"Facil";"ENEM";"2023";"A imunidade coletiva (efeito de rebanho) ocorre quando:";"Uma proporcao suficiente da populacao esta imunizada, protegendo inclusive os nao vacinados";"Todos os individuos sao naturalmente imunes";"O virus muta e se torna inofensivo";"Apenas criancas sao vacinadas";"Os antibioticos eliminam o agente infeccioso";"a";"Quando suficientes pessoas estao imunes, a transmissao cai tanto que protege os vulneraveis nao vacinados.";""
"6245";"multipla";"Biologia";"Saude";"Saude publica";"Facil";"ENEM";"2023";"O vetor transmissor da dengue, zika e chikungunya no Brasil e:";"O mosquito Aedes aegypti";"O barbeiro";"O Anopheles";"O pernilongo comum";"A mosca tse-tse";"a";"O Aedes aegypti transmite dengue, zika, chikungunya e febre amarela. Prolifera em agua parada.";""
