"id";"tipo";"disciplina";"tema";"subtema";"dificuldade";"fonte";"ano";"enunciado";"alternativa_a";"alternativa_b";"alternativa_c";"alternativa_d";"alternativa_e";"resposta_correta";"explicacao";"resposta"
"4410";"multipla";"Matematica";"Algebra";"Sistemas lineares";"Medio";"Vestibular";"2024";"Resolva o sistema: x + y = 7 e x - y = 3. O valor de x e:";"5";"4";"3";"6";"2";"a";"Somando as equacoes: 2x = 10, logo x = 5. Entao y = 7 - 5 = 2.";""
"4411";"multipla";"Matematica";"Geometria Plana";"Trapezio";"Facil";"Vestibular";"2024";"A area de um trapezio com bases 6 cm e 10 cm e altura 4 cm e:";"32 cm2";"24 cm2";"40 cm2";"16 cm2";"60 cm2";"a";"A = (B+b)*h/2 = (10+6)*4/2 = 16*2 = 32 cm2.";""
"4412";"multipla";"Matematica";"Funcoes";"Funcao exponencial";"Medio";"Vestibular";"2024";"A solucao de 2^x = 32 e:";"5";"4";"6";"3";"7";"a";"2^5 = 32, portanto x = 5.";""
"4413";"multipla";"Matematica";"Analise Combinatoria";"Permutacao";"Medio";"Vestibular";"2024";"De quantas formas diferentes 4 pessoas podem se sentar em 4 cadeiras distintas?";"24";"12";"16";"8";"6";"a";"P(4) = 4! = 4*3*2*1 = 24.";""
"4414";"multipla";"Matematica";"Probabilidade";"Espaco amostral";"Facil";"Vestibular";"2024";"Um dado honesto e lancado. A probabilidade de sair um numero par e:";"1/2";"1/3";"2/3";"1/6";"5/6";"a";"Numeros pares: 2, 4, 6 (3 casos). Total: 6. P = 3/6 = 1/2.";""
"4415";"multipla";"Matematica";"Calculo";"Limites";"Dificil";"Vestibular";"2024";"O limite lim(x->2) (x^2 - 4)/(x - 2) e igual a:";"4";"2";"0";"indefinido";"1";"a";"(x^2-4)/(x-2) = (x+2)(x-2)/(x-2) = x+2. Quando x->2: 2+2 = 4.";""
"4416";"multipla";"Matematica";"Trigonometria";"Identidades trigonometricas";"Medio";"Vestibular";"2024";"O valor de sen^2(x) + cos^2(x) e sempre igual a:";"1";"0";"2";"sen(2x)";"cos(2x)";"a";"Esta e a identidade trigonometrica fundamental: sen^2(x) + cos^2(x) = 1.";""
"4417";"multipla";"Matematica";"Matrizes";"Determinante";"Medio";"Vestibular";"2024";"O determinante da matriz [[2,3],[1,4]] e:";"5";"8";"3";"11";"6";"a";"det = 2*4 - 3*1 = 8 - 3 = 5.";""
"4418";"multipla";"Matematica";"Geometria Analitica";"Equacao da circunferencia";"Dificil";"Vestibular";"2024";"A equacao da circunferencia de centro (2, -1) e raio 3 e:";"(x-2)^2 + (y+1)^2 = 9";"(x+2)^2 + (y-1)^2 = 9";"(x-2)^2 + (y-1)^2 = 3";"x^2 + y^2 = 9";"(x-2)^2 + (y+1)^2 = 3";"a";"A forma geral e (x-a)^2 + (y-b)^2 = r^2. Com centro (2,-1) e r=3: (x-2)^2 + (y+1)^2 = 9.";""
"4419";"multipla";"Matematica";"Numeros";"Divisibilidade";"Facil";"Vestibular";"2024";"Um numero e divisivel por 9 quando:";"A soma de seus algarismos e divisivel por 9";"Termina em 0 ou 9";"E par";"Termina em 9";"A soma dos algarismos e divisivel por 3";"a";"A regra de divisibilidade por 9: a soma dos algarismos deve ser divisivel por 9.";""
"4420";"multipla";"Fisica";"Mecanica";"Lancamento obliquo";"Dificil";"Vestibular";"2024";"No lancamento obliquo, no ponto mais alto da trajetoria, a velocidade vertical e:";"Zero";"Maxima";"Igual a velocidade horizontal";"Negativa";"Igual a velocidade inicial";"a";"No ponto mais alto, o objeto muda de subida para descida. Nesse instante, a componente vertical da velocidade e zero.";""
"4421";"multipla";"Fisica";"Eletricidade";"Lei de Ohm";"Facil";"Vestibular";"2024";"Segundo a Lei de Ohm, a tensao em um resistor e igual a:";"Resistencia multiplicada pela corrente";"Corrente dividida pela resistencia";"Resistencia dividida pela corrente";"Potencia dividida pela corrente";"Corrente ao quadrado vezes resistencia";"a";"Lei de Ohm: U = R*I. A tensao e igual a resistencia multiplicada pela corrente.";""
"4422";"multipla";"Fisica";"Termodinamica";"Maquina termica";"Dificil";"Vestibular";"2024";"A eficiencia de uma maquina de Carnot que opera entre 500 K e 300 K e:";"40%";"60%";"50%";"30%";"20%";"a";"Eficiencia de Carnot: n = 1 - Tf/Tq = 1 - 300/500 = 1 - 0,6 = 0,4 = 40%.";""
"4423";"multipla";"Fisica";"Ondas";"Efeito Doppler";"Dificil";"Vestibular";"2024";"Quando uma fonte sonora se aproxima de um observador estatico, a frequencia percebida pelo observador e:";"Maior que a frequencia da fonte";"Menor que a frequencia da fonte";"Igual a frequencia da fonte";"Zero";"Depende da amplitude";"a";"Pelo efeito Doppler, quando a fonte se aproxima do observador, as ondas se comprimem e o observador percebe uma frequencia maior.";""
"4424";"multipla";"Fisica";"Eletromagnetismo";"Inducao eletromagnetica";"Dificil";"Vestibular";"2024";"A lei de Faraday estabelece que a forca eletromotriz induzida em um circuito e proporcional a:";"Taxa de variacao do fluxo magnetico";"Intensidade do campo eletrico";"Resistencia do circuito";"Carga armazenada no capacitor";"Frequencia da corrente";"a";"Lei de Faraday: EMF = -dFi/dt. A FEM induzida e proporcional a taxa de variacao do fluxo magnetico.";""
"4425";"multipla";"Fisica";"Mecanica";"Momento angular";"Dificil";"Vestibular";"2024";"Uma bailarina gira com os bracos abertos. Ao fechar os bracos, sem atrito externo, sua velocidade angular:";"Aumenta";"Diminui";"Permanece constante";"Vai a zero";"Torna-se negativa";"a";"Pela conservacao do momento angular (L=I*w), ao fechar os bracos o momento de inercia I diminui, portanto a velocidade angular w aumenta.";""
"4426";"multipla";"Fisica";"Optica";"Cores da luz";"Facil";"Vestibular";"2024";"A cor da luz visivel com maior comprimento de onda e:";"Vermelho";"Violeta";"Azul";"Verde";"Amarelo";"a";"No espectro visivel, a luz vermelha tem maior comprimento de onda (aprox. 700 nm) e a violeta tem o menor (aprox. 400 nm).";""
"4427";"multipla";"Fisica";"Mecanica dos Fluidos";"Principio de Arquimedes";"Medio";"Vestibular";"2024";"Um objeto submerso em um fluido sofre um empuxo igual a:";"Peso do fluido deslocado";"Peso do objeto";"Pressao do fluido";"Volume do objeto";"Densidade do fluido";"a";"Principio de Arquimedes: o empuxo e igual ao peso do fluido deslocado pelo objeto: E = d_fluido * V_submerso * g.";""
"4428";"multipla";"Fisica";"Mecanica";"Energia potencial elastica";"Medio";"Vestibular";"2024";"A energia armazenada em uma mola com constante elastica k=200 N/m comprimida 0,1 m e:";"1 J";"2 J";"10 J";"20 J";"0,5 J";"a";"Ep = (1/2)*k*x^2 = (1/2)*200*(0,1)^2 = 100*0,01 = 1 J.";""
"4429";"multipla";"Fisica";"Eletricidade";"Potencial eletrico";"Dificil";"Vestibular";"2024";"O potencial eletrico e uma grandeza:";"Escalar";"Vetorial";"Tensorial";"Dependente da carga de prova";"Sempre negativa";"a";"O potencial eletrico e uma grandeza escalar (nao tem direcao), ao contrario do campo eletrico que e vetorial.";""
"4430";"multipla";"Quimica";"Quimica Organica";"Alcenos";"Facil";"Vestibular";"2024";"Os alcenos sao hidrocarbonetos que possuem em sua estrutura:";"Uma dupla ligacao entre carbonos";"Uma tripla ligacao entre carbonos";"Apenas ligacoes simples";"Um anel aromatico";"Dois aneis";"a";"Alcenos (ou olefinas) possuem pelo menos uma dupla ligacao entre carbonos. Sua formula geral e CnH2n.";""
"4431";"multipla";"Quimica";"Quimica Inorganica";"Acidos e bases";"Medio";"Vestibular";"2024";"Segundo Bronsted-Lowry, um acido e uma substancia que:";"Doa protons (H+)";"Aceita protons (H+)";"Doa eletrons";"Aceita eletrons";"Libera OH-";"a";"Na teoria de Bronsted-Lowry, acido e toda especie capaz de doar protons (H+) e base e toda especie capaz de aceitar protons.";""
"4432";"multipla";"Quimica";"Radioatividade";"Tipos de radiacao";"Medio";"Vestibular";"2024";"A radiacao que possui maior poder de penetracao e:";"Gama";"Alfa";"Beta";"Ultravioleta";"Infravermelho";"a";"A radiacao gama (ondas eletromagneticas) possui o maior poder de penetracao, sendo capaz de atravessar concreto e chumbo. A alfa tem o menor poder.";""
"4433";"multipla";"Quimica";"Solucoes";"pH";"Medio";"Vestibular";"2024";"Uma solucao com pH = 3 e considerada:";"Acida";"Basica";"Neutra";"Tampao";"Supersaturada";"a";"Solucoes com pH < 7 sao acidas, pH = 7 sao neutras e pH > 7 sao basicas. pH = 3 indica solucao acida.";""
"4434";"multipla";"Quimica";"Quimica Organica";"Alcinos";"Facil";"Vestibular";"2024";"O mais simples dos alcinos e o etino (acetileno), com formula:";"C2H2";"C2H4";"C2H6";"CH4";"C3H4";"a";"O etino (acetileno) tem formula C2H2: H-C≡C-H. Possui uma tripla ligacao entre os dois carbonos.";""
"4435";"multipla";"Quimica";"Eletroquimica";"Pilhas";"Dificil";"Vestibular";"2024";"Em uma pilha eletroquimica, a oxidacao ocorre no:";"Anodo";"Catodo";"Eletrodo inerte";"Ponte salina";"Eletrolitodo";"a";"No anodo ocorre a reacao de oxidacao (perda de eletrons). No catodo ocorre a reducao (ganho de eletrons).";""
"4436";"multipla";"Quimica";"Quimica Ambiental";"Chuva acida";"Medio";"Vestibular";"2024";"A chuva acida e causada principalmente pela presenca de quais gases na atmosfera?";"SO2 e NOx";"O2 e CO2";"N2 e H2";"CH4 e NH3";"Cl2 e F2";"a";"A chuva acida resulta da reacao de SO2 (dioxido de enxofre) e NOx (oxidos de nitrogenio) com a agua atmosferica, formando acidos sulfurico e nitrico.";""
"4437";"multipla";"Quimica";"Polimeros";"Polimerizacao";"Medio";"Vestibular";"2024";"O polietileno e obtido pela polimerizacao do:";"Eteno";"Propeno";"Etanol";"Benzeno";"Metanol";"a";"O polietileno (PE) e obtido pela polimerizacao de adicao do eteno (CH2=CH2), formando longas cadeias -[CH2-CH2]n-.";""
"4438";"multipla";"Quimica";"Quimica Inorganica";"Sais";"Facil";"Vestibular";"2024";"O cloreto de sodio (NaCl) e um exemplo de:";"Sal";"Acido";"Base";"Oxido";"Hidroxido";"a";"NaCl e um sal, resultado da reacao entre o acido cloridrico (HCl) e a base hidroxido de sodio (NaOH).";""
"4439";"multipla";"Quimica";"Modelo Atomico";"Distribuicao eletronica";"Medio";"Vestibular";"2024";"O elemento com numero atomico 11 (Sodio) possui quantos eletrons na camada de valencia?";"1";"2";"3";"7";"8";"a";"Na (Z=11) tem configuracao 1s2 2s2 2p6 3s1. Tem 1 eletron na ultima camada (3s1), portanto 1 eletron de valencia.";""
"4440";"multipla";"Biologia";"Evolucao";"Selecao natural";"Medio";"Vestibular";"2024";"O mecanismo central da teoria evolutiva de Darwin e Wallace e:";"Selecao natural";"Mutacao dirigida";"Heranca de caracteres adquiridos";"Deriva genetica";"Uso e desuso";"a";"A selecao natural e o mecanismo central do darwinismo: individuos com caracteristicas mais vantajosas sobrevivem e se reproduzem mais, transmitindo essas caracteristicas.";""
"4441";"multipla";"Biologia";"Genetica";"Mutacao";"Medio";"Vestibular";"2024";"A falcemia e causada por uma mutacao que altera:";"Um unico par de bases do DNA";"Um cromossomo inteiro";"O numero de cromossomos";"A estrutura da membrana";"O numero de mitocondrias";"a";"A anemia falciforme e causada por uma mutacao de ponto (substituicao de um unico nucleotideo) no gene da beta-globina da hemoglobina.";""
"4442";"multipla";"Biologia";"Ecologia";"Biomas brasileiros";"Facil";"Vestibular";"2024";"O Pantanal, considerado uma das maiores areas umidas do mundo, localiza-se principalmente no estado de:";"Mato Grosso do Sul e Mato Grosso";"Amazonas e Para";"Bahia e Minas Gerais";"Goias e Tocantins";"Rio Grande do Sul e Santa Catarina";"a";"O Pantanal se estende principalmente pelos estados de Mato Grosso do Sul e Mato Grosso, alem de partes da Bolivia e do Paraguai.";""
"4443";"multipla";"Biologia";"Fisiologia Humana";"Sistema nervoso";"Medio";"Vestibular";"2024";"O sistema nervoso autonomo e dividido em sistema simpatico e:";"Parassimpatico";"Somatico";"Central";"Periferico";"Enterico";"a";"O sistema nervoso autonomo regula funcoes involuntarias e se divide em sistema simpatico (reacao de luta ou fuga) e parassimpatico (descanso e digestao).";""
"4444";"multipla";"Biologia";"Citologia";"Mitocondria";"Medio";"Vestibular";"2024";"A mitocondria e o organulo responsavel pela:";"Respiracao celular aerobica";"Sintese de proteinas";"Fotossintese";"Digestao intracelular";"Divisao celular";"a";"A mitocondria e o organulo onde ocorre a respiracao celular aerobica, produzindo ATP atraves da fosforilacao oxidativa.";""
"4445";"multipla";"Biologia";"Botanica";"Angiospermas";"Facil";"Vestibular";"2024";"As angiospermas se diferenciam das gimnospermas por possuirem:";"Sementes envolvidas pelo fruto";"Sementes nuas (sem fruto)";"Ausencia de sementes";"Reproducao por esporos";"Ausencia de vasos condutores";"a";"Angiospermas possuem ovulo encerrado dentro de um ovario, que apos a fecundacao se torna o fruto contendo a semente.";""
"4446";"multipla";"Biologia";"Fisiologia Humana";"Sistema imunologico";"Medio";"Vestibular";"2024";"Os anticorpos sao proteinas produzidas por:";"Linfocitos B";"Linfocitos T";"Neutrofilos";"Eritrocitos";"Plaquetas";"a";"Os linfocitos B se diferenciam em plasmocitos, que produzem e secretam anticorpos (imunoglobulinas) especificos contra antigenos.";""
"4447";"multipla";"Biologia";"Ecologia";"Relacoes ecologicas";"Facil";"Vestibular";"2024";"A relacao entre o palhaço e a anemona-do-mar, em que ambos se beneficiam, e chamada de:";"Mutualismo";"Comensalismo";"Parasitismo";"Predatismo";"Amensalismo";"a";"O mutualismo e uma relacao harmonica interespecifica em que ambas as especies se beneficiam, como o peixe-palhaço e a anemona.";""
"4448";"multipla";"Biologia";"Bioquimica";"Lipidios";"Medio";"Vestibular";"2024";"Os triglicerideos sao formados pela uniao de glicerol com:";"Tres acidos graxos";"Dois acidos graxos";"Um acido graxo";"Tres aminoacidos";"Tres monossacarideos";"a";"Triglicerideos (gorduras neutras) sao formados pela uniao de uma molecula de glicerol com tres moleculas de acidos graxos, por meio de ligacoes ester.";""
"4449";"multipla";"Biologia";"Reproducao";"Meiose";"Medio";"Vestibular";"2024";"A meiose resulta na formacao de celulas com:";"Metade do numero de cromossomos (n)";"O mesmo numero de cromossomos (2n)";"O dobro de cromossomos (4n)";"Nenhum cromossomo";"Numero variavel de cromossomos";"a";"A meiose e uma divisao reducional: a celula diploide (2n) origina 4 celulas haploides (n), com metade do numero de cromossomos.";""
"4450";"multipla";"Historia";"Pre-Historia";"Neolitico";"Facil";"Vestibular";"2024";"A Revolucao Neolitica e marcada principalmente pelo surgimento da:";"Agricultura e pecuaria";"Escrita cuneiforme";"Metalurgia do ferro";"Democracia ateniense";"Rota da Seda";"a";"A Revolucao Neolitica (aproximadamente 10.000 a.C.) foi marcada pelo desenvolvimento da agricultura e da domesticacao de animais, permitindo o sedentarismo humano.";""
"4451";"multipla";"Historia";"Historia Antiga";"Grecia";"Medio";"Vestibular";"2024";"A batalha de Maratona (490 a.C.) foi um confronto entre gregos e:";"Persas";"Egipcios";"Romanos";"Macedonios";"Cartagineses";"a";"A batalha de Maratona foi um confronto das Guerras Medicas entre atenienses/plataicos e o Imperio Persa, resultando em vitoria grega.";""
"4452";"multipla";"Historia";"Historia Medieval";"Islam";"Medio";"Vestibular";"2024";"O islamismo foi fundado pelo profeta Maome no seculo VII d.C. O livro sagrado dos muculmanos e:";"Alcorao";"Biblia";"Tora";"Veda";"Upanixade";"a";"O Alcorao (Quran) e o livro sagrado do islamismo, considerado pelos muculmanos como a palavra de Alah revelada ao profeta Maome.";""
"4453";"multipla";"Historia";"Historia Moderna";"Reforma Protestante";"Medio";"Vestibular";"2024";"A Reforma Protestante foi iniciada em 1517 por:";"Martinho Lutero";"Joao Calvino";"Henrique VIII";"Ignacio de Loyola";"Zwinglio";"a";"Martinho Lutero iniciou a Reforma Protestante ao publicar as 95 Teses em 1517, questionando as praticas da Igreja Catolica, especialmente a venda de indulgencias.";""
"4454";"multipla";"Historia";"Historia do Brasil";"Brasil Colonial";"Medio";"Vestibular";"2024";"O sistema de capitanias hereditarias no Brasil Colonial foi implementado pelo rei portugues:";"Dom Joao III";"Dom Pedro I";"Dom Manuel I";"Dom Joao VI";"Dom Sebastiao";"a";"Dom Joao III criou o sistema de capitanias hereditarias em 1534 para colonizar o Brasil, dividindo o territorio em 15 lotes doados a donatarios.";""
"4455";"multipla";"Historia";"Historia Contemporanea";"ONU";"Facil";"Vestibular";"2024";"A Organizacao das Nacoes Unidas (ONU) foi fundada em:";"1945";"1919";"1939";"1948";"1950";"a";"A ONU foi fundada em 1945, apos o fim da Segunda Guerra Mundial, com o objetivo de promover a paz, a seguranca e a cooperacao internacional.";""
"4456";"multipla";"Geografia";"Geologia";"Placas tectonicas";"Medio";"Vestibular";"2024";"A teoria das placas tectonicas explica fenomenos como terremotos e vulcanismo. Quem propôs a teoria da deriva continental?";"Alfred Wegener";"Charles Darwin";"Alexander von Humboldt";"James Hutton";"Nicolas Steno";"a";"Alfred Wegener propôs a teoria da deriva continental em 1912, base da moderna teoria das placas tectonicas, explicando a movimentacao dos continentes.";""
"4457";"multipla";"Geografia";"Hidrografia";"Bacias hidrograficas";"Facil";"Vestibular";"2024";"A maior bacia hidrografica do mundo em area e a:";"Bacia Amazonica";"Bacia do Congo";"Bacia do Mississippi";"Bacia do Rio Nilo";"Bacia do Ob";"a";"A Bacia Amazonica e a maior bacia hidrografica do mundo, com cerca de 6 milhoes de km2, concentrando 20% da agua doce superficial do planeta.";""
"4458";"multipla";"Geografia";"Populacao";"Transicao demografica";"Medio";"Vestibular";"2024";"No modelo de transicao demografica, o estagio em que tanto as taxas de natalidade quanto de mortalidade sao baixas caracteriza:";"Populacoes desenvolvidas";"Populacoes em desenvolvimento";"Populacoes pre-industriais";"Populacoes em expansao acelerada";"Populacoes rurais";"a";"No 4o estagio da transicao demografica, ambas as taxas sao baixas, resultando em crescimento vegetativo proximo de zero, tipico de paises desenvolvidos.";""
"4459";"multipla";"Lingua Portuguesa";"Gramatica";"Pontuacao";"Medio";"Vestibular";"2024";"O ponto e virgula e utilizado principalmente para:";"Separar oracoes coordenadas que ja contem virgulas internas";"Indicar pausa curta entre palavras";"Encerrar um periodo";"Indicar citacao direta";"Substituir o ponto final";"a";"O ponto e virgula separa oracoes coordenadas de certa extensao ou que ja possuem virgulas internamente, indicando uma pausa maior que a virgula.";""
