"id";"tipo";"disc";"tema";"subtema";"dif";"fonte";"ano";"xp";"enunciado";"a";"b";"c";"d";"e";"ok";"exp"
"ENEM_2010_Q056";"multipla";"Biologia";"Gramática e Linguística";"Comprensión lectora";"Difícil";"ENEM";"2010";"20";"![](https://enem.dev/2010/questions/56/85dc7933-c9f1-46b8-8ca8-fee1d9ec8951.png)";"Pela circulação do magma no subsolo.";"Pelas erupções constantes dos vulcões.";"Pelo sol que aquece as águas com radiação ultravioleta.";"Pela queima do carvão e combustível fósseis.";"Pelos detritos e cinzas vulcânicas.";"a";"A resposta correta é a alternativa A. Pela circulação do magma no subsolo."
"ENEM_2010_Q057";"multipla";"Biologia";"Artes e Cultura";"Coesão e coerência";"Difícil";"ENEM";"2010";"20";"O despejo de dejetos de esgotos domésticos e industriais vem causando sérios problemas aos rios brasileiros. Esses poluentes são ricos em substâncias que contribuem para a eutrofização de ecossistemas, que é um enriquecimento da água por nutrientes, o que provoca um grande crescimento bacteriano e, por fim, pode promover escassez de oxigênio.";"Aquecer as águas dos rios para aumentar a velocidade de decomposição dos dejetos.";"Retirar do esgoto os materiais ricos em nutrientes para diminuir a sua concentração nos rios.";"Adicionar bactérias anaeróbicas às águas dos rios para que elas sobrevivam mesmo sem oxigênio.";"Substituir produtos não degradáveis por biodegradáveis para que as bactérias possam utilizar os nutrientes.";"Aumentar a solubilidade dos dejetos no esgoto para que os nutrientes fiquem mais acessíveis às bactérias.";"b";"A resposta correta é a alternativa B. Retirar do esgoto os materiais ricos em nutrientes para diminuir a sua concentração nos rios."
"ENEM_2010_Q058";"multipla";"Biologia";"Literatura Brasileira";"Romantismo";"Difícil";"ENEM";"2010";"20";"Sob pressão normal (ao nível do mar), a água entra em ebulição à temperatura de 100 °C. Tendo por base essa afirmação, um garoto residente em uma cidade litorânea fez a seguinte experiência: * – Colocou uma caneca metálica contendo água no fogareiro do fogão de sua casa. * – Quando a água começou a ferver, encostou, cuidadosamente, a extremidade mais estreita de uma seringa de injeção, desprovida de agulha, na superfície do líquido e, erguendo o êmbolo da seringa, aspirou certa quantidade de água para seu interior, tampando-a em seguida. * – Verificando após alguns instantes que a água da seringa havia parado de ferver, ele ergueu o êmbolo da seringa, constatando, intrigado, que a água voltou a ferver após um pequeno deslocamento do êmbolo.";"Permite a entrada de calor do ambiente externo para o interior da seringa.";"Provoca, por atrito, um aquecimento da água contida na seringa.";"Produz um aumento de volume que aumenta o ponto de ebulição da água.";"Proporciona uma queda de pressão no interior da seringa que diminui o ponto de ebulição da água.";"Possibilita uma diminuição da densidade da água que facilita sua ebulição.";"d";"A resposta correta é a alternativa D. Proporciona uma queda de pressão no interior da seringa que diminui o ponto de ebulição da água."
"ENEM_2010_Q059";"multipla";"Biologia";"Literatura Brasileira";"Romantismo";"Difícil";"ENEM";"2010";"20";"As cidades industrializadas produzem grandes proporções de gases como o CO2. o principal gás causador de efeito estufa. Isso ocorre por causa da quantidade de combustíveis fósseis queimados, principalmente no transporte, mas também em caldeiras industriais. Além disso, nessas cidades concentram-se as maiores áreas com solos asfaltados e concretados, o que aumenta a retenção de calor, formando o que se conhece por “ilhas de calor”. Tal fenômeno ocorre porque esses materiais absorvem o calor e o devolvem para o ar sob a forma de radiação térmica.";"Diminua devido a utilização de caldeiras por indústrias metalúrgicas.";"Aumente devido ao bloqueio da luz do sol pelos gases do efeito estufa.";"Diminua devido à não necessidade de aquecer a água utilizada em indústrias.";"Aumente devido à necessidade de maior refrigeração de indústrias e residências.";"Diminua devido à grande quantidade de radiação térmica reutilizada.";"d";"A resposta correta é a alternativa D. Aumente devido à necessidade de maior refrigeração de indústrias e residências."
"ENEM_2010_Q060";"multipla";"Biologia";"Língua Estrangeira (Inglês)";"Romantismo";"Difícil";"ENEM";"2010";"20";"A lavoura arrozeira na planície costeira da região sul do Brasil comumente sofre perdas elevadas devido a salinização da água de irrigação, que ocasiona prejuízos diretos, como a redução de produção da lavoura. Solos com processo de salinização avançado não são indicados, por exemplo, para o cultivo de arroz. As plantas retiram a água do solo quando as forças de embebição dos tecidos das raízes são superiores às forças com que a água é retida no solo. WINKEL, H.L.; TSCHIEDEL, M. Cultura do arroz: salinização de solos em cultivo do arroz. Disponível em: http://agropage.tripod.com/saliniza.hml. Acesso em: 25 jun. 2010 (adaptado).";"Aumento da salinidade, em que a água do solo atinge uma concentração de sais maior que a das células das raízes das plantas, impedindo, assim, que a água seja absorvida.";"Aumento da salinidade, em que o solo atinge um nível muito baixo de água, e as plantas não tem força de sucção para absorver a água.";"Diminuição da salinidade, que atinge um nível em que as plantas não têm força de sucção, fazendo com que a água não seja absorvida.";"Aumento da salinidade, que atinge um nível em que as plantas têm muita sudação, não tendo força de sucção para superá-la.";"Diminuição da salinidade, que atinge um nível em que as plantas ficam túrgidas e não têm força de sudação para superá-la.";"a";"A resposta correta é a alternativa A. Aumento da salinidade, em que a água do solo atinge uma concentração de sais maior que a das células das raízes das plantas, impedindo, assim, que a á..."
"ENEM_2010_Q061";"multipla";"Biologia";"Gramática e Linguística";"Análise sintática";"Difícil";"ENEM";"2010";"20";"No ano de 2000, um vazamento em um duto de óleo na baía de Guanabara (RJ) causou um dos maiores acidentes ambientais do Brasil. Além de afetar a fauna e a flora, o acidente abalou o equilíbrio da cadeia alimentar de toda a baía. O petróleo forma uma película na superfície da água, o que prejudica as trocas gasosas da atmosfera com a água e desfavorece a realização de fotossíntese pelas algas, que estão na base da cadeia alimentar hídrica. Além disso, o derramamento de óleo contribuiu para o envenenamento das árvores e, consequentemente, para a intoxicação da fauna e flora aquáticas, bem como conduziu à morte diversas espécies de animais, entre outras formas de vida, afetando também a atividade pesqueira. LAUBIER, L. Diversidade da Maré Negra. In: Scientific American Brasil. 4(39), ago. 2005 (adaptado).";"Indicam a independência da espécie humana com relação ao ambiente marinho.";"Alertam para a necessidade do controle da poluição ambiental para a redução do efeito estufa.";"Ilustram a interdependência das diversas formas de vida (animal, vegetal e outras) e o seu habitat.";"Indicam a alta resistência do meio ambiente à ação do homem, além de evidenciar a sua sustentabilidade mesmo em condições extremas de poluição.";"Evidenciam a grande capacidade animal de se adaptar às mudanças ambientais, em contraste com a baixa capacidade das espécies vegetais, que estão na base da cadeia alimentar hídrica.";"c";"A resposta correta é a alternativa C. Ilustram a interdependência das diversas formas de vida (animal, vegetal e outras) e o seu habitat."
"ENEM_2010_Q062";"multipla";"Biologia";"Interpretação e Produção de Texto";"Análise sintática";"Difícil";"ENEM";"2010";"20";"Para explicar a absorção de nutrientes, bem como a função das microvilosidades das membranas das células que revestem as paredes internas do intestino delgado, um estudante realizou o seguinte experimento: Colocou 200 ml de água em dois recipientes. No primeiro recipiente, mergulhou, por 5 segundos, um pedaço de papel liso, como na FIGURA 1; no segundo recipiente, fez o mesmo com um pedaço de papel com dobras simulando as microvilosidades, conforme FIGURA 2. Os dados obtidos foram: a quantidade de água absorvida pelo papel liso foi de 8 ml, enquanto pelo papel dobrado foi de 12 ml. ![](https://enem.dev/2010/questions/62/f2824040-a108-45f8-abec-1428dd63cba7.png)";"Manter o volume de absorção.";"Aumentar a superfície de absorção.";"Diminuir a velocidade de absorção.";"Aumentar o tempo da absorção.";"Manter a seletividade na absorção.";"b";"A resposta correta é a alternativa B. Aumentar a superfície de absorção."
"ENEM_2010_Q063";"multipla";"Biologia";"Língua Estrangeira (Espanhol)";"Modernismo";"Difícil";"ENEM";"2010";"20";"![](https://enem.dev/2010/questions/63/4f40bc17-01f3-4962-8574-593ac0409adb.jpg)";"Transforma energia química em energia elétrica, sem causar danos ao meio ambiente, porque o principal subproduto formado é a água.";"Converte a energia química contida nas moléculas dos componentes em energia térmica, sem que ocorra a produção de gases poluentes nocivos ao meio ambiente.";"Transforma energia química em energia elétrica, porém emite gases poluentes da mesma forma que a produção de energia a partir dos combustíveis fósseis.";"Converte energia elétrica proveniente dos combustíveis fósseis em energia química, retendo os gases poluentes produzidos no processo sem alterar a qualidade do meio ambiente.";"Converte a energia potencial acumulada nas moléculas de água contidas no sistema em energia química, sem que ocorra a produção de gases poluentes nocivos ao meio ambiente.";"a";"A resposta correta é a alternativa A. Transforma energia química em energia elétrica, sem causar danos ao meio ambiente, porque o principal subproduto formado é a água."
"ENEM_2010_Q064";"multipla";"Biologia";"Língua Estrangeira (Espanhol)";"Romantismo";"Difícil";"ENEM";"2010";"20";"Alguns anfíbios e répteis são adaptados à vida subterrânea. Nessa situação, apresentam algumas características corporais como, por exemplo, ausência de patas, corpo anelado que facilita o deslocamento no subsolo e, em alguns casos, ausência de olhos.";"As características citadas no texto foram originadas pela seleção natural.";"A ausência de olhos teria sido causada pela falta de uso dos mesmos, segundo a lei do uso e desuso.";"O corpo anelado é uma característica fortemente adaptativa, mas transmitida apenas à primeira geração de descendentes.";"As patas teriam sido perdidas pela falta de uso e, em seguida, essa característica foi incorporada ao patrimônio genético e então transmitidas aos descendentes.";"As características citadas no texto foram adquiridas por meio de mutações e depois, ao longo do tempo, foram selecionadas por serem mais adaptadas ao ambiente em que os organismos se encontram.";"b";"A resposta correta é a alternativa B. A ausência de olhos teria sido causada pela falta de uso dos mesmos, segundo a lei do uso e desuso."
"ENEM_2010_Q065";"multipla";"Biologia";"Língua Estrangeira (Inglês)";"Mídias digitais";"Difícil";"ENEM";"2010";"20";"As misturas efervescentes, em pó ou comprimidos, são comuns para a administração de vitamina C ou de medicamentos para azia. Essa forma farmacêutica sólida foi desenvolvida para facilitar o transporte, aumentar a estabilidade de substâncias e, quando em solução, acelerar a absorção do fármaco pelo organismo. As matérias primas que atuam na efervescência são, em geral, o ácido tartárico ou ácido cítrico que reagem como um sal de caráter básico, como o bicarbonato de sódio (NaHCO3), quando em contato com a água. A partir do contato da mistura efervescente com a água, ocorre uma série de reações químicas simultâneas: liberação de íons, formação de ácido e liberação de gás carbônico – gerando a efervescência. As equações a seguir representam as etapas da reação da mistura efervescente na água, em que foram omitidos os estados de agregação dos reagentes, e H3A representa o ácido cítrico. I – NaHCO3 → NA+ + HCO3 II – H2CO3 ↔H2O + CO2 III – HCO3 + H+ ↔ H2CO3 IV – H3A ↔ 3H+ + A−";"IV, I, II e III.";"I, IV, III e II.";"IV, III, I e II.";"I, IV, II e III.";"IV, I, III e II.";"e";"A resposta correta é a alternativa E. IV, I, III e II."
"ENEM_2010_Q066";"multipla";"Biologia";"Comunicação e Tecnologia";"Análise sintática";"Difícil";"ENEM";"2010";"20";"Um ambiente capaz de asfixiar todos os animais conhecidos do planeta foi colonizado por pelo menos três espécies diferentes de invertebrados marinhos. Descobertos a mais de 3.000 m de profundidade no Mediterrâneo, eles são os primeiros membros do reino animal a prosperar mesmo diante da ausência total de oxigênio. Até agora, achava-se que só bactérias pudessem ter esse estilo de vida. Não admira que os bichos pertençam a um grupo pouco conhecido, o dos loriciferos, que mal chegam a 1,0 mm. Apesar do tamanho, possuem cabeça, boca, sistema digestivo e carapaça. A adaptação dos bichos à vida no sufoco é tão profunda que suas células dispensaram as chamadas mitocôndrias. LOPES, R. J. Italianos descobrem animal que vive em água sem oxigênio. Disponível em: http://www1.folha.uol.com.br. Acesso em: 10 abr. 2010 (adaptado).";"S e CH4";"S e NO3-";"H2 e NO3-";"CO2 e CH4";"H2 e CO2";"b";"A resposta correta é a alternativa B. S e NO3-"
"ENEM_2010_Q067";"multipla";"Biologia";"Interpretação e Produção de Texto";"Comprensión lectora";"Difícil";"ENEM";"2010";"20";"O abastecimento de nossas necessidades energéticas futuras dependerá certamente do desenvolvimento de tecnologias para aproveitar a energia solar com maior eficiência. A energia solar é a maior fonte de energia mundial. Num dia ensolarado, por exemplo, aproximadamente 1 kJ de energia solar atinge cada metro quadrado de superfície terrestre por segundo. No entanto, o aproveitamento dessa energia é difícil porque ela é diluída (distribuída por uma área muito extensa) e oscila com o horário e as condições climáticas. O uso efetivo da energia solar depende de formas de estocar a energia coletada para o uso posterior. BROWN, T. **Química e Ciência Central**. São Paulo: Pearson Prentice Hall, 2005.";"Insatisfatória, pois a reação apresentada não permite que a energia presente no meio externo seja absorvida pelo sistema para ser utilizada posteriormente.";"Insatisfatória, uma vez que há formação de gases poluentes e com potencial poder explosivo, tornando-a uma reação perigosa e de difícil controle.";"Insatisfatória, uma vez que a a formação do gás CO que não possui conteúdo energético passível de ser aproveitado posteriormente e é considerado um gás poluente.";"Satisfatória, uma vez que a reação direta ocorre com absorção de calor e promove a formação das substâncias combustíveis que poderão ser utilizadas posteriormente para a obtenção de energia e realização de trabalho útil.";"Satisfatória, uma vez que a reação direta ocorre com liberação de calor havendo ainda a formação das substâncias combustíveis que poderão ser utilizadas posteriormente para a obtenção de energia a realização de trabalho útil.";"d";"A resposta correta é a alternativa D. Satisfatória, uma vez que a reação direta ocorre com absorção de calor e promove a formação das substâncias combustíveis que poderão ser utilizadas po..."
"ENEM_2010_Q068";"multipla";"Biologia";"Língua Estrangeira (Inglês)";"Romantismo";"Difícil";"ENEM";"2010";"20";"![](https://enem.dev/2010/questions/68/a0bb7b9d-65ff-4a3d-b370-d26ece33e59c.png)";"R$ 42,80.";"R$ 42,00.";"R$ 43,00.";"R$ 43,80.";"R$ 44,00.";"e";"A resposta correta é a alternativa E. R$ 44,00."
"ENEM_2010_Q069";"multipla";"Biologia";"Comunicação e Tecnologia";"Coesão e coerência";"Difícil";"ENEM";"2010";"20";"![](https://enem.dev/2010/questions/69/41751926-6bcd-405d-ad63-38c328db607d.jpg)";"Metanol, pois sua combustão completa fornece, aproximadamente, 22,7 kJ de energia por litro de combustível queimado.";"Etanol, pois sua combustão completa fornece, aproximadamente, 29,7 kJ de energia por litro de combustível queimado.";"Metanol, pois sua combustão completa fornece, aproximadamente, 17,9 MJ de energia por litro de combustível queimado.";"Etanol, pois sua combustão completa fornece, aproximadamente, 23,5 MJ de energia por litro de combustível queimado.";"Etanol, pois sua combustão completa fornece, aproximadamente, 33,7 MJ de energia por litro de combustível queimado.";"d";"A resposta correta é a alternativa D. Etanol, pois sua combustão completa fornece, aproximadamente, 23,5 MJ de energia por litro de combustível queimado."
"ENEM_2010_Q070";"multipla";"Biologia";"Literatura Brasileira";"Romantismo";"Difícil";"ENEM";"2010";"20";"![](https://enem.dev/2010/questions/70/30a85d80-8071-49b5-808d-4ed735bda2da.png)";"1.830 W.";"2.800 W.";"3.200 W.";"4.030 W.";"5.500 W.";"a";"A resposta correta é a alternativa A. 1.830 W."
"ENEM_2010_Q071";"multipla";"Biologia";"Gramática e Linguística";"Análise sintática";"Difícil";"ENEM";"2010";"20";"O uso prolongado de lentes de contato, sobretudo durante a noite, aliado a condições precárias de higiene representam fatores de risco para o aparecimento de uma infecção denominada ceratite microbiana, que causa ulceração inflamatória na córnea. Para interromper o processo da doença, é necessário tratamento antibiótico. De modo geral, os fatores de risco provocam a diminuição da oxigenação corneana e determinam mudanças no seu metabolismo, de um estado aeróbico para anaeróbico. Como decorrência, observa-se a diminuição no número e na velocidade de mitoses do epitélio, o que predispõe ao aparecimento de defeitos epiteliais e à invasão bacteriana. CRESTA, F. Lente de contato e infecção ocular. Revista Sinopse de Oftalmologia. São Paulo: Moreira Jr., v.04, n.04, 2002 (adaptado).";"A grande capacidade de adaptação, considerando as constantes mudanças no ambiente em que se reproduzem e o processo aeróbico como a melhor opção desses micro-organismos para a obtenção de energia.";"A grande capacidade de sofrer mutações, aumentando a probabilidade do aparecimento de formas resistentes e o processo anaeróbico da fermentação como a principal via de obtenção de energia.";"A diversidade morfológica entre as bactérias, aumentando a variedade de tipos de agentes infecciosos e a nutrição heterotrófica, como forma de esses micro-organismos obterem matéria-prima e energia.";"O alto poder de reprodução, aumentando a variabilidade genética dos milhares de indivíduos e a nutrição heterotrófica, como única forma de obtenção de matéria-prima e energia desses micro-organismos.";"O alto poder de reprodução, originando milhares de descendentes geneticamente idênticos entre si e a diversidade metabólica, considerando processos aeróbicos e anaeróbicos para a obtenção de energia.";"e";"A resposta correta é a alternativa E. O alto poder de reprodução, originando milhares de descendentes geneticamente idênticos entre si e a diversidade metabólica, considerando processos ae..."
"ENEM_2010_Q072";"multipla";"Biologia";"Comunicação e Tecnologia";"Análise sintática";"Difícil";"ENEM";"2010";"20";"Todos os organismos necessitam de água e grande parte deles vive em rios, lagos e oceanos. Os processos biológicos, como respiração e fotossíntese, exercem profunda influência na química das águas naturais em todo o planeta. O oxigênio é ator dominante na química e na bioquímica da hidrosfera. Devido a sua baixa solubilidade em água (9,0 mg/l a 20 °C) a disponibilidade de oxigênio nos ecossistemas aquáticos estabelece o limite entre a vida aeróbica e anaeróbica. Nesse contexto, um parâmetro chamado Demanda Bioquímica de Oxigênio (DBO) foi definido para medir a quantidade de matéria orgânica presente em um sistema hídrico. A DBO corresponde à massa de O2 em miligramas necessárias para realizar a oxidação total do carbono orgânico em um litro de água. **BAIRD, C. **Química Ambiental**. Ed. Bookmam, 2005 (adaptado).** Dados: Massas molares em g/mol: C = 12; H = 1; O = 16.";"0,4 mg de O2/litro";"1,7 mg de O2/litro";"2,7 mg de O2/litro";"9,4 mg de O2/litro";"10,7 mg de O2/litro";"e";"A resposta correta é a alternativa E. 10,7 mg de O2/litro"
"ENEM_2010_Q073";"multipla";"Biologia";"Literatura Portuguesa";"Modernismo";"Difícil";"ENEM";"2010";"20";"![](https://enem.dev/2010/questions/73/77d2c218-f8ec-4aba-83d2-701db70cdd89.jpg)";"1,7 kg.";"1,9 Kg.";"2,9 Kg.";"3,3 Kg.";"3,6 Kg.";"c";"A resposta correta é a alternativa C. 2,9 Kg."
"ENEM_2010_Q074";"multipla";"Biologia";"Língua Estrangeira (Inglês)";"Coesão e coerência";"Difícil";"ENEM";"2010";"20";"A eletrólise é muito empregada na indústria com o objetivo de reaproveitar parte dos metais sucateados. O cobre, por exemplo, é um dos metais com maior rendimento no processo de eletrólise, com uma recuperação de aproximadamente 99,9%. Por ser um metal de alto valor comercial e de múltiplas aplicações, sua recuperação torna-se viável economicamente.";"0,02 g";"0,04 g";"2,40 g";"35,5 g";"71,0 g";"d";"A resposta correta é a alternativa D. 35,5 g"
"ENEM_2010_Q075";"multipla";"Biologia";"Língua Estrangeira (Inglês)";"Mídias digitais";"Difícil";"ENEM";"2010";"20";"![](https://enem.dev/2010/questions/75/4cf500ff-ecc0-4f24-b1b2-a9055a92d633.jpg) Dois pesquisadores percorreram os trajetos marcados no mapa. A tarefa deles foi analisar os ecossistemas e, encontrando problemas, relatar e propor medidas de recuperação. A seguir, são reproduzidos trechos aleatórios extraídos dos relatórios desses dois pesquisadores. Trechos aleatórios extraídos do relatório do pesquisador P1: I. “Por causa da diminuição drástica das espécies vegetais deste ecossistema, como os pinheiros, a gralha azul também está em processo de extinção”. II. “As árvores de troncos tortuosos e cascas grossas que predominam nesse ecossistema estão sendo utilizadas em carvoarias”. Trechos aleatórios extraídos do relatório do pesquisador P2: III. “Das palmeiras que predominam nesta região podem ser extraídas substâncias importantes para a economia regional”, IV. “Apesar da aridez desta região, em que encontramos muitas plantas espinhosas, não se pode desprezar a sua biodiversidade”. Ecossistemas brasileiros: mapa de distribuição de ecossistemas. Disponível em: http://educacao.uol.com.br/ciencias/ult1686u52.jhtm. Acesso em: 20 abr. 2010 (adaptado).";"Caatinga, Cerrado, Zona dos Cocais e Floresta Amazônica.";"Mata de Araucárias, Cerrado, Zona dos Cocais e Caatinga.";"Manguezais, Zona dos Cocais, Cerrado e Mata Atlântica.";"Floresta Amazônica, Cerrado, Mata Atlântica e Pampas.";"Mata Atlântica, Cerrado, Zona dos Cocais e Pantanal.";"b";"A resposta correta é a alternativa B. Mata de Araucárias, Cerrado, Zona dos Cocais e Caatinga."
"ENEM_2010_Q076";"multipla";"Biologia";"Literatura Portuguesa";"Comprensión lectora";"Difícil";"ENEM";"2010";"20";"Investigadores das Universidades de Oxford e da Califórnia desenvolveram uma variedade de Aedes aegypti geneticamente modificada que é candidata para uso na busca de redução na transmissão do vírus da dengue. Nessa nova variedade de mosquito, as fêmeas não conseguem voar devido à interrupção do desenvolvimento do músculo das asas. A modificação genética introduzida é um gene dominante condicional, isso é, o gene tem expressão dominante (basta apenas uma cópia do alelo) e este só atua nas fêmeas. FU, G. et al. Female-specific flightless phenotype for mosquito control. PNAS 107 (10): 4550-4554, 2010.";"Diminuiria o sucesso reprodutivo desses machos transgênicos.";"Restringiria a área geográfica de voo dessa espécie de mosquito.";"Dificultaria a contaminação e reprodução do vetor natural da doença.";"Tornaria o mosquito menos resistente ao agente etiológico da doença.";"Dificultaria a obtenção de alimentos pelos machos geneticamente modificados.";"c";"A resposta correta é a alternativa C. Dificultaria a contaminação e reprodução do vetor natural da doença."
"ENEM_2010_Q077";"multipla";"Biologia";"Língua Estrangeira (Espanhol)";"Comprensión lectora";"Difícil";"ENEM";"2010";"20";"![](https://enem.dev/2010/questions/77/ccb7182d-278b-4d5d-9626-03df5e848ed4.jpg)";"Desidratação do ácido monofluoracético com liberação de água.";"Hidrólise do ácido monofluoracético sem formação de água.";"Perda de íons hidroxila do ácido monofluoracético, com liberação de hidróxido de sódio.";"Neutralização do ácido monofluoracético usando hidróxido de sódio, com liberação de água.";"Substituição dos íons hidrogênio por sódio na estrutura do ácido monofluoracético, sem formação de água.";"d";"A resposta correta é a alternativa D. Neutralização do ácido monofluoracético usando hidróxido de sódio, com liberação de água."
