"id";"tipo";"disc";"tema";"subtema";"dif";"fonte";"ano";"xp";"enunciado";"a";"b";"c";"d";"e";"ok";"exp"
"ENEM_2016_Q048";"multipla";"Biologia";"Literatura Brasileira";"Arte contemporânea";"Médio";"ENEM";"2016";"15";"![](https://enem.dev/2016/questions/48/ce6bddea-21d4-44b9-9683-36234b25cc12.jpg) A Figura 2 ilustra o Projeto Park Spark, desenvolvido em Cambridge, MA (EUA), em que as fezes dos animais domésticos são recolhidas em sacolas biodegradáveis e jogadas em um biodigestor instalado em parques públicos; e os produtos são utilizados em equipamentos no próprio parque. ![](https://enem.dev/2016/questions/48/29c36443-64d1-4747-85cb-c057dd8d39ed.jpg)";"Queima de gás metano.";"Armazenamento de gás carbônico.";"Decomposição aeróbica das fezes.";"Uso mais eficiente de combustíveis fósseis.";"Fixação de carbono em moléculas orgânicas.";"a";"A resposta correta é a alternativa A. Queima de gás metano."
"ENEM_2016_Q049";"multipla";"Biologia";"Literatura Brasileira";"Modernismo";"Médio";"ENEM";"2016";"15";"![](https://enem.dev/2016/questions/49/c694a7ba-780c-4ea0-aa71-df3cbe4a300a.png)";"[alternativa visual]";"[alternativa visual]";"[alternativa visual]";"[alternativa visual]";"[alternativa visual]";"d";"Gabarito oficial: alternativa D. Consulte a resolução completa no gabarito oficial do INEP."
"ENEM_2016_Q051";"multipla";"Biologia";"Interpretação e Produção de Texto";"Coesão e coerência";"Médio";"ENEM";"2016";"15";"Em meados de 2003, mais de 20 pessoas morreram no Brasil após terem ingerido uma suspensão de sulfato de bário utilizada como contraste em exames radiológicos. O sulfato de bário é um sólido pouquíssimo solúvel em água, que não se dissolve mesmo na presença de ácidos. As mortes ocorreram porque um laboratório farmacêutico forneceu o produto contaminado com carbonato de bário, que é solúvel em meio ácido. Um simples teste para verificar a existência de íons bário solúveis poderia ter evitado a tragédia. Esse teste consiste em tratar a amostra com solução aquosa de HCl e, após filtrar para separar os compostos insolúveis de bário, adiciona-se solução aquosa de H2SO4 sobre o filtrado e observa-se por 30 minutos TUBINO, M.; SIMONI, J.A. **Refletindo sobre o caso _celobar_®** Química Nova, n. 2, 2007 (adaptado).";"Liberação de calor.";"Alteração da cor para rosa.";"Precipitação de um sólido branco.";"Formação de gás hidrogênio.";"Volatilização de gás cloro.";"c";"A resposta correta é a alternativa C. Precipitação de um sólido branco."
"ENEM_2016_Q052";"multipla";"Biologia";"Interpretação e Produção de Texto";"Modernismo";"Médio";"ENEM";"2016";"15";"![](https://enem.dev/2016/questions/52/420bf048-0e4c-44bb-919d-ac9b6cba9a0b.png) O uso de feromônios em ações de controle de insetos-praga está de acordo com o modelo preconizado para a agricultura do futuro. São agentes altamente específicos e seus compostos químicos podem ser empregados em determinados cultivos, conforme ilustrado no quadro. ![](https://enem.dev/2016/questions/52/bda784c1-e142-4cdc-84dc-5ebc4a507431.png)";"Sitophilus spp.";"Migdolus fryanus.";"Anthonomus rubi.";"Grapholita molesta.";"Scrobipalpuloides absoluta.";"e";"A resposta correta é a alternativa E. Scrobipalpuloides absoluta."
"ENEM_2016_Q053";"multipla";"Biologia";"Artes e Cultura";"Comprensión lectora";"Médio";"ENEM";"2016";"15";"![](https://enem.dev/2016/questions/53/f5c532a3-9d64-4230-bdb5-98b3db576752.jpg)";"A glicose seja convertida em sacarose.";"As enzimas dessa planta sejam ativadas.";"A maceração favoreçа a solubilização em águа.";"O amido seja transformado em substratos utilizáveis pela levedura.";"Os grãos com diferentes composições químicas sejam padronizados.";"d";"A resposta correta é a alternativa D. O amido seja transformado em substratos utilizáveis pela levedura."
"ENEM_2016_Q055";"multipla";"Biologia";"Literatura Portuguesa";"Comprensión lectora";"Médio";"ENEM";"2016";"15";"![](https://enem.dev/2016/questions/55/474b0d3e-9bae-4e69-8198-0343720100a1.png) ![](https://enem.dev/2016/questions/55/5a400051-2ebf-4e92-a991-642277965dc2.png)";"Aumenta na faixa das frequências médias.";"Diminui na faixa das frequências agudas.";"Diminui na faixa das frequências graves.";"Aumenta na faixa das frequências médias altas.";"Aumenta na faixa das frequências médias baixas.";"c";"A resposta correta é a alternativa C. Diminui na faixa das frequências graves."
"ENEM_2016_Q056";"multipla";"Biologia";"Literatura Brasileira";"Romantismo";"Difícil";"ENEM";"2016";"20";"As proteínas de uma célula eucariótica possuem peptídeos sinais, que são sequências de aminoácidos responsáveis pelo seu endereçamento para as diferentes organelas, de acordo com suas funções. Um pesquisador desenvolveu uma nanopartícula capaz de carregar proteínas para dentro de tipos celulares específicos. Agora ele quer saber se uma nanopartícula carregada com uma proteína bloqueadora do ciclo de Krebs _in vitro_ é capaz de exercer sua atividade em uma célula cancerosa, podendo cortar o aporte energético e destruir essas células.";"Núcleo.";"Mitocôndria.";"Peroxissomo.";"Complexo golgiense.";"Retículo endoplasmático.";"b";"A resposta correta é a alternativa B. Mitocôndria."
"ENEM_2016_Q058";"multipla";"Biologia";"Interpretação e Produção de Texto";"Arte contemporânea";"Difícil";"ENEM";"2016";"20";"![](https://enem.dev/2016/questions/58/99a5812b-100d-4591-a496-2762c9cac26f.png) em que n corresponde ao número de mols. O metanol pode ser obtido pela reação entre brometo de metila e hidróxido de sódio, conforme a equação química: ![](https://enem.dev/2016/questions/58/e7997a8a-16ac-40aa-8909-dbbd285ffade.png)";"22%.";"40%.";"50%.";"67%.";"75%.";"d";"A resposta correta é a alternativa D. 67%."
"ENEM_2016_Q059";"multipla";"Biologia";"Língua Estrangeira (Espanhol)";"Arte contemporânea";"Difícil";"ENEM";"2016";"20";"Por apresentar significativa resistividade elétrica, o grafite pode ser utilizado para simular resistores elétricos em circuitos desenhados no papel, com o uso de lápis e lapiseiras. Dependendo da espessura e do comprimento das linhas desenhadas, é possível determinar a resistência elétrica de cada traçado produzido. No esquema foram utilizados três tipos de lápis diferentes (2H, HB e 6B) para efetuar três traçados distintos. ![](https://enem.dev/2016/questions/59/87747823-81f1-4892-b49e-862c699ea63b.png) Munido dessas informações, um estudante pegou uma folha de papel e fez o desenho de um sorvete de casquinha utilizando-se desses traçados. Os valores encontrados nesse experimento, para as resistências elétricas (R), medidas com o auxílio de um ohmímetro ligado nas extremidades das resistências, são mostrados na figura. Verificou-se que os resistores obedeciam à Lei de Ohm. ![](https://enem.dev/2016/questions/59/c3cf30b9-4fc9-45a6-955f-d0f99181dd7c.png)";"1";"4/7";"10/27";"14/81";"4/81";"b";"A resposta correta é a alternativa B. 4/7"
"ENEM_2016_Q061";"multipla";"Biologia";"Literatura Brasileira";"Análise sintática";"Difícil";"ENEM";"2016";"20";"![](https://enem.dev/2016/questions/61/0ebdcee7-9e70-490b-90de-f5702770667f.jpg) O pesquisador concluiu corretamente que os peixes controlam a densidade dos(as)";"Algas, estimulando seu crescimento.";"Cracas, predando especialmente animais pequenos.";"Mexilhões, predando especialmente animais pequenos.";"Quatro espécies testadas, predando indivíduos pequenos";"Ascídias, apesar de não representarem os menores organismos.";"c";"A resposta correta é a alternativa C. Mexilhões, predando especialmente animais pequenos."
"ENEM_2016_Q064";"multipla";"Biologia";"Literatura Portuguesa";"Modernismo";"Difícil";"ENEM";"2016";"20";"TEXTO I Biocélulas combustíveis são uma alternativa tecnológica para substituição das baterias convencionais. Em uma biocélula microbiológica, bactérias catalisam reações de oxidação de substratos orgânicos. Liberam elétrons produzidos na respiração celular para um eletrodo, onde fluem por um circuito elétrico até o cátodo do sistema, produzindo corrente elétrica. Uma reação típica que ocorre em biocélulas microbiológicas utiliza o acetato como substrato. AQUINO NETO, S. **Preparação e caracterização de bioanodos para biocélula a combustível etanol/O2** . Disponível em: www.teses.usp.br. Acesso em: 23 jun. 2015 (adaptado). TEXTO II Em sistemas bioeletroquímicos, os potenciais padrão (E°’) apresentam valores característicos. Para as biocélulas de acetato, considere as seguintes semirreações de redução e seus respectivos potenciais: 2 CO2 + 7H+ + 8e– → CH3COO– + 2H2O E°’ = -0,3 V O2 + 4H+ + 4e– → 2H2O E°’ = 0,8V. SCOTT, K.; YU, E. H. **Microbial electrochemical and fuel cells: fundamentals and applications**. Woodhead Publishing Series in Energy, n. 88, 2016 (adaptado).";"3";"4";"6";"9";"15";"b";"A resposta correta é a alternativa B. 4"
"ENEM_2016_Q065";"multipla";"Biologia";"Gramática e Linguística";"Comprensión lectora";"Difícil";"ENEM";"2016";"20";"A formação de coágulos sanguíneos em veias e artérias é um dos fatores responsáveis pela ocorrência de doenças cardiovasculares, como varizes, infarto e acidentes vasculares cerebrais. A prevenção e o tratamento dessas doenças podem ser feitos com drogas anticoagulantes. A indústria farmacêutica estimula a pesquisa de toxinas animais com essa propriedade.";"Moluscos fitófagos.";"Moscas saprófagas.";"Pássaros carnívoros.";"Morcegos frugívoros.";"Mosquitos hematófagos.";"e";"A resposta correta é a alternativa E. Mosquitos hematófagos."
"ENEM_2016_Q066";"multipla";"Biologia";"Artes e Cultura";"Modernismo";"Difícil";"ENEM";"2016";"20";"![](https://enem.dev/2016/questions/66/37f431da-a3ba-4a66-ac4b-c33f6d37730c.png) ![](https://enem.dev/2016/questions/66/9e38e644-e6b4-4128-9e76-a44227a87238.png)";"1.";"2.";"4.";"81.";"162.";"b";"A resposta correta é a alternativa B. 2."
"ENEM_2016_Q067";"multipla";"Biologia";"Artes e Cultura";"Coesão e coerência";"Difícil";"ENEM";"2016";"20";"Primeiro, em relação àquilo a que chamamos água, quando congela, parece-nos estar a olhar para algo que se tornou pedra ou terra, mas quando derrete e se dispersa, esta torna-se bafo e ar; o ar, quando é queimado, torna-se fogo; e, inversamente, o fogo, quando se contrai e se extingue, regressa à forma do ar; o ar, novamente concentrado e contraído, torna-se nuvem e nevoeiro, mas, a partir destes estados, se for ainda mais comprimido, torna-se água corrente, e de água torna-se novamente terra e pedras; e deste modo, como nos parece, dão geração uns aos outros de forma cíclica. PLATÃO. **Timeu-Crítias**. Coimbra: CECH, 2011. Do ponto de vista da ciência moderna, os “quatro elementos” descritos por Platão correspondem, na verdade, às fases sólida, líquida, gasosa e plasma da matéria. As transições entre elas são hoje entendidas como consequências macroscópicas de transformações sofridas pela matéria em escala microscópica.";"Troca de átomos entre as diferentes moléculas do material.";"Transmutação nuclear dos elementos químicos do material.";"Redistribuição de prótons entre os diferentes átomos do material.";"Mudança na estrutura espacial formada pelos diferentes constituintes do material.";"Alteração nas proporções dos diferentes isótopos de cada elemento presente no material.";"d";"A resposta correta é a alternativa D. Mudança na estrutura espacial formada pelos diferentes constituintes do material."
"ENEM_2016_Q068";"multipla";"Biologia";"Língua Estrangeira (Inglês)";"Arte contemporânea";"Difícil";"ENEM";"2016";"20";"Para cada litro de etanol produzido em uma indústria de cana-de-açúcar são gerados cerca de 18 L de vinhaça que é utilizada na irrigação das plantações de cana-de-açúcar, já que contém teores médios de nutrientes N, P e K iguais a 357 mg/L, 60 mg/L e 2 034 mg/L, respectivamente. SILVA, M. A. S.; GRIEBELER, N. P.; BORGES, L. C. Uso de vinhaça e impactos nas propriedades do solo e lençol freático. **Revista Brasileira de Engenharia Agrícola e Ambiental**, n. 1, 2007 (adaptado).";"1.";"29.";"60.";"170.";"1000.";"b";"A resposta correta é a alternativa B. 29."
"ENEM_2016_Q069";"multipla";"Biologia";"Literatura Brasileira";"Mídias digitais";"Difícil";"ENEM";"2016";"20";"Recentemente um estudo feito em campos de trigo mostrou que níveis elevados do dióxido de carbono na atmosfera prejudicam a absorção de nitrato pelas plantas. Consequentemente, a qualidade nutricional desses alimentos pode diminuir à medida que os níveis de dióxido de carbono na atmosfera atingirem as estimativas para as próximas décadas. Bloom, A J et al. Nitrate assimilation is inhibited by elevated CO2 in field grown wheat. **Nature Climate Change**, n. 4., abr 2014, adaptado.";"Amido.";"Frutose.";"Lipídeos.";"Celulose.";"Proteínas.";"e";"A resposta correta é a alternativa E. Proteínas."
"ENEM_2016_Q070";"multipla";"Biologia";"Língua Estrangeira (Espanhol)";"Análise sintática";"Difícil";"ENEM";"2016";"20";"Pesquisadores recuperaram DNA de ossos de mamute (_Mammuthus primigenius_) encontrados na Sibéria, que tiveram sua idade de cerca de 28 mil anos confirmada pela técnica do carbono-14. FAPESP. **DNA de mamute é revelado**. Disponível em: http://agencia.fapesp.br. Acesso em: 13 ago. 2012 (adaptado).";"Proporção conhecida entre carbono-14 e carbono-12 na atmosfera ao longo dos anos.";"Decomposição de todo o carbono-12 presente no organismo após a morte.";"Fixação maior do carbono-14 nos tecidos de organismos após a morte.";"Emissão de carbono-12 pelos tecidos de organismos após a morte.";"Transformação do carbono-12 em carbono-14 ao longo dos anos.";"a";"A resposta correta é a alternativa A. Proporção conhecida entre carbono-14 e carbono-12 na atmosfera ao longo dos anos."
"ENEM_2016_Q071";"multipla";"Biologia";"Literatura Brasileira";"Modernismo";"Difícil";"ENEM";"2016";"20";"A vegetação apresenta adaptações ao ambiente, como plantas arbóreas e arbustivas com raízes que se expandem horizontalmente, permitindo forte ancoragem no substrato lamacento; raízes que se expandem verticalmente, por causa da baixa oxigenação do substrato; folhas que têm glândulas para eliminar o excesso de sais; folhas que podem apresentar cutícula espessa para reduzir a perda de água por evaporação.";"Cerrado.";"Pampas.";"Pantanal.";"Manguezal.";"Mata de Cocais.";"d";"A resposta correta é a alternativa D. Manguezal."
"ENEM_2016_Q072";"multipla";"Biologia";"Literatura Portuguesa";"Reading comprehension";"Difícil";"ENEM";"2016";"20";"Uma pessoa é responsável pela manutenção de uma sauna úmida. Todos os dias cumpre o mesmo ritual: colhe folhas de capim-cidreira e algumas folhas de eucalipto. Em seguida, coloca as folhas na saída do vapor da sauna, aromatizando-a, conforme mostrado na figura. ![](https://enem.dev/2016/questions/72/99b15188-22b8-4a01-a936-bb8307f50c4c.png)";"Filtração simples.";"Destilação simples.";"Extração por arraste.";"Sublimação fracionada.";"Decantação sólido-líquido.";"c";"A resposta correta é a alternativa C. Extração por arraste."
"ENEM_2016_Q073";"multipla";"Biologia";"Interpretação e Produção de Texto";"Arte contemporânea";"Difícil";"ENEM";"2016";"20";"Os ecossistemas degradados por intensa atividade agrícola apresentam geralmente, diminuição de sua a estabilidade. Nesse contexto, o uso integrado de árvores aos sistemas agrícolas (sistemas agroflorestais) pode cumprir um papel inovador ao buscar a aceleração do processo sucessional e, ao mesmo tempo, uma produção escalonada e diversificada. Disponível em: saf.cnpgc.embrapa.br. Acesso em 21 jan. 2012 (adaptado)";"Substitui gradativamente as espécies cultiváveis por espécies arbóreas.";"Intensifica a fertilização do solo com o uso de técnicas apropriadas e biocidas.";"Promove maior diversidade de vida no solo como aumento da matéria orgânica.";"Favorece a dispersão das sementes cultivadas pela fauna residente nas áreas florestais.";"Cria condições para o estabelecimento de espécies pioneiras com a diminuição da insolação sobre o solo.";"c";"A resposta correta é a alternativa C. Promove maior diversidade de vida no solo como aumento da matéria orgânica."
"ENEM_2016_Q074";"multipla";"Biologia";"Literatura Brasileira";"Modernismo";"Difícil";"ENEM";"2016";"20";"![](https://enem.dev/2016/questions/74/de112a65-c255-4b68-956d-be2ec557351d.png)";"IA = IE e IC = ID.";"IA = IB = IE e IC = ID.";"IA = IB, apenas.";"IA = IB = IE, apenas.";"IC = IB, apenas.";"a";"A resposta correta é a alternativa A. IA = IE e IC = ID."
"ENEM_2016_Q075";"multipla";"Biologia";"Literatura Brasileira";"Coesão e coerência";"Difícil";"ENEM";"2016";"20";"![](https://enem.dev/2016/questions/75/dd153eb4-697f-4e0b-ab99-0590c6301cd3.jpg)";"Gutação.";"Gravidade.";"Respiração.";"Fotossíntese.";"Transpiração.";"e";"A resposta correta é a alternativa E. Transpiração."
"ENEM_2016_Q076";"multipla";"Biologia";"Língua Estrangeira (Inglês)";"Coesão e coerência";"Difícil";"ENEM";"2016";"20";"![](https://enem.dev/2016/questions/76/d04791bb-ac0a-454a-b9c3-d52906fd5345.png)";"Éter.";"Éster.";"Álcool.";"Haleto.";"Hidrocarboneto.";"a";"A resposta correta é a alternativa A. Éter."
"ENEM_2016_Q077";"multipla";"Biologia";"Literatura Brasileira";"Coesão e coerência";"Difícil";"ENEM";"2016";"20";"![](https://enem.dev/2016/questions/77/49b1ba7f-e030-4a6f-a45b-904746c94fec.png) ![](https://enem.dev/2016/questions/77/e6446caa-3305-4442-841d-2fd1af3e86d0.png)";"50,0 g";"250,0 g";"300,0 g";"450,0 g";"600,0 g";"c";"A resposta correta é a alternativa C. 300,0 g"
"ENEM_2016_Q078";"multipla";"Biologia";"Interpretação e Produção de Texto";"Modernismo";"Difícil";"ENEM";"2016";"20";"![](https://enem.dev/2016/questions/78/07838468-d80e-4417-9c08-a5700e6f32ed.png)";"Fenol.";"Piridina.";"Metilamina.";"Hidrogenofosfato de potássio.";"Hidrogenosulfato de potássio.";"d";"A resposta correta é a alternativa D. Hidrogenofosfato de potássio."
"ENEM_2016_Q079";"multipla";"Sociologia";"Artes e Cultura";"Romantismo";"Difícil";"ENEM";"2016";"20";"Vários métodos são empregados para prevenção de infecções por microrganismos. Dois desses métodos utilizam microrganismos vivos e são eles: as vacinas atenuadas, constituidas por patógenos avirulentos, e os probióticos que contém bactérias benéficas. Na figura são apresentados cinco diferentes mecanismos de exclusão de patógenos pela ação dos probióticos no intestino de um animal. ![](https://enem.dev/2016/questions/79/0716200b-a539-4ee2-937d-3ba40b15b4b4.jpg)";"5";"4";"3";"2";"1";"b";"A resposta correta é a alternativa B. 4"
"ENEM_2016_Q080";"multipla";"Biologia";"Língua Estrangeira (Inglês)";"Modernismo";"Difícil";"ENEM";"2016";"20";"O Painel Intergovernamental de Mudanças Climáticas (na sigla em inglês, IPCC) prevê que nas próximas décadas o planeta passará por mudanças climáticas e propõe estratégias de mitigação e adaptação a elas. As _estratégias de mitigação_ são direcionadas à causa dessas mudanças, procurando reduzir a concentração de gases de efeito estufa na atmosfera. As _estratégias de adaptação_, por sua vez, são direcionadas aos efeitos dessas mudanças, procurando preparar os sistemas humanos às mudanças climáticas já em andamento, de modo a reduzir seus efeitos negativos. IPCC, 2014. **Climate Change 2014: synthesis report**. Disponível em: http://w5-syr.ipcc.ch. Acesso em: 22 out 2015 (adaptado)";"Construção de usinas eólicas.";"Tratamento de resíduos sólidos.";"Aumento da eficiência dos veículos.";"Adoção de agricultura sustentável de baixo carbono.";"Criação de diques de contenção em regiões costeiras.";"e";"A resposta correta é a alternativa E. Criação de diques de contenção em regiões costeiras."
"ENEM_2016_Q081";"multipla";"Biologia";"Gramática e Linguística";"Comprensión lectora";"Médio";"ENEM";"2016";"15";"![](https://enem.dev/2016/questions/81/fab74d42-ab21-42bc-bc5f-ed99d86be779.png)";"Menor e menor que a lipofilia da testosterona.";"Menor e maior que a lipofilia da testosterona.";"Maior e menor que a lipofilia da testosterona.";"Maior e maior que a lipofilia da testosterona.";"Menor e igual que a lipofilia da testosterona.";"d";"A resposta correta é a alternativa D. Maior e maior que a lipofilia da testosterona."
"ENEM_2016_Q082";"multipla";"Biologia";"Língua Estrangeira (Inglês)";"Reading comprehension";"Médio";"ENEM";"2016";"15";"![](https://enem.dev/2016/questions/82/d1fcf538-6917-4172-95f2-3c3e2f874aa5.png)";"3.";"6.";"7.";"8.";"10.";"b";"A resposta correta é a alternativa B. 6."
"ENEM_2016_Q083";"multipla";"Biologia";"Artes e Cultura";"Coesão e coerência";"Médio";"ENEM";"2016";"15";"O Brasil possui um grande número de espécies distintas entre animais, vegetais e microrganismos envoltos em uma imensa complexidade e distribuídas em uma grande variedade de ecossistemas. SANDES, A R. R. BLASI, G. **Biodiversidade e diversidade química e genética**. Disponível em: http://novastecnologias.com.br. Acesso em 22 set 2015 (adaptado).";"Produção de indivíduos mais férteis.";"Transmissão de novas características adquiridas.";"Recombinação genética na formação dos gametas.";"Ocorrência de mutações somáticas nos descendentes.";"Variação do número de cromossomos característico da espécie.";"c";"A resposta correta é a alternativa C. Recombinação genética na formação dos gametas."
"ENEM_2016_Q085";"multipla";"Biologia";"Gramática e Linguística";"Comprensión lectora";"Médio";"ENEM";"2016";"15";"![](https://enem.dev/2016/questions/85/905b1535-8032-4140-b20e-0f06b840ed90.png)";"[alternativa visual]";"[alternativa visual]";"[alternativa visual]";"[alternativa visual]";"[alternativa visual]";"c";"Gabarito oficial: alternativa C. Consulte a resolução completa no gabarito oficial do INEP."
"ENEM_2016_Q086";"multipla";"Biologia";"Comunicação e Tecnologia";"Reading comprehension";"Médio";"ENEM";"2016";"15";"![](https://enem.dev/2016/questions/86/52add56c-e390-4125-8e61-d553591f9b1c.png)";"I e III";"I e V";"II e III";"II e IV";"II e V";"a";"A resposta correta é a alternativa A. I e III"
"ENEM_2016_Q089";"multipla";"Biologia";"Literatura Brasileira";"Mídias digitais";"Médio";"ENEM";"2016";"15";"O aquecimento de um material por irradiação com micro-ondas ocorre por causa da interação da onda eletromagnética com o dipolo elétrico da molécula. Um importante atributo do aquecimento por micro-ondas é a absorção direta da energia pelo material a ser aquecido. Assim, esse aquecimento é seletivo e dependerá, principalmente, da constante dielétrica e da frequência de relaxação do material. O gráfico mostra a taxa de aquecimento de cinco solventes sob irradiação de micro-ondas. BARBOZA, A. C. R. N. et al. Aquecimento em forno de micro-ondas. Desenvolvimento de alguns conceitos fundamentais. **Química Nova**, n. 6, 2001 (adaptado). ![](https://enem.dev/2016/questions/89/89686e55-7f2b-41cc-9c53-3c0f26b581a6.png)";"H2O";"CH3OH";"CH3CH2OH";"CH3CH2CH2OH";"CH3CH2CH2CH2CH2CH3";"e";"A resposta correta é a alternativa E. CH3CH2CH2CH2CH2CH3"
"ENEM_2016_Q091";"multipla";"Inglês";"Língua Estrangeira (Inglês)";"Arte contemporânea";"Médio";"ENEM";"2016";"15";"La Sala II de la Cámara de Casación Penal ordenó que Marcela y Felipe Noble Herrera, los hijos adoptivos de la duena de Clarín, se sometan “a la extracción directa, con o sin consentimiento, de mínimas muestras de sangre, saliva, piei, cabello u otras muestras biológicas” que les pertenezcan de “manera indubitable” para poder determinar si son hijos de desaparecidos. El tribunal, así, hizo lugar a un reclamo de las Abuelas de Plaza de Mayo y movió un casillero una causa judicial que ya lleva diez anos de indefinición. Sin embargo, simultáneamente, fijó un limite y sólo habilito la comparación de los perfiles genéticos de los jóvenes con el ADN de las familias de personas “detenidas o desaparecidas con certeza” hasta el 13 de mayo de 1976, en el caso de Marcela, y hasta el 7 de julio del mismo ano en el de Felipe. La obtención del material genético no será inmediata, ya que algunas de las partes apelarán y el tema inevitablemente desembocará a la Corte Suprema, que tendrá la palabra final sobre la discusión de fondo. “Es una de cal y otra de arena, es querer quedar bien con Dios y con el diablo”, resumió la presidenta de Abuelas, Estela Carlotto, su primera impresión de la resolución que firmaron Guillermo Yacobucci, Luis García y Raúl Madueño. Aun así la evaluó como “un paso importante” porque determina que “sí o sí la extracción de sangre o de elementos que contengan ADN debe proceder”. “Lo que nos cayó mal”, acotó, es “la limitación” temporal que permitirá que la comparación se haga sólo con un grupo de familias. “Seguimos con la historia de que acá hay de primera y de segunda. Por qué todos los demás casos siempre se han comparado con el Banco (de Datos Genéticos) completo y en éste no?”, se preguntó. HAUSER, I. Disponível em: www.pagina12.com.ar. Acesso em: 30 maio 2016.";"Referir-se ao fato de a decisão judicial não implicar a sua imediata aplicação.";"Destacar a inevitável execução da sentença.";"Ironizar a parcialidade da Justiça nessa ação";"Criticar a coleta compulsória do material genético.";"Enfatizar a determinação judicial como algo consolidado.";"c";"A resposta correta é a alternativa C. Ironizar a parcialidade da Justiça nessa ação"
