"id";"tipo";"disciplina";"tema";"subtema";"dificuldade";"fonte";"ano";"enunciado";"alternativa_a";"alternativa_b";"alternativa_c";"alternativa_d";"alternativa_e";"resposta_correta";"explicacao";"resposta"
"4201";"dissertativa";"Matemática";"Álgebra";"Binômio de Newton";"Médio";"Vestibular";"2024";"Expanda (x + 2)³ usando o Binômio de Newton e verifique o resultado.";"";"";"";"";"";"";"(x+2)³ = C(3,0)x³(2⁰) + C(3,1)x²(2¹) + C(3,2)x¹(2²) + C(3,3)x⁰(2³) = x³ + 3×2x² + 3×4x + 8 = x³ + 6x² + 12x + 8. Verificação: (x+2)³ = (x+2)(x+2)² = (x+2)(x²+4x+4) = x³+4x²+4x+2x²+8x+8 = x³+6x²+12x+8 ✓";"x³ + 6x² + 12x + 8"
"4202";"dissertativa";"Física";"Estática dos fluidos";"Vasos comunicantes";"Médio";"Vestibular";"2023";"Explique o princípio dos vasos comunicantes e cite duas aplicações práticas no cotidiano ou na engenharia.";"";"";"";"";"";"";"Vasos comunicantes: quando dois recipientes são conectados por um tubo, o líquido se nivela na mesma altura quando em equilíbrio (mesma pressão na base). P = d×g×h é igual para ambos os lados. Aplicações: (1) Nível de água em caixas-d'água e sistemas de encanamento — a água flui pelo nível sem bomba; (2) Manômetro de coluna de líquido (tubo em U) — mede diferença de pressão pela diferença de altura dos lados.";"Vasos comunicantes: líquido se nivela na mesma altura. Apps: encanamento, manômetro em U"
"4203";"dissertativa";"Química";"Orgânica";"Carboidratos — açúcares";"Médio";"Vestibular";"2024";"Compare sacarose, glicose e frutose: estrutura química, doçura relativa e como o organismo os metaboliza.";"";"";"";"";"";"";"Glicose (C₆H₁₂O₆): monossacarídeo, aldose, combustível celular direto. Frutose (C₆H₁₂O₆): isômero da glicose, cetose, mais doce que a glicose. Sacarose (C₁₂H₂₂O₁₁): dissacarídeo (glicose + frutose) ligados por ligação glicosídica — açúcar de mesa. Doçura: frutose > sacarose > glicose. Metabolismo: sacarose é hidrolisada pela sacarase intestinal em glicose+frutose; glicose entra diretamente na glicólise; frutose é metabolizada principalmente no fígado (pode ser convertida em triglicerídeos em excesso).";"Sacarose = glicose+frutose; frutose > sacarose > glicose em doçura; sacarose hidrolisada no intestino"
"4204";"dissertativa";"Biologia";"Virologia";"Ciclo viral lítico e lisogênico";"Médio";"Vestibular";"2023";"Compare os ciclos lítico e lisogênico dos bacteriófagos, explicando como cada um ocorre e qual a importância do ciclo lisogênico para a evolução bacteriana.";"";"";"";"";"";"";"Ciclo lítico: o fago injeta DNA na bactéria → DNA viral dirige a célula para produzir novos fagos → lise celular (morte da bactéria) libera centenas de fagos. Ciclo lisogênico: o DNA viral integra-se ao cromossomo bacteriano como profago → replica junto com a bactéria sem causar dano imediato → um estímulo (UV, etc.) pode induzir o ciclo lítico. Importância evolutiva: transferência horizontal de genes (transdução) — o profago pode carrear genes bacterianos para outras bactérias; contribui para diversidade e resistência bacteriana; origem de ilhas de patogenicidade.";"Lítico: produção rápida → lise. Lisogênico: profago integrado → transdução e evolução bacteriana"
"4205";"dissertativa";"Português";"Gramática";"Funções da linguagem";"Fácil";"Vestibular";"2024";"Cite e explique as seis funções da linguagem de Roman Jakobson, identificando qual é predominante em um poema lírico, em uma campanha publicitária e em um dicionário.";"";"";"";"";"";"";"Funções: (1) Referencial (denotativa): foco na mensagem/contexto, informar — dominante em notícias, dicionários. (2) Emotiva (expressiva): foco no emissor, expressar sentimentos — dominante em poesia lírica. (3) Conativa (apelativa): foco no receptor, persuadir — dominante em publicidade, ordens. (4) Fática: foco no canal, manter contato — 'alô?'. (5) Metalinguística: foco no código — definir palavras (dicionário). (6) Poética: foco na própria mensagem, estética — poesia. Poema lírico: poética/emotiva. Publicidade: conativa. Dicionário: referencial/metalinguística.";"Poema: emotiva/poética. Publicidade: conativa. Dicionário: referencial/metalinguística"
"4206";"dissertativa";"Filosofia";"Filosofia da religião";"Provas da existência de Deus";"Difícil";"Vestibular";"2023";"Explique o argumento ontológico de Anselmo de Cantuária para a existência de Deus e a crítica de Kant a esse argumento.";"";"";"";"";"";"";"Anselmo (séc. XI): 'Deus é aquilo maior do que o qual nada pode ser concebido' (id quo maius cogitari nequit). Se Deus existe apenas na mente e não na realidade, poderia conceber algo maior (com existência real). Logo, Deus deve existir na realidade. Crítica de Kant: a existência não é um predicado real — não acrescenta nada ao conceito. Passar do conceito de Deus para sua existência real é um salto lógico ilegítimo. 'Cem táleres reais não diferem em conceito de cem táleres imaginários, mas diferem radicalmente em relação ao meu bolso.'";"Anselmo: Deus maior que qualquer concebível → deve existir. Kant: existência não é predicado; salto conceito→realidade é ilegítimo"
"4207";"dissertativa";"Sociologia";"Direito";"Acesso à justiça";"Médio";"Vestibular";"2024";"Analise os obstáculos ao acesso à justiça no Brasil, considerando aspectos econômicos, geográficos e culturais, e discuta o papel da Defensoria Pública.";"";"";"";"";"";"";"Obstáculos econômicos: custas processuais, honorários advocatícios, tempo do processo (prejudica mais os pobres). Geográficos: concentração de tribunais nas capitais; localidades remotas sem estrutura judiciária. Culturais: desconhecimento dos direitos; linguagem jurídica inacessível; medo das instituições. A Defensoria Pública (garantida pela CF/88): fornece assistência jurídica gratuita aos hipossuficientes; garantia constitucional do acesso à justiça; ainda subdotada em muitos estados. Desafios: demanda reprimida enorme, poucos defensores por habitante, especialmente no Norte/Nordeste.";"Obstáculos: custas, distância, linguagem jurídica. Defensoria Pública: assistência gratuita, mas subdotada"
"4208";"dissertativa";"Literatura";"Literatura Portuguesa";"Saramago";"Médio";"Vestibular";"2023";"Em 'Ensaio Sobre a Cegueira' de José Saramago, analise a cegueira como metáfora social e as estratégias narrativas inovadoras do autor.";"";"";"";"";"";"";"A cegueira branca epidêmica de Saramago é metáfora da irresponsabilidade social, do egoísmo humano e da barbárie que emerge quando as estruturas civilizacionais colapsam. Os 'cegos' perdem humanidade progressivamente — exceção à mulher do médico (única que enxerga). Crítica à indiferença social, ao Estado que aprisona ao invés de ajudar. Estratégias narrativas: pontuação atípica (períodos longos sem parágrafo), diálogos sem aspas ou identificação, narrador onisciente irônico, personagens sem nomes (o médico, a mulher, a rapariga). Cria efeito de fluxo caótico que espelha a desorientação dos cegos.";"Cegueira = egoísmo/barbárie humana. Estilo: pontuação incomum, sem aspas, personagens sem nome, narrador irônico"
"4209";"dissertativa";"Matemática";"Números complexos";"Forma trigonométrica";"Médio";"Vestibular";"2024";"O número complexo z = 1 + √3 i pode ser escrito na forma trigonométrica z = r(cosθ + i senθ). Determine r e θ.";"";"";"";"";"";"";"r = |z| = √(1² + (√3)²) = √(1+3) = √4 = 2. θ = arctan(√3/1) = arctan(√3) = 60° = π/3. z = 2(cos60° + i sen60°). Verificação: 2(cos60° + i sen60°) = 2(1/2 + i√3/2) = 1 + √3 i ✓.";"r = 2; θ = 60°; z = 2(cos60° + i sen60°)"
"4210";"dissertativa";"Física";"Mecânica";"Momento linear e colisões";"Médio";"Vestibular";"2023";"Dois objetos de massas iguais m se movem em sentidos opostos com velocidades iguais v. Após uma colisão perfeitamente elástica, o que acontece com as velocidades? Explique usando conservação de momento e energia.";"";"";"";"";"";"";"Conservação do momento: m×v + m×(-v) = m×v₁' + m×v₂' → 0 = v₁' + v₂'. Conservação de energia cinética (elástica): ½m×v² + ½m×v² = ½m×v₁'² + ½m×v₂'² → 2v² = v₁'² + v₂'². Com v₁' = -v₂': 2v² = 2v₂'² → v₂' = ±v. Solução não trivial: v₁' = v e v₂' = -v (troca de velocidades). Os objetos de mesma massa trocam as velocidades após colisão elástica.";"Massas iguais trocam velocidades: v₁' = v₂ = -v; v₂' = v₁ = +v"
"4211";"dissertativa";"Química";"Eletroquímica";"Corrosão e proteção";"Médio";"Vestibular";"2024";"Explique o processo de corrosão do ferro, as condições que favorecem e os principais métodos de proteção anticorrosiva.";"";"";"";"";"";"";"A ferrugem é oxidação eletroquímica do ferro na presença de O₂ e H₂O (eletrólito): Fe → Fe²⁺ + 2e⁻ (ânodo); O₂ + 2H₂O + 4e⁻ → 4OH⁻ (cátodo). Fe²⁺ + 2OH⁻ → Fe(OH)₂ → Fe₂O₃·H₂O (ferrugem). Condições que favorecem: umidade, salinidade, pH ácido, presença de sais. Proteção: (1) Pintura — barreira física; (2) Galvanização — camada de zinco (sacrificial); (3) Proteção catódica — zinco ou corrente elétrica tornam o ferro catodo; (4) Aço inoxidável — liga com Cr, Ni, forma óxido protetor.";"Fe + O₂ + H₂O → ferrugem. Proteção: pintura, galvanização (zinco sacrificial), proteção catódica, inox"
"4212";"dissertativa";"Biologia";"Zoologia";"Adaptações ao voo";"Médio";"Vestibular";"2023";"Descreva as principais adaptações morfológicas e fisiológicas das aves ao voo, comparando-as com morcegos (único mamífero voador).";"";"";"";"";"";"";"Aves — adaptações ao voo: esqueleto pneumatizado (ossos ocos, leves), quilha no esterno (ancoragem dos músculos peitorais), ausência de dentes (mandíbula córnea/bico), penas (aerodinâmica, isolamento), alvéolos pulmonares com sacos aéreos (respiração mais eficiente), coração grande e temperatura alta. Morcegos: asa formada por membrana pele (patagium) entre dedos alongados; ecolocalização (ultrassons) para orientação no escuro; estrutura óssea mamífera (mais pesada que aves). Ambos: metabolismo elevado, visão adaptada.";"Aves: ossos ocos, quilha, penas, sacos aéreos. Morcegos: patagium, ecolocalização. Ambos: metabolismo alto"
"4213";"dissertativa";"Filosofia";"Filosofia Contemporânea";"Fenomenologia";"Difícil";"Vestibular";"2024";"Explique o método fenomenológico de Husserl e como Heidegger o transforma ao introduzir o conceito de Dasein.";"";"";"";"";"";"";"Husserl: fenomenologia como ciência rigorosa das estruturas da consciência. Método: epoché (suspender julgamentos sobre existência do mundo externo), redução fenomenológica (descrever fenômenos como aparecem à consciência). Intentio: toda consciência é consciência DE algo. Heidegger transforma: abandona a consciência transcendental husserliana. O Dasein (ser-no-mundo) já está sempre situado e envolvido com o mundo — não pode ser suspendido. A compreensão do ser é ontologicamente anterior à reflexão epistêmica. O Dasein não é sujeito isolado contemplando objetos, mas ser-com-outros, temporal e finito, projetando-se para possibilidades futuras.";"Husserl: epoché, descrever consciência. Heidegger: Dasein = ser-no-mundo, situado, temporal — supera dualismo sujeito/objeto"
"4214";"dissertativa";"Sociologia";"Juventude";"Cultura jovem";"Médio";"Vestibular";"2023";"Analise como o hip-hop e o funk carioca se constituíram como expressões culturais das juventudes periféricas brasileiras e seu processo de reconhecimento cultural.";"";"";"";"";"";"";"Hip-hop (surgido no Bronx, NY nos 70s): chega ao Brasil na década de 1980, especialmente em São Paulo. Expressão cultural das periferias negras: rap, break, grafite, DJ. Nomes: Racionais MC's, Criolo. O hip-hop é resistência cultural que denuncia violência policial, racismo e exclusão. Funk carioca: derivado do soul/funk americano, nas favelas do Rio de Janeiro. Historicamente criminalizado; hoje reconhecido como patrimônio cultural carioca (2021). Baile funk: espaço de sociabilidade. Ambos demonstram como culturas periféricas criam identidade, resistência e podem ser cooptadas pela indústria cultural.";"Hip-hop: resistência negra periférica (rap, break); Racionais. Funk: favelas do RJ, patrimônio cultural. Ambos: identidade e resistência"
"4215";"dissertativa";"Literatura";"Literatura Brasileira";"Jorge Amado";"Médio";"Vestibular";"2024";"Analise a representação da cultura afro-brasileira na obra de Jorge Amado, destacando 'Gabriela, Cravo e Canela' e o papel das personagens femininas.";"";"";"";"";"";"";"Jorge Amado representa a cultura afro-brasileira com valorização positiva do sincretismo religioso (candomblé, orixás), da sensualidade e da alegria da Bahia — em contraste com o puritanismo burguês e o racismo. Em 'Gabriela' (1958): Gabriela é personagem emblemática, negra, sensual, livre — resistência à moral dominante. Nacib, o árabe, representa o cosmopolitismo baiano. A narrativa critica a hipocrisia da sociedade cacaueira de Ilhéus, que muda economicamente mas não moralmente. Personagens femininas: mulheres negras e mestiças são representadas com agência, sensualidade e resistência.";"Afro-brasileiro: candomblé, sincretismo, mestiçagem valorizada. Gabriela: mulher negra livre vs. moral burguesa. Crítica à hipocrisia"
"4216";"dissertativa";"Matemática";"Funções";"Valor absoluto em funções";"Médio";"Vestibular";"2023";"Resolva a equação |2x - 4| = 6 e represente a solução geometricamente na reta numérica.";"";"";"";"";"";"";"|2x - 4| = 6 → dois casos: (1) 2x-4 = 6 → 2x = 10 → x = 5; (2) 2x-4 = -6 → 2x = -2 → x = -1. Solução: {-1, 5}. Geometricamente: a equação pergunta quais valores de x têm distância 3 do ponto 2 (|x-2| = 3): x = 5 (distância 3 à direita de 2) e x = -1 (distância 3 à esquerda de 2).";"x = 5 ou x = -1; na reta numérica: pontos a distância 3 do centro 2"
"4217";"dissertativa";"Física";"Eletricidade";"Geradores e receptores";"Médio";"Vestibular";"2024";"Um gerador elétrico tem força eletromotriz ε = 12 V e resistência interna r = 1 Ω. É conectado a uma resistência externa R = 3 Ω. Calcule: corrente no circuito, tensão terminal e potência no resistor externo.";"";"";"";"";"";"";"Corrente: i = ε/(R+r) = 12/(3+1) = 3 A. Tensão terminal: V = ε - i×r = 12 - 3×1 = 9 V. Potência no R externo: P = i²×R = 9×3 = 27 W (ou P = V×i = 9×3 = 27 W).";"i = 3 A; V_terminal = 9 V; P_externo = 27 W"
"4218";"dissertativa";"Química";"Óxidos";"Tipos de óxidos";"Médio";"Vestibular";"2023";"Classifique os óxidos em: ácidos, básicos, anfóteros e neutros. Dê um exemplo de cada e escreva as reações de formação dos óxidos ácido e básico.";"";"";"";"";"";"";"Óxido ácido (anidrido): não-metal + O₂ → forma ácido com água. Ex: SO₃ + H₂O → H₂SO₄. Óxido básico: metal + O₂ → forma base com água. Ex: CaO + H₂O → Ca(OH)₂ (cal hidratada). Óxido anfótero: reage com ácido E com base. Ex: Al₂O₃ (alumina) — Al₂O₃ + 6HCl → 2AlCl₃ + 3H₂O e Al₂O₃ + 2NaOH → 2NaAlO₂ + H₂O. Óxido neutro: não reage com água, ácido nem base. Ex: CO (monóxido de carbono), NO.";"Ácido: SO₃+H₂O→H₂SO₄. Básico: CaO+H₂O→Ca(OH)₂. Anfótero: Al₂O₃. Neutro: CO"
"4219";"dissertativa";"Biologia";"Anatomia";"Sistema linfático";"Médio";"Vestibular";"2024";"Explique as funções do sistema linfático, sua relação com o sistema imunológico e o papel dos linfonodos.";"";"";"";"";"";"";"Sistema linfático: (1) Drenagem de líquido intersticial (linfa) dos tecidos de volta ao sangue — evita edema; (2) Transporte de lipídios absorvidos no intestino (quilomicrons via vasos quilíferos); (3) Imunidade. Relação com imunidade: os vasos linfáticos conduzem antígenos e linfócitos; órgãos linfoides (timo, baço, amígdalas, MALT). Linfonodos: estruturas ao longo dos vasos linfáticos; filtram a linfa, detectam patógenos; contêm linfócitos B e T; inflamam durante infecções ('gânglios inchados'). São postos avançados do sistema imune que coordenam respostas específicas.";"Linfático: drenagem, absorção de lipídios, imunidade. Linfonodos: filtram linfa, ativam linfócitos, inflamam em infecção"
"4220";"dissertativa";"Filosofia";"Ética";"Ética do cuidado";"Médio";"Vestibular";"2023";"A ética do cuidado, desenvolvida por Carol Gilligan como crítica ao modelo moral de Kohlberg, enfatiza quais aspectos? Compare com a ética kantiana.";"";"";"";"";"";"";"Gilligan critica Kohlberg por usar sujeito masculino abstrato como modelo universal de desenvolvimento moral. A ética do cuidado enfatiza: relações concretas de interdependência, responsabilidade pelos outros, compaixão, contexto particular (vs. regras abstratas), cuidado das vulnerabilidades. Comparação com Kant: Kant foca em deveres universais, razão, autonomia e regras abstratas (imperativo categórico) — prescinde do contexto. Ética do cuidado é relacional, contextual, particularista. Não se opõe, mas complementa: princípios universais + sensibilidade ao cuidado concreto das relações.";"Ética do cuidado: relações concretas, responsabilidade, compaixão vs. Kant: regras universais, razão abstrata"
"4221";"dissertativa";"Sociologia";"Racismo";"Ações afirmativas";"Médio";"Vestibular";"2024";"Discuta as políticas de ações afirmativas no Brasil (cotas raciais e sociais), apresentando os argumentos favoráveis e contrários à medida.";"";"";"";"";"";"";"Ações afirmativas: políticas que reservam vagas ou recursos para grupos historicamente discriminados (negros, indígenas, PCD, escola pública). A Lei de Cotas (2012) reserva 50% das vagas federais. Argumentos favoráveis: reparação histórica da escravidão e discriminação; promoção de igualdade material não apenas formal; aumenta diversidade e melhora qualidade das instituições; reduz a sub-representação de negros em postos de prestígio. Contrários: violação do princípio meritocrático; cria discriminação inversa; dificuldade em definir raça; não ataca causas estruturais (qualidade da educação básica). O STF declarou as cotas constitucionais em 2012.";"Cotas: Lei 2012; favorável: reparação histórica, igualdade material; contrário: mérito, definição de raça; STF constitucional"
"4222";"dissertativa";"Literatura";"Literatura Brasileira";"Geração Beat e influência";"Médio";"Vestibular";"2023";"A Geração Beat americana (Kerouac, Ginsberg) influenciou a contracultura brasileira dos anos 60-70. Explique essa influência na literatura e música nacional.";"";"";"";"";"";"";"A Geração Beat (1950s) valorizava a liberdade de expressão, a viagem como busca existencial, o jazz, drogas, sensualidade e ruptura com o conformismo burguês. No Brasil, a contracultura dos 60-70 (contexto da ditadura) recebeu essa influência: tropicalismo (Caetano, Gil) mesclou beat e bossa nova; literatura: Torquato Neto, Waly Salomão (poesia marginal); Manguebeat nos 90s. A influência se deu pela circulação de livros (Kerouac, 'Na Estrada'; Ginsberg, 'Uivo'), pela beat poetry e pelo comportamento contracultural que dialogava com a resistência à ditadura.";"Beat: liberdade, viagem, ruptura → Tropicalismo, poesia marginal, Waly Salomão. Resistência à ditadura e ao conformismo"
"4223";"dissertativa";"Matemática";"Equações";"Sistemas não lineares";"Médio";"Vestibular";"2024";"Resolva o sistema de equações: {x + y = 5 ; x·y = 6}. Interprete geometricamente.";"";"";"";"";"";"";"De x+y=5: y = 5-x. Substituindo em xy=6: x(5-x) = 6 → 5x-x² = 6 → x²-5x+6 = 0 → (x-2)(x-3) = 0. x=2 ou x=3. Se x=2, y=3; se x=3, y=2. Solução: (2,3) e (3,2). Geometricamente: a interseção de uma reta (x+y=5) com uma hipérbole (xy=6) resulta em 2 pontos, pois a reta é secante à hipérbole.";"x=2,y=3 e x=3,y=2; interseção de reta e hipérbole"
"4224";"dissertativa";"Física";"Cinemática";"Composição de velocidades";"Médio";"Vestibular";"2023";"Um barqueiro quer cruzar um rio de 120 m de largura. Sua velocidade em relação à água é 2 m/s perpendicular à margem. A corrente do rio é de 1,5 m/s paralela à margem. Quanto tempo leva para cruzar e onde chegará?";"";"";"";"";"";"";"Tempo para cruzar (independe da corrente): t = d/v_barco = 120/2 = 60 s. Deslocamento pela corrente: d = v_corrente × t = 1,5 × 60 = 90 m rio abaixo. O barqueiro chega 90 m deslocado da posição diretamente oposta. Velocidade resultante: v = √(2² + 1,5²) = √(4+2,25) = √6,25 = 2,5 m/s.";"t = 60 s; desviado 90 m pela corrente; v_resultante = 2,5 m/s"
"4225";"dissertativa";"Química";"Cinética";"Catálise enzimática";"Médio";"Vestibular";"2024";"Compare catalisadores homogêneos e heterogêneos, explicando o papel das enzimas como catalisadores biológicos e o conceito de sítio ativo.";"";"";"";"";"";"";"Catalisador homogêneo: mesma fase que os reagentes. Ex: H⁺ em solução ácida. Catalisador heterogêneo: fase diferente. Ex: Pt sólida em reações gasosas (conversor catalítico). Enzimas: catalisadores biológicos proteicos, altamente específicos e eficientes. Sítio ativo: região tridimensional da enzima onde o substrato se encaixa (modelo lock-and-key ou induzido). A ligação enzima-substrato forma complexo ES → produto, reduzindo a energia de ativação. Fatores que afetam: temperatura, pH, concentração de substrato, inibidores competitivos e não-competitivos.";"Homogêneo: mesma fase. Heterogêneo: fases diferentes. Enzima: proteica, específica, sítio ativo = encaixe substrato"
"4226";"dissertativa";"Biologia";"Comportamento";"Instinto e aprendizagem em abelhas";"Médio";"Vestibular";"2023";"Explique a organização social das abelhas (eusocialidade) e como a dança waggle comunica informações sobre fontes de alimento.";"";"";"";"";"";"";"Eusocialidade das abelhas (Apis mellifera): colônia com castas — rainha (reprodução), operárias (trabalho, estéreis), machos (reprodução). Alta cooperação e cuidado coletivo da prole. Dança waggle (von Frisch, Nobel 1973): operária que encontrou alimento executa dança no favo. O ângulo da dança indica a direção do alimento em relação ao sol. A duração da dança indica a distância. A intensidade indica a qualidade da fonte. É uma forma sofisticada de comunicação simbólica — uma das mais complexas entre invertebrados.";"Eusocialidade: rainha, operárias, machos. Dança waggle: ângulo = direção, duração = distância, intensidade = qualidade"
"4227";"dissertativa";"Filosofia";"Metafísica";"Problema mente-corpo";"Difícil";"Vestibular";"2024";"Explique o dualismo mente-corpo de Descartes e as principais críticas contemporâneas a essa posição.";"";"";"";"";"";"";"Descartes: mente (res cogitans, substância pensante, imaterial) e corpo (res extensa, matéria, espaço) são substâncias radicalmente distintas. A mente controla o corpo pela glândula pineal. Críticas: (1) Problema da interação: como substâncias radicalmente distintas interagem? (2) Ryle: 'fantasma na máquina' — equívoco categorial; (3) Neurociência: estados mentais são correlacionados com estados cerebrais (atividade neural); (4) Materialismo/fisicalismo: tudo é físico, mente = atividade cerebral; (5) Funcionalismo: mente é o que o cérebro faz; (6) Problema dos qualia: mesmo o fisicalismo não explica a experiência subjetiva.";"Dualismo: mente imaterial vs. corpo material. Críticas: problema da interação, neurociência, Ryle, fisicalismo"
"4228";"dissertativa";"Sociologia";"Cultura";"Indústria cultural";"Médio";"Vestibular";"2023";"Adorno e Horkheimer cunharam o conceito de 'indústria cultural'. Explique esse conceito e avalie sua relevância para compreender a cultura de massas contemporânea.";"";"";"";"";"";"";"Adorno e Horkheimer (Escola de Frankfurt, 'Dialética do Esclarecimento', 1944): a cultura se torna mercadoria produzida industrialmente para o consumo de massa. A indústria cultural padroniza, simplifica e promove conformismo, impedindo a consciência crítica. A arte 'séria' é substituída por entretenimento passivo que reproduz a ideologia dominante. Relevância contemporânea: streaming, redes sociais, algoritmos que filtram conteúdo, cultura de influenciadores, cancelamento da arte crítica — confirmam aspectos da teoria. Críticas: subestima a agência dos consumidores e a cultura popular como resistência.";"Indústria cultural: cultura como mercadoria padronizada → conformismo. Relevante hoje: streaming, algoritmos, influenciadores"
"4229";"dissertativa";"Literatura";"Literatura Brasileira";"Autores contemporâneos";"Médio";"Vestibular";"2024";"Analise 'Ponciá Vicêncio' de Conceição Evaristo como exemplo de literatura afro-brasileira contemporânea, destacando memória, ancestralidade e identidade negra.";"";"";"";"";"";"";"'Ponciá Vicêncio' (2003): primeira obra de Evaristo. Ponciá, mulher negra que migra do campo para a cidade, busca reconstruir a identidade negra fragmentada pela escravidão. A avó, o vovô Vicêncio (marcado pelo trauma da escravidão) e a argila (arte ancestral) são fios de memória e ancestralidade. Conceito de 'escrevivência' (Evaristo): a escrita como forma de viver e reviver experiências das mulheres negras. A narrativa rompe com silêncios históricos, dando voz a uma perspectiva excluída. Identidade negra: não linear, fragmentada, construída na tensão entre memória coletiva e experiência individual.";"Escrevivência; Ponciá busca identidade negra fragmentada; ancestralidade (vovô, argila); memória da escravidão; voz afrofeminina"
