"id";"tipo";"disciplina";"tema";"subtema";"dificuldade";"fonte";"ano";"enunciado";"alternativa_a";"alternativa_b";"alternativa_c";"alternativa_d";"alternativa_e";"resposta_correta";"explicacao";"resposta"
"4309";"multipla";"Matematica";"Algebra";"Produto de soma e diferenca";"Facil";"Vestibular";"2024";"O resultado de (5+3)(5-3) e:";"16";"64";"6";"4";"30";"a";"(a+b)(a-b) = a^2 - b^2 = 25 - 9 = 16.";""
"4310";"multipla";"Matematica";"Geometria Plana";"Paralelogramo";"Facil";"Vestibular";"2024";"Um paralelogramo tem base 8 cm e altura 5 cm. Sua area e:";"40 cm2";"26 cm2";"20 cm2";"80 cm2";"13 cm2";"a";"Area do paralelogramo = base x altura = 8 x 5 = 40 cm2.";""
"4311";"multipla";"Matematica";"Estatistica";"Variancia e desvio padrao";"Medio";"Vestibular";"2024";"O desvio padrao mede:";"A dispersao dos dados em torno da media — quanto os valores se afastam da media";"O valor central do conjunto de dados";"O valor que aparece com mais frequencia";"A diferenca entre o maior e o menor valor";"A probabilidade de cada evento";"a";"O desvio padrao (sigma) mede a dispersao dos dados em torno da media. Pequeno DP = dados concentrados perto da media. Grande DP = dados muito espalhados. Variancia = sigma^2. Amplitude = max - min (medida de dispersao mais simples, mas menos robusta).";""
"4312";"multipla";"Matematica";"Probabilidade";"Regra de adicao";"Medio";"Vestibular";"2024";"Se P(A) = 0,4 e P(B) = 0,3 e os eventos sao mutuamente exclusivos, entao P(A ou B) e:";"0,7";"0,12";"0,1";"1";"0,5";"a";"Para eventos mutuamente exclusivos (nao podem ocorrer juntos): P(A ou B) = P(A) + P(B) = 0,4 + 0,3 = 0,7. Se nao fossem exclusivos: P(A ou B) = P(A) + P(B) - P(A e B).";""
"4313";"multipla";"Matematica";"Geometria Espacial";"Tronco de cone";"Dificil";"Vestibular";"2024";"O volume de um paralelepipedo retangular de dimensoes 3, 4 e 5 cm e:";"60 cm3";"47 cm3";"94 cm3";"20 cm3";"12 cm3";"a";"Volume do paralelepipedo (caixa retangular) = comprimento x largura x altura = 3 x 4 x 5 = 60 cm3.";""
"4314";"multipla";"Fisica";"Mecanica";"Quantidade de movimento";"Medio";"Vestibular";"2024";"A quantidade de movimento (momento linear) de um objeto de 3 kg movendo-se a 4 m/s e:";"12 kg.m/s";"7 kg.m/s";"1,33 m/s";"48 kg.m/s";"12 N";"a";"p = m x v = 3 x 4 = 12 kg.m/s. O impulso (J = F x Delta_t) e igual a variacao do momento: J = Delta_p.";""
"4315";"multipla";"Fisica";"Mecanica";"Centro de massa";"Medio";"Vestibular";"2024";"O Centro de Massa de um sistema e o ponto onde:";"Toda a massa do sistema pode ser considerada concentrada para fins de movimentos translacionais";"A velocidade do sistema e sempre zero";"A aceleracao e maxima";"As forcas internas se anulam";"A energia cinetica e maxima";"a";"O Centro de Massa (CM) e o ponto medio ponderado pelas massas de um sistema. Para fins de translacao, todo o sistema se comporta como se toda a massa estivesse no CM sujeita a resultante das forcas externas. A segunda lei de Newton para o sistema: F_ext = M_total x a_CM. Isso simplifica enormemente a analise de sistemas de particulas e corpos rigidos.";""
"4316";"multipla";"Fisica";"Eletricidade";"Resistencia eletrica";"Facil";"Vestibular";"2024";"A resistencia eletrica de um condutor depende de:";"Comprimento, area da secao transversal e resistividade do material";"Apenas da corrente eletrica";"Apenas da tensao aplicada";"Apenas da temperatura";"Da cor do condutor";"a";"R = rho * L / A, onde rho = resistividade do material (propriedade intrinseca), L = comprimento do fio, A = area da seccao transversal. Condutor mais longo: maior R. Seccao maior: menor R (mais 'espaco' para os eletrons). Resistividade depende do material e da temperatura (resistencia aumenta com temperatura nos metais).";""
"4317";"multipla";"Fisica";"Eletricidade";"Circuito serie";"Medio";"Vestibular";"2024";"Em um circuito serie, a resistencia equivalente e:";"A soma das resistencias individuais: Req = R1 + R2 + R3 + ...";"A media das resistencias";"Igual a menor resistencia";"1/(1/R1 + 1/R2 + ...)";"Zero";"a";"Em serie: Req = R1 + R2 + R3 + ... A corrente e a mesma em todos os elementos; a tensao total se distribui entre os elementos. Em paralelo: 1/Req = 1/R1 + 1/R2 + ... A tensao e a mesma em todos os elementos; a corrente total se distribui entre os ramos.";""
"4318";"multipla";"Quimica";"Quimica Geral";"Numero de Avogadro";"Medio";"Vestibular";"2024";"O numero de Avogadro (NA = 6,02 x 10^23) representa:";"O numero de particulas (atomos, moleculas ou ions) contidas em 1 mol de qualquer substancia";"A massa molar em gramas de qualquer substancia";"O volume molar dos gases em CNTP";"O numero de eletrons no atomo mais pesado";"A constante de Planck";"a";"O numero de Avogadro (NA = 6,022 x 10^23 mol^-1) e o numero de entidades elementares (atomos, moleculas, ions, eletrons) em 1 mol. 1 mol de qualquer gas em CNTP (0graus C, 1 atm) ocupa 22,4 L (volume molar). 1 mol de C-12 pesa exatamente 12 g. A constante de Boltzmann k = R/NA.";""
"4319";"multipla";"Quimica";"Quimica Organica";"Benzeno e derivados";"Medio";"Vestibular";"2024";"O acido acetilsalicilico (AAS), principio ativo da aspirina, pertence ao grupo dos:";"Esteres aromaticos — formado pela acetilacao do acido salicilico";"Alcaloides";"Terpenoides";"Amino acids";"Polissacarideos";"a";"O AAS (acido 2-acetoxibenzoico) e um ester formado pela reacao do acido salicilico com anidrido acetico (acetilaçao). Pertence aos anti-inflamatorios nao-esteroidais (AINE). Felix Hoffman sintetizou-o em 1897 para a Bayer. Inibe a ciclooxigenase (COX-1 e COX-2), enzima da sintese de prostaglandinas (dor e inflamacao), e tem efeito anticoagulante.";""
"4320";"multipla";"Quimica";"Quimica Geral";"Velocidade das reacoes";"Medio";"Vestibular";"2024";"Um catalisador aumenta a velocidade de uma reacao quimica ao:";"Diminuir a energia de ativacao da reacao sem ser consumido no processo";"Aumentar a temperatura do sistema";"Aumentar a concentracao dos reagentes";"Ser consumido para formar os produtos";"Alterar o equilibrio quimico para a direita";"a";"O catalisador oferece um caminho alternativo de menor energia de ativacao para a reacao. Assim, mais moleculas tem energia suficiente para reagir (maior fator exponencial na equacao de Arrhenius), aumentando a velocidade. O catalisador nao e consumido (regenerado ao final) e nao altera a variacao de entalpia (DeltaH) nem a posicao do equilibrio (apenas acelera a chegada ao equilibrio).";""
"4321";"multipla";"Biologia";"Fisiologia Humana";"Sistema nervoso central";"Facil";"Vestibular";"2024";"As meninges sao membranas que envolvem o sistema nervoso central. A inflamacao das meninges e chamada de:";"Meningite — geralmente causada por bacterias ou virus";"Encefalite";"Poliomielite";"Neuropatia";"Esclerose";"a";"As meninges (dura-mater, aracnoide, pia-mater) protegem o encefalo e a medula espinhal. A meningite (inflamacao das meninges) pode ser bacteriana (meningococo — grave), viral (mais comum e menos grave) ou fungica. Sintomas: rigidez de nuca, febre, fotofobia, cefaleia intensa. A vacina meningococica protege contra os principais sorotipos bacterianos.";""
"4322";"multipla";"Biologia";"Fisiologia Humana";"Sistema reprodutor feminino";"Medio";"Vestibular";"2024";"A ovulacao, liberacao do ovulo pelo ovario, ocorre normalmente:";"Ao redor do 14o dia do ciclo menstrual (ciclo de 28 dias)";"No inicio do ciclo (menstruacao)";"No final do ciclo";"A qualquer momento do ciclo";"Apenas durante a gestacao";"a";"O ciclo menstrual tem ~28 dias. A fase folicular (dias 1-13): estrogênio sobe, folículo cresce. Por volta do dia 14, o pico de LH (hormonio luteinizante) desencadeia a ovulacao. A fase luteal (dias 15-28): corpo luteo produz progesterona. Se nao houver fecundacao, o corpo luteo regride, os hormonios caem e ocorre a menstruacao (~dia 28).";""
"4323";"multipla";"Biologia";"Botanica";"Angiospermas — frutos e sementes";"Facil";"Vestibular";"2024";"O fruto e botanicamente definido como:";"O ovario maduro (apos fecundacao), que contem e protege as sementes";"Qualquer estrutura carnosa e doce das plantas";"A flor apos a polinizacao";"As folhas modificadas das angiospermas";"O gameta feminino da planta";"a";"Botanicamente, fruto = ovario maduro (apos a dupla fecundacao). A parede do ovario (pericarpo) pode ser carnosa (frutos verdadeiros: manga, laranja) ou seca (legumes: feijao, amendoim). Pseudofrutos tem contribuicao de outras partes da flor (maca = receptaculo; morango = receptaculo; caju = pedunculo). A semente = ovulo fecundado maduro.";""
"4324";"multipla";"Historia";"Historia Geral";"Cruzadas";"Medio";"Vestibular";"2024";"As Cruzadas (seculos XI-XIII) foram expediciones militares dos cristãos europeus com objetivo de:";"Reconquistar a Terra Santa (Jerusalem) dos muçulmanos, embora tambem tivessem motivacoes economicas e politicas";"Expandir o comercio com o Oriente Medio";"Converter os povos africanos ao cristianismo";"Combater a heresia catara na Franca";"Estabelecer colonias no leste europeu";"a";"As Cruzadas (1095-1291), convocadas pelo papa Urbano II, tinham motivacoes multifacetadas: (1) Religiosidade medieval — reconquistar Jerusalem e os lugares sagrados dos turcos seldjucidas; (2) Economica — abertura das rotas comerciais com o Oriente, saque de cidades ricas; (3) Politica — desviar a violencia dos cavaleiros europeus para fora. Tiveram impactos enormes no contato entre culturas cristas, islamicas e judaicas.";""
"4325";"multipla";"Historia";"Historia Geral";"Revolucao industrial Segunda";"Medio";"Vestibular";"2024";"A Segunda Revolucao Industrial (1870-1914) diferenciou-se da Primeira por:";"Uso de eletricidade, petroleo e quimica industrial; novos paises (EUA, Alemanha, Japao) como lideres";"Ser liderada exclusivamente pela Inglaterra com carvao e vapor";"Nao envolver producao em massa";"Ter ocorrido principalmente na America Latina";"Basear-se na energia nuclear";"a";"A 2a Revolucao Industrial (1870-1914) caracterizou-se por: (1) Novas fontes de energia: eletricidade (Edison, Tesla) e petroleo (motor a combustao interna); (2) Novos materiais: aco (Bessemer), aluminio, plastico; (3) Quimica: corantes, medicamentos, fertilizantes; (4) Comunicacoes: telegrafo, telefone; (5) Novos lideres: EUA, Alemanha e Japao superaram a Inglaterra. Base do imperialismo do fim do seculo XIX.";""
"4326";"multipla";"Historia";"Historia do Brasil";"Crise de 1929";"Medio";"Vestibular";"2024";"A Crise de 1929 (Grande Depressao) afetou o Brasil principalmente pela:";"Queda do preco do cafe e destruicao de estoques, prejudicando a oligarquia cafeicultora paulista";"Falencia dos bancos brasileiros";"Invasao militar estrangeira";"Colapso da industria brasileira";"Hiperinflacao sem precedentes";"a";"A Crise de 1929 derrubou o preco do cafe (principal produto de exportacao brasileiro) de US$ 22,5 para US$ 8 por saca. O governo brasileiro comprou e destruiu enormes estoques de cafe para manter os precos. A oligarquia cafeicultora ficou enfraquecida, contribuindo para a crise politica que levou a Revolucao de 1930 e a ascensao de Vargas.";""
"4327";"multipla";"Historia";"Historia Geral";"Organizacoes regionais";"Facil";"Vestibular";"2024";"A Uniao Europeia (UE) foi formalmente criada pelo:";"Tratado de Maastricht (1992), que aprofundou a integracao europeia e criou o Euro";"Tratado de Roma (1957), que criou a CEE";"Acordo de Schengen (1985)";"Tratado de Lisboa (2009)";"Tratado de Versalhes (1919)";"a";"O Tratado de Maastricht (1992, Holanda) transformou a CEE (Comunidade Economica Europeia) em Uniao Europeia, aprofundando a integracao: criou a cidadania europeia, estabeleceu criterios para o Euro (adotado em 1999/2002) e expandiu cooperacao em politica externa e justicia. O processo de integracao europeia comecou com o Tratado de Roma (1957) e continua evoluindo.";""
"4328";"multipla";"Historia";"Historia Geral";"Imperio Romano";"Medio";"Vestibular";"2024";"A queda do Imperio Romano do Ocidente (476 d.C.) e utilizada como marco da transicao entre:";"Antiguidade e Idade Media";"Preistoria e Antiguidade";"Idade Media e Modernidade";"Modernidade e Contemporaneidade";"Paleolitico e Mesolitico";"a";"A historiografia tradicional divide a historia em: Pre-historia (ate escrita, ~3500 a.C.), Antiguidade (3500 a.C. - 476 d.C.), Idade Media (476-1453), Modernidade (1453-1789) e Contemporaneidade (1789-presente). A queda de Roma em 476 d.C. (invasao germânica) marca o inicio da Idade Media. A queda de Constantinopla em 1453 (Imperio Romano do Oriente) marca a transicao para a Modernidade.";""
"4329";"multipla";"Geografia";"Geologia";"Rochas";"Facil";"Vestibular";"2024";"As rochas igneas (magmaticas) se formam pelo:";"Resfriamento e solidificacao do magma — intrusivas (plutonicas) ou extrusivas (vulcanicas)";"Deposito de sedimentos compactados";"Transformacao de rochas preexistentes por calor e pressao";"Deposito de sais minerais em aguas marinhas";"Atividade biologica de organismos";"a";"Rochas igneas (magmaticas): formadas pela solidificacao do magma. Intrusivas (plutonicas): solidificam lentamente no interior da crosta — granito, diorito (cristais grandes). Extrusivas (vulcanicas): solidificam rapidamente na superficie — basalto, obsidiana (cristais finos ou amorfos). Rochas sedimentares: deposito e cimentacao de sedimentos. Rochas metamorficas: transformacao por calor e pressao (marmore = calcario metamorfizado).";""
"4330";"multipla";"Lingua Portuguesa";"Semantica";"Denotacao e conotacao";"Facil";"Vestibular";"2024";"No verso 'O mar e um cachorro enorme', a palavra 'cachorro' e usada em sentido:";"Conotativo — evoca agitacao, barulho, imprevisibilidade";"Denotativo — descreve um animal de estimacao";"Tecnico";"Juridico";"Nenhum dos anteriores";"a";"Denotacao: sentido literal, dicionarizado. 'Cachorro' denotativo = o animal. Conotacao: sentido figurado, contextual. 'O mar e um cachorro enorme' = metafora que evoca a natureza agitada, barulhenta e imprevisível do mar. A conotacao enriquece o texto literario com camadas de significado. O mesmo objeto pode ter muitas conotacoes dependendo do contexto cultural.";""
"4331";"multipla";"Lingua Portuguesa";"Gramatica";"Derivacao prefixal";"Facil";"Vestibular";"2024";"A palavra 'irreal' e formada pelo processo de:";"Derivacao prefixal — prefixo 'ir-' (variante de 'in-') + real";"Composicao";"Derivacao sufixal";"Hibridismo";"Onomatopeia";"a";"Derivacao prefixal: adicao de prefixo a uma palavra base. 'Ir-' e uma variante do prefixo latino 'in-' (negacao) antes de radicais que comecam com 'r': in-real = irreal (assimilacao). Outros prefixos: des- (desfazer), re- (refazer), anti- (antiviral), pre- (pre-natal). Derivacao sufixal: adicao de sufixo: real-idad-e. Composicao: uni-versidade, pas-te-l-aria.";""
"4332";"multipla";"Lingua Portuguesa";"Literatura Brasileira";"Haroldo de Campos";"Dificil";"Vestibular";"2024";"O Concretismo (Poesia Concreta), movimento liderado por Augusto de Campos, Haroldo de Campos e Decio Pignatari nos anos 1950, propunha:";"A poesia como objeto visual e sonoro — exploracao grafica, espacial e fonetica do poema";"O retorno ao verso metrificado tradicional";"A poesia comprometida com a luta social";"O verso livre romantizado";"A poesia regional nordestina";"a";"O Concretismo (manifesto inaugurado com 'Plano-Piloto para Poesia Concreta', 1958) propunha a 'poesia-objeto': o poema explorava o espaco grafico da pagina, a musicalidade, o visual e a estrutura linguistica como material poetico. Influenciado por Mallarme, e. e. cummings e pela semiologia. Palavras dispostas no espaco da pagina criam significados visuais alem do linguistico. Foi o movimento de vanguarda mais internacionalmente conhecido do Brasil.";""
"4333";"multipla";"Filosofia";"Filosofia da Historia";"Hegel";"Dificil";"Vestibular";"2024";"Para Hegel, a historia se desenvolve pela:";"Dialética de tese, antitese e sintese — o Espirito Absoluto se realiza progressivamente";"Forcas materiais e relacoes de producao";"Vontade de poder dos individuos extraordinarios";"Ciclos repetitivos sem progressao";"Ordem divina providencial";"a";"O idealismo historico de Hegel: a historia e o processo de autoconhecimento do Espirito Absoluto (Geist). O movimento e dialetico: toda realidade (tese) gera sua negacao (antitese) que e superada numa sintese superior. A historia progride em direcao a maior liberdade e autoconsciencia. Marx inverteu Hegel: para Marx, nao e o Espirito mas as forcas materiais (modo de producao) que movem a historia.";""
"4334";"multipla";"Filosofia";"Filosofia Contemporanea";"Desconstrucao";"Dificil";"Vestibular";"2024";"A desconstrucao de Jacques Derrida propoe que os textos:";"Contem contradicoes e hirarquias que podem ser subvertidas — o significado e sempre diferido e instavel";"Tem um significado fixo e definitivo estabelecido pelo autor";"Devem ser interpretados pela intencao original do escritor";"Sao representacoes neutras da realidade";"Tem hierarquias estables e bem definidas";"a";"Derrida propoe a 'desconstrucao' como estrategia de leitura: todo texto contem hirarquias de oposicoes binarias (fala/escrita, presenca/ausencia, homem/mulher) que favorecem um termo sobre o outro. A desconstrucao mostra como essas hierarquias sao artificiais e como o texto subverte suas proprias pretensoes de estabilidade. O significado nunca e pleno — e sempre 'differance' (diferenca e diferimento).";""
"4335";"multipla";"Sociologia";"Sociologia da Globalizacao";"Fluxos globais";"Medio";"Vestibular";"2024";"Arjun Appadurai analisa a globalizacao por meio de cinco 'paisagens' (scapes). Ethnoscapes refere-se a:";"Fluxos globais de pessoas — migrantes, turistas, refugiados e trabalhadores que circulam pelo mundo";"Fluxo de tecnologias atraves das fronteiras";"Fluxo de capital financeiro global";"Fluxo de imagens e midias";"Fluxo de ideologias politicas";"a";"Appadurai ('Modernity at Large', 1996) propoe cinco dimensoes dos fluxos culturais globais: (1) Ethnoscapes: fluxo de pessoas (migrantes, refugiados, diaspora); (2) Technoscapes: tecnologias; (3) Financescapes: capital; (4) Mediascapes: imagens e narrativas midiaticas; (5) Ideoscapes: ideologias e conceitos politicos. Esses fluxos sao disjuntos e geram a cultura global hibrida.";""
"4336";"multipla";"Sociologia";"Sociologia da Modernidade";"Reflexividade";"Dificil";"Vestibular";"2024";"Anthony Giddens caracteriza a modernidade tardia pela 'reflexividade', que significa:";"O conhecimento e as praticas sociais sao constantemente revistos e modificados a luz de novas informacoes";"A populacao reflete apenas sobre o passado";"As ciencias sociais nao produzem conhecimento confiavel";"A sociedade e determinada por forcas inconscientes";"A tradicao substitui a razao nas sociedades modernas";"a";"Giddens, em 'As Consequencias da Modernidade' (1990), propoe que a reflexividade e uma caracteristica central da modernidade: o conhecimento sobre a sociedade (incluindo a ciencia social) circula de volta para a sociedade e modifica seu comportamento. Nao ha ponto de Arquimedes externo — o conhecimento e constantemente revisado. Isso produz insegurança ontologica (o mundo e imprevisivel) mas tambem potencial emancipatorio.";""
"4337";"multipla";"Matematica";"Numeros";"Numeros reais e irracionais";"Facil";"Vestibular";"2024";"O numero raiz(2) e:";"Irracional — nao pode ser expresso como fracao de inteiros";"Racional com decimal finito";"Inteiro";"Complexo";"Natural";"a";"raiz(2) e um numero irracional: sua representacao decimal e infinita e nao-periodica (~1,41421356...). A prova e classica: suponha que raiz(2) = p/q (frac irredutivel). Entao 2 = p^2/q^2, logo p^2 = 2q^2. P e par, digamos p=2k. Entao 4k^2 = 2q^2, q^2 = 2k^2 — q tambem e par, contradizendo a irredutibilidade. Prova por contradicao dos pitagoricos.";""
"4338";"multipla";"Matematica";"Geometria Plana";"Triangulo equilatero";"Facil";"Vestibular";"2024";"Um triangulo equilatero tem todos os angulos iguais a:";"60 graus";"90 graus";"45 graus";"120 graus";"30 graus";"a";"Em um triangulo equilatero, todos os tres lados sao iguais e todos os tres angulos sao iguais. Soma dos angulos internos = 180 graus / 3 = 60 graus cada.";""
"4339";"multipla";"Matematica";"Funcoes";"Zeros da funcao";"Facil";"Vestibular";"2024";"O zero (raiz) de f(x) = 3x - 6 e:";"x = 2";"x = 6";"x = 3";"x = -2";"x = 1/2";"a";"f(x) = 0 => 3x - 6 = 0 => 3x = 6 => x = 2.";""
"4340";"multipla";"Fisica";"Mecanica";"Lancamento vertical";"Medio";"Vestibular";"2024";"Uma pedra e lancada verticalmente para cima com velocidade inicial de 20 m/s. A altura maxima atingida (g=10 m/s2) e:";"20 m";"40 m";"200 m";"10 m";"4 m";"a";"Na altura maxima, v = 0. Equacao de Torricelli: v^2 = v0^2 - 2gh => 0 = 400 - 20h => h = 400/20 = 20 m.";""
"4341";"multipla";"Fisica";"Eletricidade";"Transformacoes de energia";"Facil";"Vestibular";"2024";"Numa lampada incandescente, a energia eletrica e convertida principalmente em:";"Calor e luz (a maior parte e calor — baixa eficiencia)";"Energia cinetica";"Energia potencial";"Energia quimica";"Energia nuclear";"a";"Na lampada incandescente, a corrente aquece o filamento de tungstênio ate ~2500K (incandescencia). Apenas ~5-10% da energia eletrica e convertida em luz visivel; o restante e emitido como calor (infravermelho). Por isso as lampadas incandescentes foram substituidas por fluorescentes (~25% de eficiencia) e LEDs (~50% de eficiencia).";""
"4342";"multipla";"Quimica";"Quimica Geral";"Reacoes organicas em cotidiano";"Facil";"Vestibular";"2024";"O vinagre e uma solucao aquosa de:";"Acido acetico (CH3COOH) a ~5%";"Acido cloridrico";"Acido sulfurico";"Alcool etilico";"Acido lactico";"a";"O vinagre e produzido pela oxidacao do alcool etilico (fermentacao acetica): C2H5OH + O2 -> CH3COOH + H2O. Contem ~5% de acido acetico. E utilizado na culinaria como condimento e conservante. O acido acetico e um acido carboxilico de dois carbonos (acido etanoico), com pH ~2,4.";""
"4343";"multipla";"Biologia";"Fisiologia Humana";"Doencas cardiovasculares";"Facil";"Vestibular";"2024";"A arteriosclerose e o endurecimento das arterias causado principalmente pelo:";"Acumulo de placas de ateroma (colesterol LDL, calcio e celulas inflamatorias) na parede arterial";"Bacterias na corrente sanguinea";"Excesso de potassio na dieta";"Deficiencia de vitamina C";"Virus que atacam as celulas endoteliais";"a";"A aterosclerose e uma doenca inflamatorio-degenerativa das arterias: deposito de gordura (principalmente LDL oxidado), celulas inflamatorias e calcio formam placas de ateroma que estreitam e endurecem as arterias. Fatores de risco: hipertensao, diabetes, tabagismo, obesidade, dieta rica em gordura saturada, sedentarismo. Complicacoes: infarto do miocardio, AVC, insuficiencia renal.";""
"4344";"multipla";"Biologia";"Ecologia";"Poluicao do ar";"Facil";"Vestibular";"2024";"A chuva acida e causada principalmente pela emissao de:";"SO2 (dioxido de enxofre) e NOx (oxidos de nitrogenio) por industrias e veiculos";"CO2 de queimadas na Amazonia";"Metano de aterros sanitarios";"CFCs de equipamentos de refrigeracao";"Vapor d'agua de usinas termoeletricas";"a";"A chuva acida forma-se quando SO2 (queima de carvao com enxofre) e NOx (motores a combustao) reagem com a agua atmosferica formando acidos (H2SO4 e HNO3). O pH pode cair para 3-4 (normal: 5,6). Afeta lagos (acidificacao, morte de peixes), florestas (lixivacao de nutrientes, morte de arvores), monumentos (corrosao de pedra calcaria) e saude humana.";""
"4345";"multipla";"Historia";"Historia do Brasil";"Escravidao indigena";"Medio";"Vestibular";"2024";"A escravidao indigena no Brasil colonial foi combatida principalmente pelos:";"Jesuitas — que propugnavam a catequizacao e protecao dos indigenas, em conflito com os colonos";"Governo da Coroa portuguesa desde o inicio";"Comerciantes holandeses";"Proprios colonos escravistas";"Tropas mercenarias indigenas";"a";"Os jesuitas (Companhia de Jesus, fundada por Inacio de Loyola) chegaram ao Brasil em 1549 e criaram as missoes indigenas (reducoes), onde catequizavam e protegiam os indigenas do trabalho forcado. Isso gerou conflito constante com os colonos, que queriam mao de obra indigena. O marques de Pombal expulsou os jesuitas do Brasil e de todas as colonias portuguesas em 1759.";""
"4346";"multipla";"Historia";"Historia Geral";"Liga das Nacoes";"Medio";"Vestibular";"2024";"A Liga das Nacoes, criada apos a Primeira Guerra Mundial, fracassou principalmente por:";"Nao ter adesao dos EUA, nao ter forcas militares proprias e fracassar em conter as agressoes do Eixo";"Ter sido destruida na Segunda Guerra";"Ter excluido a Alemanha de qualquer participacao";"Ser dominada pela URSS";"Nao ter incluido o Brasil como membro";"a";"A Liga das Nacoes (1920-1946), proposta por Woodrow Wilson (14 pontos), foi criada pelo Tratado de Versalhes. Fracassos: (1) O Senado americano recusou a adesao dos EUA (isolacionismo); (2) Sem forca militar, nao podia coagir estados; (3) Falhou em conter a invasao da Manchuria pelo Japao (1931), da Etiopia pela Italia (1935-36) e a expansao da Alemanha nazista. Foi sucedida pela ONU em 1945.";""
"4347";"multipla";"Historia";"Historia do Brasil";"Ditadura — Milagre Economico";"Medio";"Vestibular";"2024";"O 'milagre economico' brasileiro (1968-1973) caracterizou-se por:";"Alto crescimento do PIB (~10% ao ano), mas com concentracao de renda e aumento da desigualdade";"Crescimento igualitario com distribuicao de renda";"Industrializacao sem endividamento externo";"Crescimento baseado na reforma agraria";"Autonomia tecnologica completa";"a";"O milagre economico (governo Medici) teve crescimento medio do PIB de ~11%/ano, impulsionado por: capital externo (endividamento), petroleo barato, exportacoes diversificadas, grandes obras (BR-1, Itaipu, Angra). A contrapartida: concentracao de renda (os ricos ficaram mais ricos), repracao politica (silenciou criticas com crescimento), endividamento externo que gerou a crise dos anos 1980.";""
