"id";"tipo";"disc";"tema";"subtema";"dif";"fonte";"ano";"xp";"enunciado";"a";"b";"c";"d";"e";"ok";"exp"
"ENEM_2020_Q041";"multipla";"Português";"Interpretação e Produção de Texto";"Mídias digitais";"Médio";"ENEM";"2020";"15";"Policarpo Quaresma, cidadão brasileiro, funcionário público, certo de que a língua portuguesa é emprestada ao Brasil; certo também de que, por esse fato, o falar e o escrever em geral, sobretudo no campo das letras, se veem na humilhante contingência de sofrer continuamente censuras ásperas dos proprietários da língua; sabendo, além, que, dentro do nosso país, os autores e os escritores, com especialidade os gramáticos, não se entendem no tocante à correção gramatical, vendo-se, diariamente, surgir azedas polêmicas entre os mais profundos estudiosos do nosso idioma — usando do direito que lhe confere a Constituição, vem pedir que o Congresso Nacional decrete o tupi-guarani como língua oficial e nacional do povo brasileiro. BARRETO. L. **Triste fim de Policarpo Quaresma**. Disponível em: www.dominiopublico.gov.br. Acesso em: 26 jun. 2012";"Situação social de enunciação representada.";"Divergência teórica entre gramáticos e literatos.";"Pouca representatividade das línguas indígenas.";"Atitude irônica diante da língua dos colonizadores.";"Tentativa de solicitação do documento demandado.";"a";"A resposta correta é a alternativa A. Situação social de enunciação representada."
"ENEM_2020_Q042";"multipla";"Inglês";"Língua Estrangeira (Inglês)";"Comprensión lectora";"Médio";"ENEM";"2020";"15";"Atualmente os jovens estão imersos numa sociedade permeada pela tecnologia. Nesse contexto, os jogos digitais são artefatos muito empregados. Videogames ativos ou exergames foram introduzidos como forma de permitir que o corpo controlasse tais jogos. Como resultado, passaram a ser vistos como uma ferramenta auxiliar na adoção de um estilo de vida menos sedentário, com efeitos positivos sobre a saúde. Tem-se defendido que os exergames podem contribuir para a prática regular de atividade física moderada, bem como promover a interação entre jogadores, reduzindo o sentimento de isolamento social. Por outro lado, argumenta-se que os exergames não podem substituir a experiência real das práticas corporais, pois não motivam a longo prazo a prática permanente de atividades físicas. FINCO, M. D.: REATEGUI. E. B.; ZARO, M.A. Laboratório de exorgames: um espaço complementar para as aulas de educação física. **Movimento**. n. 3, 2015 (adaptado).";"Exercitação física, promovendo a saúde.";"Vivência de exercícios físicos sistemáticos.";"Envolvimento com atividades físicas ao longo da vida.";"Jogo por meio de comandos fornecidos pelo videogame.";"Disputa entre jogadores, contribuindo para o individualismo.";"a";"A resposta correta é a alternativa A. Exercitação física, promovendo a saúde."
"ENEM_2020_Q043";"multipla";"Literatura";"Literatura Brasileira";"Modernismo";"Médio";"ENEM";"2020";"15";"Quando quis agilizar o processo de seleção de novos alunos, a tradicional faculdade britânica de medicina St. George usou um software para definir quem deveria ser entrevistado. Ao reproduzir a forma como os funcionários faziam essa escolha, o programa eliminou, de cara, 60 de 2.000 candidatos. Só por causa do sexo ou da origem racial, numa dedução baseada em sobrenome e local de nascimento. Um estudo sobre o caso foi publicado em 1988, mas, 25 anos depois, outra pesquisa apontou que esse tipo de discriminação segue firme. O exemplo recente envolve o buscador do Google: ao digitar nomes comuns entre negros dos EUA, a chance de os anúncios automáticos oferecerem checagem de antecedentes criminais pode aumentar 25%. E pode piorar com a pergunta “detido?” logo após a palavra procurada. **Disponível em:** https://tab.uol.com.br. _Acesso em: 11 ago. 2017 (adaptado)._";"Agilidade dos softwares.";"Passar dos anos.";"Linguagem.";"Preconceito.";"Educação.";"d";"A resposta correta é a alternativa D. Preconceito."
"ENEM_2020_Q044";"multipla";"Literatura";"Literatura Brasileira";"Arte contemporânea";"Médio";"ENEM";"2020";"15";"![](https://enem.dev/2020/questions/44/2676a98e-0b86-425d-a2ed-429ede0b2438.png)";"A família que adota é mais feliz.";"A adoção tardia é muito positiva.";"As famílias preferem adotar bebês.";"A adoção de adolescentes é mais simples.";"Os filhos adotivos são companheiros dos pais.";"b";"A resposta correta é a alternativa B. A adoção tardia é muito positiva."
"ENEM_2020_Q045";"multipla";"Literatura";"Literatura Portuguesa";"Comprensión lectora";"Médio";"ENEM";"2020";"15";"Viajo Curitiba das conferências positivistas, elas são onze em Curitiba, há treze no mundo inteiro; do tocador de realejo que não roda a manivela desde que o macaquinho morreu; dos bravos soldados do fogo que passam chispando no carro vermelho atrás do incêndio que ninguém não viu, esta Curitiba e a do cachorroquente com chope duplo no Buraco do Tatu eu viajo. Curitiba, aquela do Burro Brabo, um cidadão misterioso morreu nos braços da Rosicler, quem foi? quem não foi? foi o reizinho do Sião; da Ponte Preta da estação, a única ponte da cidade, sem rio por baixo, esta Curitiba viajo. Curitiba sem pinheiro ou céu azul, pelo que vosmecê é — província, cárcere, lar—, esta Curitiba, e não a outra para inglês ver, com amor eu viajo, viajo, viajo. **TREVISAN. D**. _Em busca de Curitiba perdida_. Rio de Janeiro: Record. 1992.";"Destituido de afetividade, que ironiza os costumes e as tradições da sociedade curitibana.";"Marcado pela negatividade, que busca desconstruir perspectivas habituais de representação da cidade.";"Carregado de melancolia, que constata a falta de identidade cultural diante dos impactos da urbanização.";"Embevecido pela simplicidade do cenário, indiferente à descrição de elementos de reconhecido valor histórico.";"Distanciado dos elementos narrados, que recorre ao ponto de vista do viajante como expressão de estranhamento.";"b";"A resposta correta é a alternativa B. Marcado pela negatividade, que busca desconstruir perspectivas habituais de representação da cidade."
"ENEM_2020_Q045";"multipla";"Espanhol";"Língua Estrangeira (Espanhol)";"Arte contemporânea";"Médio";"ENEM";"2020";"15";"Viajo Curitiba das conferências positivistas, elas são onze em Curitiba, há treze no mundo inteiro; do tocador de realejo que não roda a manivela desde que o macaquinho morreu; dos bravos soldados do fogo que passam chispando no carro vermelho atrás do incêndio que ninguém não viu, esta Curitiba e a do cachorroquente com chope duplo no Buraco do Tatu eu viajo. Curitiba, aquela do Burro Brabo, um cidadão misterioso morreu nos braços da Rosicler, quem foi? quem não foi? foi o reizinho do Sião; da Ponte Preta da estação, a única ponte da cidade, sem rio por baixo, esta Curitiba viajo. Curitiba sem pinheiro ou céu azul, pelo que vosmecê é — província, cárcere, lar—, esta Curitiba, e não a outra para inglês ver, com amor eu viajo, viajo, viajo. **TREVISAN. D**. _Em busca de Curitiba perdida_. Rio de Janeiro: Record. 1992.";"Destituido de afetividade, que ironiza os costumes e as tradições da sociedade curitibana.";"Marcado pela negatividade, que busca desconstruir perspectivas habituais de representação da cidade.";"Carregado de melancolia, que constata a falta de identidade cultural diante dos impactos da urbanização.";"Embevecido pela simplicidade do cenário, indiferente à descrição de elementos de reconhecido valor histórico.";"Distanciado dos elementos narrados, que recorre ao ponto de vista do viajante como expressão de estranhamento.";"b";"A resposta correta é a alternativa B. Marcado pela negatividade, que busca desconstruir perspectivas habituais de representação da cidade."
"ENEM_2020_Q046";"multipla";"História";"Língua Estrangeira (Inglês)";"Análise sintática";"Médio";"ENEM";"2020";"15";"Embora inegáveis os benefícios que ambas as economias têm auferido do intercâmbio comercial, o Brasil tem reiterado seu objetivo de desenvolver com a China uma relação comercial menos assimétrica. Os números revelam com clareza a assimetria. As exportações brasileiras de produtos básicos, especialmente soja, minério de ferro e petróleo, compõem, dependendo do ano, algo entre 75% e 80% da pauta, ao passo que as importações brasileiras consistem, aproximadamente, em 95% de produtos industrializados chineses, que vão desde os mais variados bens de consumo até máquinas e equipamentos de alto valor. LEÃO, V. C. Prefácio. In: CINTRA, M. A. M.; SILVA FILHO, E. B.; PINTO, E. C. (Org.). **China em transformação**: dimensões econômicas e geopolíticas do desenvolvimento. Rio de Janeiro: Ipea, 2015.";"Expansão do setor extrativista.";"Incremento da atividade agrícola.";"Diversificação da matriz energética.";"Fortalecimento da pesquisa científica.";"Monitoramento do fluxo alfandegário.";"d";"A resposta correta é a alternativa D. Fortalecimento da pesquisa científica."
"ENEM_2020_Q047";"multipla";"História";"Língua Estrangeira (Inglês)";"Comprensión lectora";"Médio";"ENEM";"2020";"15";"As estatísticas mais recentes do Brasil rural revelam um paradoxo que interessa a toda sociedade: o emprego de natureza agrícola definha em praticamente todo o país, mas a população residente no campo voltou a crescer; ou pelo menos parou de cair. Esses sinais trocados sugerem que a dinâmica agrícola, embora fundamental, já não determina sozinha os rumos da demografia no campo. Esse novo cenário é explicado em parte pelo incremento do emprego não agrícola no campo. Ao mesmo tempo, aumentou a massa de desempregados, inativos e aposentados que mantêm residência rural. SILVA, J.G. Velhos e novos mitos do rural brasileiro. **Estudos Avançados**, n. 43, dez. 2001.";"Heterogeneidade do modo de vida agrário.";"Redução do fluxo populacional nas cidades.";"Correlação entre força de trabalho e migração sazonal.";"Indissociabilidade entre local de moradia e acesso à renda.";"Desregulamentação das propriedades nas zonas de fronteira.";"a";"A resposta correta é a alternativa A. Heterogeneidade do modo de vida agrário."
"ENEM_2020_Q048";"multipla";"História";"Interpretação e Produção de Texto";"Reading comprehension";"Médio";"ENEM";"2020";"15";"Nas últimas décadas, uma acentuada feminização no mundo do trabalho vem ocorrendo. Se a participação masculina pouco cresceu no período pós-1970, a intensificação da inserção das mulheres foi o traço marcante. Entretanto, essa presença feminina se dá mais no espaço dos empregos precários, onde a exploração, em grande medida, se encontra mais acentuada. NOGUEIRA, C. M. As trabalhadoras do telemarketing: uma nova divisão sexual do trabalho? In: ANTUNES, R. _et al_. **Infoproletários**: degradação real do trabalho virtual. São Paulo: Boitempo, 2009.";"Estagnação de direitos adquiridos e do anacronismo da legislação vigente.";"Manutenção do status quo gerencial e dos padrões de socialização familiar.";"Desestruturação da herança patriarcal e das mudanças do perfil ocupacional.";"Disputas na composição sindical e da presença na esfera político-partidária.";"Exigências de aperfeiçoamento profissional e de habilidades na competência diretiva.";"b";"A resposta correta é a alternativa B. Manutenção do status quo gerencial e dos padrões de socialização familiar."
"ENEM_2020_Q049";"multipla";"História";"Literatura Brasileira";"Mídias digitais";"Médio";"ENEM";"2020";"15";"A propriedade compreende, em seu conteúdo e alcance, além do tradicional direito de uso, gozo e disposição por parte de seu titular, a obrigatoriedade do atendimento de sua função social, cuja definição é inseparável do requisito obrigatório do uso racional da propriedade e dos recursos ambientais que lhe são integrantes. O proprietário, como membro integrante da comunidade, se sujeita a obrigações crescentes que, ultrapassando os limites do direitos de vizinhança, no âmbito do direito privado, abrangem o campo dos direitos da coletividade, visando o bem-estar geral, no âmbito do direito público. JELINEK, R. **O princípio da função social da propriedade e sua repercussão sobre o sistema do Código Civil**. Disponível em: www.mp.rs.gov.br. Acesso em: 20 fev. 2013.";"Reverter o processo de privatização fundiária.";"Ressaltar a inviabilidade da produção latifundiária.";"Defender a desapropriação dos espaços improdutivos.";"Impedir a produção exportadora nas terras agriculturáveis.";"Coibir o funcionamento de empresas agroindustriais no campo.";"c";"A resposta correta é a alternativa C. Defender a desapropriação dos espaços improdutivos."
"ENEM_2020_Q050";"multipla";"História";"Interpretação e Produção de Texto";"Mídias digitais";"Médio";"ENEM";"2020";"15";"A expansão das cidades e a formação das aglomerações urbanas no Brasil foram marcadas pela produção industrial e pela consolidação das metrópoles como locais de seu desenvolvimento. Na segunda metade do século XX, as metrópoles brasileiras estenderam-se por áreas de ocupação contínua, configurando densas regiões urbanizadas. MOURA, R. **Arranjos urbano-regionais no Brasil**: especificidades e reprodução de padrões. Disponível em: www.ub.edu. Acesso em: 11 fev. 2015.";"Valorização da escala local.";"Crescimento das áreas periféricas.";"Densificação do transporte ferroviário.";"Predomínio do planejamento estadual.";"Inibição de consórcios intermunicipais.";"b";"A resposta correta é a alternativa B. Crescimento das áreas periféricas."
"ENEM_2020_Q051";"multipla";"História";"Língua Estrangeira (Espanhol)";"Arte contemporânea";"Médio";"ENEM";"2020";"15";"**Zona de pastoreio e cultura do algodão e cereais do agreste (1963)** ![](https://enem.dev/2020/questions/51/527a4568-c098-422a-bdaa-2c8f6bc42b84.jpg) ANDRADE, M. C. **A terra e o homem no Nordeste**. São Paulo: Brasiliense, 1963.";"Separação pelo tipo de solo.";"Exportação da colheita sazonal.";"Priorização da tecnologia moderna.";"Adequação pelo tempo da natureza.";"Intensificação da atividade pecuária.";"d";"A resposta correta é a alternativa D. Adequação pelo tempo da natureza."
"ENEM_2020_Q052";"multipla";"História";"Língua Estrangeira (Espanhol)";"Reading comprehension";"Médio";"ENEM";"2020";"15";"Dois grandes eventos históricos tornaram possível um caso como o de Menocchio: a invenção da imprensa e a Reforma. A imprensa lhe permitiu confrontar os livros com a tradição oral em que havia crescido e lhe forneceu as palavras que nele conviviam. A Reforma lhe deu audácia para comunicar o que pensava ao padre do vilarejo, conterrâneos, inquisidores — mesmo não tendo conseguido dizer tudo diante do papa, dos cardeais e dos príncipes, como queria. GINZBURG, C. **O queijo e os vermes**: o cotidiano e as ideias de um moleiro perseguido pela Inquisição. São Paulo: Cia. das Letras, 2006.";"Consulta pública das bibliotecas reais.";"Sofisticação barroca do ritual litúrgico.";"Aceitação popular da educação secular.";"Interpretação autônoma dos textos bíblicos.";"Correção doutrinária das heresias medievais.";"d";"A resposta correta é a alternativa D. Interpretação autônoma dos textos bíblicos."
"ENEM_2020_Q053";"multipla";"Sociologia";"Artes e Cultura";"Coesão e coerência";"Médio";"ENEM";"2020";"15";"“Devo estar chegando perto do centro da Terra. Deixe ver: deve ter sido mais de seis mil quilômetros, por aí…” (como se vê, Alice tinha aprendido uma porção de coisas desse tipo na escola, e embora essa não fosse uma oportunidade lá muito boa de demonstrar conhecimentos, já que não havia ninguém por perto para escutá-la, em todo caso era bom praticar um pouco) “… sim, deve ser mais ou menos essa a distância… mas então qual seria a latitude ou longitude em que estou?” (Alice não tinha a menor ideia do que fosse latitude ou longitude, mas acho que eram palavras muito imponentes). CARROLL, L. Aventuras de Alice: no País das Maravilhas, Através do espelho e outros textos. São Paulo: Summus, 1980.";"Ao tipo de projeção cartográfica.";"Aos contornos dos fusos horários.";"À localização do norte magnético.";"Aos referenciais de posição relativa.";"Às distorções das formas continentais.";"d";"A resposta correta é a alternativa D. Aos referenciais de posição relativa."
