"id";"tipo";"disciplina";"tema";"subtema";"dificuldade";"fonte";"ano";"enunciado";"alternativa_a";"alternativa_b";"alternativa_c";"alternativa_d";"alternativa_e";"resposta_correta";"explicacao";"resposta"
"3317";"multipla";"Literatura";"Literatura Brasileira";"Romantismo — 1ª geração";"Médio";"Vestibular";"2023";"A 1ª geração romântica no Brasil (1836-1853), representada por Gonçalves de Magalhães e Gonçalves Dias, é marcada pelo:";"Pessimismo e escapismo";"Realismo e crítica social";"Indianismo e nacionalismo";"Sensualidade e erotismo";"Experimentalismo formal";"c";"A 1ª geração romântica brasileira (inaugurada pelo 'Suspiros Poéticos' de Gonçalves de Magalhães, 1836) enfatizou o indianismo (valorização do índio como símbolo nacional) e o nacionalismo, em busca de uma identidade literária brasileira.";""
"3318";"multipla";"Matemática";"Estatística";"Representação gráfica";"Fácil";"Vestibular";"2024";"Um histograma é utilizado para representar:";"Dados qualitativos nominais";"Relação entre duas variáveis categóricas";"Distribuição de frequências de dados contínuos ou agrupados em classes";"Proporções em dados categóricos";"Tendências ao longo do tempo";"c";"O histograma representa a distribuição de frequências de dados quantitativos contínuos ou agrupados em intervalos (classes). Gráfico de barras: dados discretos/qualitativos. Pizza: proporções. Linha: tendência temporal.";""
"3319";"multipla";"Física";"Elétrica";"Circuitos RC";"Médio";"Vestibular";"2023";"Em um circuito RC (resistor e capacitor em série), a constante de tempo τ = RC representa:";"O tempo para o capacitor se carregar completamente";"O tempo para a corrente atingir zero";"O tempo para o capacitor atingir 63% da carga máxima";"O período de oscilação";"A frequência de ressonância";"c";"A constante de tempo τ = RC é o tempo para o capacitor atingir ~63% (1-1/e) da carga máxima ao carregar, ou reduzir para ~37% ao descarregar. Após 5τ, considera-se carregado/descarregado completamente.";""
"3320";"multipla";"Química";"Ambiental";"Smog e poluição do ar";"Médio";"Vestibular";"2024";"O smog fotoquímico, típico de cidades como Los Angeles e São Paulo, é formado pela reação de:";"SO₂ com o vapor d'água";"NOₓ e hidrocarbonetos com a luz solar, formando ozônio e outros oxidantes";"CO₂ com a umidade atmosférica";"Partículas de carvão com o nitrogênio";"Metano com o oxigênio atmosférico";"b";"O smog fotoquímico é gerado pela reação de óxidos de nitrogênio (NOₓ) e compostos orgânicos voláteis (COVs) de veículos, sob ação da luz solar, produzindo ozônio (O₃) e peroxiacetil nitrato (PAN) — irritantes e prejudiciais à saúde.";""
"3321";"multipla";"Biologia";"Genética";"Projeto Genoma Humano";"Médio";"Vestibular";"2023";"O Projeto Genoma Humano (concluído em 2003) revelou que o genoma humano contém aproximadamente quantos genes codificadores de proteínas?";"100.000";"1.000.000";"20.000 a 25.000";"3.000.000";"50.000";"c";"O Projeto Genoma Humano surpreendeu ao revelar que temos apenas ~20.000-25.000 genes codificadores de proteínas (menos que esperado), em ~3 bilhões de pares de bases. A maioria do DNA (>98%) é não-codificante.";""
"3322";"multipla";"Filosofia";"Filosofia da história";"Hegel";"Difícil";"Vestibular";"2024";"A dialética de Hegel propõe que o desenvolvimento histórico ocorre por meio de:";"Ciclos repetitivos sem progresso";"Progresso linear e contínuo sem conflitos";"Tese, antítese e síntese — superação dos contrários";"Vontade divina imutável";"Determinismo econômico";"c";"A dialética hegeliana: tese (proposição inicial), antítese (negação/contradição), síntese (superação que conserva e eleva — Aufhebung). A história avança por contradições resolvidas em sínteses superiores, realizando o Espírito Absoluto.";""
"3323";"multipla";"Sociologia";"Globalização";"Organizações internacionais";"Fácil";"Vestibular";"2023";"A ONU (Organização das Nações Unidas) foi fundada após a Segunda Guerra Mundial com o objetivo principal de:";"Promover o livre comércio entre as nações";"Criar uma moeda única mundial";"Manter a paz e a segurança internacionais";"Unificar todos os países sob um único governo";"Combater o comunismo";"c";"A ONU foi fundada em 1945 após a 2ª Guerra, substituindo a Liga das Nações. Seus propósitos são: manutenção da paz e segurança, promoção dos direitos humanos, desenvolvimento econômico e social e cooperação internacional.";""
"3324";"multipla";"Literatura";"Literatura Universal";"Shakespeare";"Médio";"Vestibular";"2024";"William Shakespeare é considerado o maior dramaturgo da língua inglesa. 'Hamlet' traz a famosa frase 'Ser ou não ser, eis a questão'. Essa reflexão de Hamlet expressa:";"Dúvida sobre a existência de Deus";"Dilema existencial entre aceitar o sofrimento ou agir/morrer";"Debate político sobre a monarquia";"Reflexão sobre a fidelidade amorosa";"Questionamento sobre a honra guerreira";"b";"'Ser ou não ser' é um monólogo filosófico de Hamlet questionando se é melhor suportar o sofrimento da vida ou resistir e agir (possivelmente morrer). É uma das mais famosas reflexões existenciais da literatura ocidental.";""
"3325";"multipla";"Matemática";"Progressões";"Soma de PA infinita";"Médio";"Vestibular";"2023";"A soma dos termos de uma PG infinita de razão |q| < 1 é dada por S = a₁/(1-q). A soma da PG (1, 1/2, 1/4, ...) é:";"1";"2";"3";"∞";"1/2";"b";"a₁ = 1, q = 1/2. S = 1/(1-1/2) = 1/(1/2) = 2.";""
"3326";"multipla";"Física";"Ondulatória";"Refração de ondas";"Médio";"Vestibular";"2024";"Quando uma onda passa de um meio menos denso para um mais denso, sua velocidade:";"Aumenta";"Permanece igual";"Diminui";"Torna-se zero";"Torna-se infinita";"c";"A velocidade de propagação de ondas diminui ao passar para um meio mais denso/com maior índice de refração. A frequência permanece constante; o comprimento de onda diminui proporcionalmente à velocidade.";""
"3327";"multipla";"Química";"Analítica";"Absorção atômica";"Difícil";"Vestibular";"2023";"A espectroscopia de absorção atômica é usada para:";"Determinar estruturas moleculares orgânicas";"Medir concentrações de metais em amostras com alta sensibilidade";"Analisar gases atmosféricos";"Identificar ânions em soluções";"Medir a viscosidade de fluidos";"b";"A absorção atômica atomiza a amostra e mede a absorção de luz por átomos livres, sendo altamente sensível para determinar concentrações de metais (Pb, Cd, Hg) em água, sangue, alimentos — análise ambiental e toxicológica.";""
"3328";"multipla";"Biologia";"Ecologia";"Nicho ecológico";"Médio";"Vestibular";"2024";"O nicho ecológico de uma espécie refere-se a:";"Apenas ao local físico onde a espécie vive";"Toda a função ecológica da espécie no ecossistema (o que come, quando, como se reproduz, etc.)";"A área geográfica de ocorrência da espécie";"O número de indivíduos de uma espécie";"A espécie com que mais compete";"b";"Nicho ecológico (Hutchinson): o conjunto multidimensional de fatores bióticos e abióticos dentro dos quais a espécie pode sobreviver e reproduzir — onde vive, o que come, horário de atividade, com quem compete, etc. Diferente de habitat (local físico).";""
"3329";"multipla";"Filosofia";"Filosofia Política";"Direito de resistência";"Médio";"Vestibular";"2023";"Para John Locke, o povo tem direito a resistir e depor o governo quando este:";"Não promove o crescimento econômico";"Viola os direitos naturais (vida, liberdade e propriedade) dos cidadãos";"Perde eleições";"Não cumpre promessas eleitorais";"Tem guerras com outros países";"b";"Para Locke, o governo existe para proteger os direitos naturais. Se viola esses direitos sistematicamente, o povo tem o direito de resistência e revolução — fundamento do liberalismo político e das revoluções americana e francesa.";""
"3330";"multipla";"Sociologia";"Trabalho";"Fordismo";"Médio";"Vestibular";"2024";"O fordismo caracterizou-se pela:";"Produção artesanal e individualizada";"Produção em massa em linha de montagem com alta especialização e salários altos";"Externalização da produção para países emergentes";"Produção just-in-time e flexível";"Ausência de tecnologia na produção";"b";"O fordismo (Henry Ford, 1913): produção em massa em linha de montagem; trabalhador especializado em uma tarefa repetitiva; salários altos para criar consumidores (Modelo T acessível); rígida hierarquia e controle do tempo de trabalho (taylorismo).";""
"3331";"multipla";"Literatura";"Literatura Brasileira";"Carlos Drummond de Andrade";"Fácil";"Vestibular";"2023";"A obra 'Alguma Poesia' (1930) marcou a estreia poética de Carlos Drummond de Andrade. O poema de abertura contém o verso: 'No meio do caminho tinha uma pedra'. Esse verso ficou famoso por:";"Usar métrica perfeita";"Exaltar a natureza brasileira";"Sua aparente simplicidade que esconde profundidade simbólica e a ruptura com o verso formal";"Ser o primeiro poema político do modernismo";"Usar extensas metáforas barrocas";"c";"A pedra no caminho tornou-se um dos mais discutidos versos brasileiros: a repetição obsessiva e a aparente trivialidade escondem profundidade simbólica. A linguagem coloquial e a ruptura com o verso alexandrino parnasiano marcam o modernismo.";""
"3332";"multipla";"Matemática";"Funções";"Ponto fixo";"Médio";"Vestibular";"2024";"Uma função f é tal que f(f(x)) = x para todo x do domínio. Isso significa que f é sua própria:";"Derivada";"Primitiva";"Inversa";"Composta";"Simétrica";"c";"Se f(f(x)) = x, então f ∘ f = identidade, o que significa que f é sua própria inversa (f⁻¹ = f). Exemplos: f(x) = -x, f(x) = 1/x.";""
"3333";"multipla";"Física";"Eletromagnetismo";"Ondas de rádio";"Fácil";"Vestibular";"2023";"As ondas de rádio pertencem ao espectro:";"Sonoro";"Eletromagnético";"Mecânico";"Gravitacional";"Nuclear";"b";"Ondas de rádio são ondas eletromagnéticas de baixa frequência (alta comprimento de onda), que se propagam à velocidade da luz no vácuo. Não precisam de meio material para se propagar.";""
"3334";"multipla";"Química";"Orgânica";"Combustíveis";"Fácil";"Vestibular";"2024";"O Proálcool, programa brasileiro lançado em 1975, incentivou a produção de etanol de cana-de-açúcar como alternativa ao:";"Carvão mineral";"Urânio";"Petróleo (gasolina)";"Gás natural";"Energia eólica";"c";"O Proálcool (1975) foi criado em resposta à crise do petróleo de 1973, incentivando a produção de etanol de cana para reduzir a dependência do petróleo importado. Tornou o Brasil referência em biocombustíveis.";""
"3335";"multipla";"Biologia";"Anatomia";"Sistema reprodutor feminino";"Fácil";"Vestibular";"2023";"A ovulação é o processo em que:";"O óvulo é fertilizado pelo espermatozoide";"O embrião se implanta no útero";"Um óvulo maduro é liberado do folículo ovariano para a tuba uterina";"O endométrio é descamado na menstruação";"Os hormônios são produzidos pelo útero";"c";"A ovulação ocorre em torno do 14º dia do ciclo menstrual: o folículo de Graaf se rompe sob estímulo do LH (pico), liberando o óvulo secundário para a tuba uterina, onde pode ser fertilizado.";""
"3336";"multipla";"Filosofia";"Teoria do conhecimento";"Platão e o mito da reminiscência";"Médio";"Vestibular";"2024";"No mito da reminiscência, Platão argumenta que aprender é, na verdade:";"Adquirir conhecimento novo pela experiência";"Memorizar fatos empiricamente observados";"Recordar conhecimentos que a alma já possui da existência prévia no mundo das Ideias";"Criar conceitos arbitrários";"Seguir a autoridade dos mestres";"c";"No Mênon, Sócrates demonstra que um escravo sem educação consegue resolver um problema de geometria através de perguntas — prova de que o conhecimento é reminiscência (anamnese) de verdades que a alma conheceu antes de encarnar.";""
"3337";"multipla";"Sociologia";"Estratificação";"Castas";"Médio";"Vestibular";"2023";"O sistema de castas, historicamente presente na Índia, é caracterizado por:";"Alta mobilidade social";"Estratificação rígida por nascimento, sem possibilidade de mudança de casta";"Igualdade formal entre os grupos";"Seleção baseada em mérito";"Organização por riqueza acumulada";"b";"O sistema de castas é fechado: a posição social é determinada pelo nascimento e há endogamia (casamento dentro da casta). Brahmanismo, hinduísmo e a Constituição indiana de 1947 (que o proibiu legalmente) são referências.";""
"3338";"multipla";"Literatura";"Literatura Universal";"Existencialismo na literatura";"Médio";"Vestibular";"2024";"'A Náusea' de Jean-Paul Sartre e 'O Estrangeiro' de Albert Camus são obras do existencialismo. O que distingue o absurdismo de Camus do existencialismo de Sartre?";"Sartre é pessimista; Camus é otimista";"Para Camus, a vida é absurda mas deve ser vivida com revolta e plenitude; Sartre propõe que criamos sentido através da liberdade";"Camus nega a existência; Sartre a afirma";"Ambos têm posições idênticas";"Camus é marxista; Sartre é anarquista";"b";"Camus: absurdismo — a vida não tem sentido intrínseco, mas devemos revoltarmo-nos contra o absurdo e viver com plenitude (Mito de Sísifo). Sartre: existencialismo — a liberdade radical cria o sentido; somos condenados a ser livres e responsáveis.";""
"3339";"multipla";"Matemática";"Álgebra";"Operações com frações algébricas";"Médio";"Vestibular";"2023";"A simplificação da fração (x² - 4)/(x - 2), para x ≠ 2, resulta em:";"x - 2";"x + 2";"x² - 2";"2x";"x";"b";"x² - 4 = (x-2)(x+2). Dividindo por (x-2): (x-2)(x+2)/(x-2) = x+2, para x ≠ 2.";""
"3340";"multipla";"Física";"Física moderna";"Laser";"Médio";"Vestibular";"2024";"O laser (Light Amplification by Stimulated Emission of Radiation) é baseado no princípio de:";"Difração de ondas de rádio";"Emissão espontânea de elétrons";"Emissão estimulada de fótons coerentes";"Fissão nuclear controlada";"Reflexão total da luz branca";"c";"O laser usa a emissão estimulada: um fóton estimula um átomo excitado a emitir outro fóton idêntico (mesma fase, comprimento de onda e direção). O resultado é luz coerente, monocromática e colimada. Aplicações: cirurgia, CD/DVD, comunicação por fibra ótica, barômetros, militares.";""
"3341";"multipla";"Química";"Materiais";"Grafite e diamante";"Médio";"Vestibular";"2023";"O grafite e o diamante são ambos formados por carbono puro, mas com propriedades físicas muito diferentes. Isso ocorre por causa de:";"Diferença no número de nêutrons";"Diferença na estrutura cristalina (alotropia do carbono)";"Diferentes composições químicas";"Presença de impurezas no diamante";"Diferença no estado de oxidação do carbono";"b";"Grafite e diamante são alótropos do carbono: mesma composição (C puro), mas estruturas cristalinas diferentes. Grafite: camadas de anéis hexagonais com ligações fracas entre camadas (condutor, macio). Diamante: rede tridimensional de tetraedros (isolante, dureza máxima).";""
"3342";"multipla";"Biologia";"Paleontologia";"Extinções em massa";"Médio";"Vestibular";"2024";"A extinção em massa do final do Cretáceo (há ~66 Ma), que eliminou os dinossauros não-aviários, foi causada principalmente por:";"Erupção de supervulcões";"Glaciação global";"Impacto de asteróide em Chicxulub e suas consequências climáticas";"Competição com mamíferos";"Pandemia viral global";"c";"O impacto do asteróide Chicxulub (México) gerou tsunami, incêndios globais e inverno de impacto (poeira bloqueou o sol por meses), eliminando ~75% das espécies incluindo os dinossauros. Evidência: camada de irídio (rara na Terra, comum em meteoritos) em rochas desse período.";""
"3343";"multipla";"Filosofia";"Filosofia da mente";"Intencionalidade";"Médio";"Vestibular";"2023";"A intencionalidade, conceito central na fenomenologia de Husserl, refere-se a:";"A intenção de realizar uma ação futura";"A propriedade da consciência de ser sempre consciência DE algo (dirigida a um objeto)";"A liberdade da vontade humana";"O propósito das ações morais";"A capacidade de formar intenções";"b";"Intencionalidade (Brentano, desenvolvida por Husserl): toda experiência mental é direcionada para um objeto. Não há pensamento ou percepção 'vazio' — a consciência é sempre consciência de algo. Fundamental na fenomenologia.";""
"3344";"multipla";"Sociologia";"Modernidade";"Teoria social clássica";"Médio";"Vestibular";"2024";"Georg Simmel analisou os efeitos da vida metropolitana moderna sobre os indivíduos. Segundo ele, a 'atitude blasé' do citadino é uma:";"Demonstração de riqueza cultural";"Reação de defesa contra a estimulação excessiva da cidade grande";"Resultado da educação superior";"Forma de conformismo político";"Expressão do nacionalismo urbano";"b";"Simmel: a vida na metrópole expõe o indivíduo a estímulos excessivos (tempo, dinheiro, barulho, rostos). A 'atitude blasé' (indiferença, embotamento) é um mecanismo de defesa psicológica para suportar essa sobrecarga.";""
"3345";"multipla";"Literatura";"Literatura Brasileira";"Cora Coralina";"Fácil";"Vestibular";"2023";"Cora Coralina (1889-1985) é uma poetisa brasileira conhecida por:";"Poesia concreta e experimental";"Poesia ligada à memória, ao cotidiano de Goiás e à valorização dos humildes";"Poesia de engajamento político marxista";"Romances históricos sobre a colonização";"Contos fantásticos de terror";"b";"Cora Coralina, goiana, é conhecida pela poesia memorialista, ligada à sua cidade natal (Goiás Velho), ao cotidiano, às mulheres humildes (lavadeiras, doceiras), à infância e à identidade regional. Publicou sua primeira obra aos 75 anos.";""
"3346";"multipla";"Matemática";"Funções";"Paridade de funções";"Médio";"Vestibular";"2024";"Uma função f é par se, para todo x do domínio, f(-x) = f(x). Qual das funções abaixo é PAR?";"f(x) = x";"f(x) = x + 1";"f(x) = x³";"f(x) = x²";"f(x) = 2x";"d";"f(-x) = (-x)² = x² = f(x). ✓ f(x) = x² é par (gráfico simétrico em relação ao eixo y). f(x)=x é ímpar (f(-x)=-x=-f(x)). f(x)=x³ é ímpar.";""
"3347";"multipla";"Física";"Cinemática";"Trajetória e deslocamento";"Fácil";"Vestibular";"2023";"A diferença entre trajetória e deslocamento é que:";"São conceitos idênticos";"Trajetória é escalar; deslocamento é vetorial";"Trajetória é o caminho percorrido; deslocamento é o vetor entre posição final e inicial";"Trajetória é sempre em linha reta";"Deslocamento é sempre maior que a trajetória";"c";"Trajetória: linha descrita pelo objeto em movimento — pode ser curva. Distância percorrida (escalar). Deslocamento: vetor que vai da posição inicial à final — não considera o caminho, só o resultado líquido.";""
"3348";"multipla";"Química";"Bioquímica";"Digestão";"Fácil";"Vestibular";"2024";"A digestão química das proteínas começa no:";"Boca (pela amilase salivar)";"Estômago (pela pepsina em meio ácido)";"Intestino delgado apenas";"Esôfago";"Intestino grosso";"b";"A digestão química de proteínas começa no estômago: o HCl (pH 1,5-3,5) desnatura as proteínas e a pepsina as hidrolisa em peptídeos menores. Continua no intestino delgado pelas proteases pancreáticas.";""
"3349";"multipla";"Biologia";"Endocrinologia";"Diabetes";"Médio";"Vestibular";"2023";"O diabetes tipo 1 é caracterizado por:";"Resistência das células à insulina";"Produção insuficiente de glucagon";"Destruição autoimune das células beta do pâncreas, com ausência de produção de insulina";"Excesso de produção de insulina";"Consumo excessivo de açúcar";"c";"Diabetes tipo 1: doença autoimune em que o sistema imunológico destrói as células beta das ilhotas de Langerhans do pâncreas, cessando a produção de insulina. Tratamento: insulina exógena. Tipo 2: resistência à insulina, tratável com dieta e medicamentos.";""
"3350";"multipla";"Filosofia";"Ética";"Ética das virtudes — Aristóteles";"Médio";"Vestibular";"2024";"Para Aristóteles, a virtude é um:";"Extremo de comportamento";"Hábito adquirido que representa o justo meio entre o excesso e a falta";"Dom natural inato";"Mandamento divino";"Resultado da educação formal apenas";"b";"Para Aristóteles, a virtude (areté) é uma disposição habitual adquirida pelo exercício — o 'justo meio' (mesotes) entre dois vícios opostos (excesso e falta). Exemplo: coragem é o meio entre a covardia e a temeridade.";""
"3351";"multipla";"Sociologia";"Família";"Patriarcalismo";"Médio";"Vestibular";"2023";"O patriarcalismo é uma estrutura social em que:";"As mulheres dominam a estrutura familiar e política";"O poder é exercido igualmente entre homens e mulheres";"O homem (pai) detém a autoridade central na família e na sociedade";"Os filhos herdam a autoridade das mães";"A família é governada pelos avós";"c";"Patriarcalismo: sistema social em que o homem/pai exerce autoridade sobre a família e a mulher, com herança pela linha paterna. Historicamente predominante e ainda presente em muitas culturas. Objeto de crítica do feminismo.";""
"3352";"multipla";"Literatura";"Literatura Brasileira";"Drummond — 'A Rosa do Povo'";"Médio";"Vestibular";"2024";"'A Rosa do Povo' (1945) de Carlos Drummond de Andrade é considerada a mais engajada de suas obras porque foi escrita:";"Durante a Semana de Arte Moderna";"No contexto da Segunda Guerra Mundial e do Estado Novo, com poesia de resistência";"Em defesa do Romantismo";"Como homenagem à Revolução Russa";"Durante o período de abertura democrática (1985)";"b";"'A Rosa do Povo' (1945) foi escrita no contexto da 2ª Guerra Mundial e do Estado Novo de Vargas. Drummond adota uma poética mais engajada, solidária ao sofrimento humano e antifascista, sem perder a complexidade existencial.";""
"3353";"multipla";"Matemática";"Algebra";"Relações em conjuntos";"Médio";"Vestibular";"2023";"Dados A = {1, 2, 3} e B = {2, 3, 4}, o conjunto A ∩ B (intersecção) é:";"{1, 2, 3, 4}";"{1, 4}";"{2, 3}";"{1}";"∅";"c";"A ∩ B contém os elementos que pertencem a AMBOS os conjuntos. A∩B = {2, 3}. A∪B = {1,2,3,4} seria a união.";""
"3354";"multipla";"Física";"Termologia";"Calor específico";"Médio";"Vestibular";"2024";"Para elevar de 1°C a temperatura de 1 g de água, necessita-se de:";"1 J";"1 kJ";"1 cal (4,18 J)";"1 kcal";"100 J";"c";"O calor específico da água é 1 cal/(g·°C) = 4,18 J/(g·°C). Para 1 g de água elevar 1°C, necessita 1 cal = 4,18 J. A água tem o maior calor específico entre substâncias comuns.";""
"3355";"multipla";"Química";"Orgânica";"Nitrogênio orgânico";"Médio";"Vestibular";"2023";"A cafeína, presente no café, é um alcaloide classificado como uma:";"Cetona";"Éster";"Base nitrogenada heterocíclica (xantina)";"Ácido carboxílico";"Álcool primário";"c";"A cafeína é 1,3,7-trimetilxantina, um alcaloide purínico — base nitrogenada heterocíclica com anéis fundidos contendo nitrogênio. É estimulante do SNC por antagonismo dos receptores de adenosina.";""
