"id";"tipo";"disciplina";"tema";"subtema";"dificuldade";"fonte";"ano";"enunciado";"alternativa_a";"alternativa_b";"alternativa_c";"alternativa_d";"alternativa_e";"resposta_correta";"explicacao";"resposta"
"4348";"multipla";"Historia";"Historia do Brasil";"Diretas Ja";"Facil";"Vestibular";"2024";"O movimento 'Diretas Ja' (1983-1984) foi uma campanha popular que exigia:";"Eleicoes diretas para presidente da Republica, encerrando as eleicoes indiretas da ditadura";"A anistia de presos politicos";"A convocacao de uma Constituinte";"O fim do regime militar imediato";"Reducao da jornada de trabalho";"a";"A campanha Diretas Ja mobilizou milhoes de brasileiros em comícios em todo o pais (o maior em SP com 1,7 mi de pessoas, 16/04/1984) pela aprovacao da Emenda Dante de Oliveira, que previa eleicoes diretas para presidente. A emenda foi derrotada no Congresso em abril de 1984. A transicao ocorreu indiretamente: Tancredo Neves foi eleito pelo Colegio Eleitoral (jan. 1985), mas morreu antes de tomar posse; Jose Sarney assumiu.";""
"4349";"multipla";"Geografia";"Economia";"Subdesenvolvimento";"Medio";"Vestibular";"2024";"A teoria da dependencia, desenvolvida por economistas latino-americanos como Cardoso e Faletto, argumenta que:";"O subdesenvolvimento e estrutural — paises perifericos se especializam em produtos primarios e transferem valor para o centro";"O subdesenvolvimento e culpa do Estado interventor";"O livre-mercado e a solucao para o subdesenvolvimento";"A industrializacao sempre resolve o subdesenvolvimento";"A dependencia e causada apenas por fatores internos";"a";"A teoria da dependencia (CEPAL, Prebisch, Cardoso, Faletto, Frank) critica o liberalismo classico: a relacao centro-periferia e estruturalmente desigual. Paises perifericos exportam commodities de baixo valor agregado e importam manufaturados de alto valor — deterioracao dos termos de troca. O capital externo, ao inves de desenvolver, extrai excedente. A solucao proposta variava: industrializacao protegida (CEPAL) ou transformacao social radical (correntes mais radicais).";""
"4350";"multipla";"Lingua Portuguesa";"Gramatica";"Verbos irregulares";"Medio";"Vestibular";"2024";"O imperfeito do subjuntivo de 'ser' na 1a pessoa do singular e:";"fosse";"seria";"serei";"foi";"sou";"a";"Conjugacao de 'ser' no imperfeito do subjuntivo: fosse, fosses, fosse, fossemos, fosseis, fossem. O imperfeito do subjuntivo e formado a partir da 3a pessoa do plural do preterito perfeito do indicativo (foram) menos a desinencia -am + terminacoes (-se, -sses, -sse, -ssemos, -sseis, -ssem). Usado em orações condicionais (se fosse, se tivesse), concessivas e em construcoes como 'caso fosse'.";""
"4351";"multipla";"Lingua Portuguesa";"Literatura Brasileira";"Poesia concreta";"Medio";"Vestibular";"2024";"O Tropicalismo (1967-1969), movimento cultural brasileiro, caracterizou-se por:";"Mistura de musica popular brasileira com rock, vanguardas artisticas e critica politica — Caetano Veloso e Gilberto Gil";"Retorno ao nacionalismo musical puro";"Exclusao de elementos estrangeiros da cultura brasileira";"Musica classica erudita de camara";"Renovacao do chorinho tradicional";"a";"O Tropicalismo (ou Tropicalia) foi um movimento cultural liderado por Caetano Veloso e Gilberto Gil (com participacao de Tom Ze, Gal Costa, Os Mutantes). Misturava musica regional brasileira com rock e psicodelia, incorporando a estetica pop e vanguardas artisticas. Era uma critica ironica ao Brasil — tanto ao conservadorismo quanto ao nacionalismo da esquerda. Influenciado por Oswald de Andrade, Cinema Novo e artes plasticas (Helio Oiticica).";""
"4352";"multipla";"Filosofia";"Etica";"Etica ambiental";"Medio";"Vestibular";"2024";"A etica ambiental profunda (Deep Ecology), proposta por Arne Naess, defende que:";"Todos os seres vivos tem valor intrinseco, independente de sua utilidade para o ser humano";"A natureza deve ser preservada apenas porque e util para os humanos";"So os animais domesticos tem direitos morais";"O desenvolvimento economico deve prevalecer sobre a preservacao";"So os humanos tem dignidade moral";"a";"A Deep Ecology (Naess, 1973) propoe uma visao biocentrica: todos os seres vivos e o proprio ecossistema tem valor intrinseco (nao apenas instrumental). Contrasta com a ecologia rasa (shallow ecology) que preserva a natureza apenas por razoes antropocentricas (recursos para humanos). A Deep Ecology exige mudanca de paradigma — do antropocentrismo para o ecocentrismo.";""
"4353";"multipla";"Sociologia";"Sociologia da Educacao";"Educacao bancaria";"Facil";"Vestibular";"2024";"Paulo Freire critica a 'educacao bancaria' porque ela:";"Trata o aluno como recipiente passivo de informacoes despejadas pelo professor, sem dialogo";"Incentiva demasiado a participacao dos alunos";"Ignora as materias tradicionais";"Valoriza o conhecimento popular sobre o cientifico";"Promove a alfabetizacao critica";"a";"Paulo Freire, em 'Pedagogia do Oprimido' (1968), critica a 'educacao bancaria': o professor deposita conteudo nos alunos passivos, acriticos, que memorizam e reproduzem sem questionar. Propoe a educacao dialogica: o professor e o aluno aprendem juntos, partindo da realidade vivida pelos educandos, desenvolvendo consciencia critica (conscientizacao) que leva a transformacao social. Base da pedagogia critica global.";""
"4354";"multipla";"Sociologia";"Sociologia do Consumo";"Sociedade de consumo";"Medio";"Vestibular";"2024";"Jean Baudrillard analisa o consumo contemporaneo como:";"Consumo de signos e simbolos — as mercadorias valem pelo status e identidade que conferem, nao pelo uso";"Necessidade economica de sobrevivencia";"Forma de redistribuicao de riqueza";"Exercicio da liberdade individual";"Manifestacao da irracionalidade humana";"a";"Baudrillard ('A Sociedade de Consumo', 1970) argumenta que na sociedade pos-industrial o consumo nao e guiado pelo valor de uso (utilidade) nem pelo valor de troca (dinheiro), mas pelo valor-signo: consumimos marcas, estilos e simbolos para construir identidades e distincoes sociais. O simulacro (representacao sem referente real) substitui o real. O hiperconsumo e uma forma de controle social, nao de satisfacao de necessidades reais.";""
"4355";"multipla";"Matematica";"Numeros";"Divisibilidade — 9";"Facil";"Vestibular";"2024";"O numero 4.572 e divisivel por 9 porque:";"4+5+7+2 = 18, que e divisivel por 9";"Termina em 2";"E um numero par";"E maior que 900";"Tem 4 algarismos";"a";"Criterio de divisibilidade por 9: a soma dos algarismos e divisivel por 9. 4+5+7+2 = 18 = 9x2. Logo 4.572 e divisivel por 9. Verificando: 4.572 / 9 = 508.";""
"4356";"multipla";"Matematica";"Funcoes";"Crescimento e decrescimento";"Facil";"Vestibular";"2024";"A funcao f(x) = 2^x e:";"Crescente para todo x real (base > 1)";"Decrescente para todo x";"Constante";"Crescente so para x > 0";"Decrescente para x < 0";"a";"f(x) = a^x com a > 1 e crescente para todo x real. f(x) = a^x com 0 < a < 1 e decrescente. Para f(x) = 2^x: quando x cresce, 2^x cresce. Exemplos: f(0) = 1, f(1) = 2, f(2) = 4, f(-1) = 0,5.";""
"4357";"multipla";"Matematica";"Algebra";"Equacao de segundo grau discriminante";"Medio";"Vestibular";"2024";"Se o discriminante (Delta) de uma equacao de segundo grau e negativo, entao:";"Nao existem raizes reais — a equacao tem duas raizes complexas conjugadas";"Ha uma raiz real repetida";"Ha duas raizes reais distintas";"A equacao tem tres raizes";"A equacao nao pode ser resolvida";"a";"Para ax^2 + bx + c = 0, Delta = b^2 - 4ac. Se Delta > 0: duas raizes reais distintas. Se Delta = 0: uma raiz real repetida. Se Delta < 0: nao ha raizes reais — ha duas raizes complexas conjugadas (a + bi e a - bi). Nos Ensinos Medio e Vestibular, trabalha-se geralmente apenas o caso dos reais.";""
"4358";"multipla";"Fisica";"Mecanica";"Alavancas";"Facil";"Vestibular";"2024";"Numa alavanca em equilibrio, o Principio de Arquimedes (alavancas) estabelece que:";"Forca x braco da forca = carga x braco da carga (momento de forcas)";"A forca e igual a carga multiplicada pela altura";"A potencia e igual ao produto de forca e velocidade";"O trabalho realizado e zero";"A pressao e uniforme em todos os pontos";"a";"Alavancas: a condicao de equilibrio e que a soma dos torques em relacao ao fulcro seja zero: F x d_F = C x d_C (forca x braco da forca = carga x braco da carga). Isso permite multiplicar a forca: com braco da forca maior, uma pequena forca equilibra uma grande carga. Ex: balanca, tesoura, quebra-nozes sao exemplos de alavancas.";""
