"id";"tipo";"disc";"tema";"subtema";"dif";"fonte";"ano";"xp";"enunciado";"a";"b";"c";"d";"e";"ok";"exp"
"ENEM_2020_Q021";"multipla";"Literatura";"Literatura Brasileira";"Romantismo";"Fácil";"ENEM";"2020";"10";"Sou o coração do folclore nordestino Eu sou Mateus e Bastião do Boi-bumbá Sou o boneco de Mestre Vitalino Dançando uma ciranda em Itamaracá Eu sou um verso de Carlos Pena Filho Num frevo de Capiba Ao som da Orquestra Armorial Sou Capibaribe Num livro de João Cabral Sou mamulengo de São Bento do Una Vindo no baque solto de maracatu Eu sou um auto de Ariano Suassuna No meio da Feira de Caruaru Sou Frei Caneca do Pastoril do Faceta Levando a flor da lira Pra Nova Jerusalém Sou Luiz Gonzaga E sou do mangue também Eu sou mameluco, sou de Casa Forte Sou de Pernambuco, sou o Leão do Norte LENINE; PINHEIRO, P.C. Leão do Norte. In: LENINE; SUZANO, M. **Olho de peixe**. São Paulo: Vetas. 1993 (fragmento).";"Valorização do teatro, música, artesanato, literatura, dança, personagens históricos e artistas populares, compondo um tecido diversificado e enriquecedor da cultura popular como patrimônio regional e nacional.";"Identificação dos lugares pernambucanos, manifestações culturais, como o bumba meu boi, as cirandas, os bonecos mamulengos e heróis locais, fazendo com que essa canção se apresente como uma referência à cultura popular nordestina.";"Exaltação das raízes populares, como a poesia, a literatura de cordel e o frevo, misturadas ao erudito, como a Orquestra Armorial, compondo um rico tecido cultural, que transforma o popular em erudito.";"Caracterização das festas populares como identidade cultural localizada e como representantes de uma cultura que reflete valores históricos e sociais próprios da população local.";"Apresentação do Pastoril do Faceta, do maracatu, do bumba meu boi e dos autos como representação da musicalidade e do teatro popular religioso, bastante comum ao folclore brasileiro.";"b";"A resposta correta é a alternativa B. Identificação dos lugares pernambucanos, manifestações culturais, como o bumba meu boi, as cirandas, os bonecos mamulengos e heróis locais, fazendo co..."
"ENEM_2020_Q022";"multipla";"Português";"Gramática e Linguística";"Coesão e coerência";"Fácil";"ENEM";"2020";"10";"![](https://enem.dev/2020/questions/22/e2bb4218-b673-46d0-8ba4-70eefe576fae.png) Disponível em: www.facebook.com/ministeriodoesporte. Acesso em: 7 dez. 2017";"Promover ações de conscientização para reduzir a violência de gênero em eventos esportivos.";"Estimular o compartilhamento de políticas públicas sobre a igualdade de gênero no esporte.";"Divulgar para a população as novas regras complementares para as torcidas de futebol.";"Informar ao público masculino as consequências de condutas ofensivas.";"Regulamentar normas de boa convivência nos estádios.";"a";"A resposta correta é a alternativa A. Promover ações de conscientização para reduzir a violência de gênero em eventos esportivos."
"ENEM_2020_Q023";"multipla";"Português";"Artes e Cultura";"Comprensión lectora";"Fácil";"ENEM";"2020";"10";"Eu tenho empresas e sou digno do visto para ir a Nova York. O dinheiro que chove em Nova York é para pessoas com poder de compra. Pessoas que tenham um visto do consulado americano. O dinheiro que chove em Nova York também é para os nova-iorquinos. São milhares de dólares. \[…\] Estou indo para Nova York, onde está chovendo dinheiro. Sou um grande administrador. Sim, está chovendo dinheiro em Nova York. Deu no rádio. Vejo que há pedestres invadindo a via onde trafega o meu carro vermelho, importado da Alemanha. Vejo que há carros nacionais trafegando pela via onde trafega o meu carro vermelho, importado da Alemanha. Ao chegar em Nova York, tomarei providências. SANTANNA, A. O importado vermelho de Noé. In: MORICONI. I. (Org.). _Os cem melhores contos_. Rio de Janeiro: Objetiva. 2001.";"Expressam a futilidade do discurso de poder e de distinção do narrador.";"Disfarçam a falta de densidade das angústias existenciais narradas.";"Ironizam a valorização da cultura norte-americana pelos brasileiros.";"Explicitam a ganância financeira do capitalismo contemporâneo.";"Criticam os estereótipos sociais das visões de mundo elitistas.";"a";"A resposta correta é a alternativa A. Expressam a futilidade do discurso de poder e de distinção do narrador."
"ENEM_2020_Q024";"multipla";"Português";"Artes e Cultura";"Reading comprehension";"Fácil";"ENEM";"2020";"10";"**DECRETO N. 28 314, DE 28 DE SETEMBRO DE** **2007** Demite o Gerúndio do Distrito Federal e dá outras providências. O **GOVERNADOR DO DISTRITO FEDERAL**, no uso das atribuições que lhe confere o artigo 100, incisos VII e XXVI, da Lei Orgânica do Distrito Federal, DECRETA: Art. 1.° Fica demitido o Gerúndio de todos os órgãos do Governo do Distrito Federal. Art. 2.° Fica proibido, a partir desta data, o uso do gerúndio para desculpa de INEFICIÊNCIA. Art. 3.° Este Decreto entra em vigor na data de sua publicação. Art. 4.° Revogam-se as disposições em contrário. Brasília, 28 de setembro de 2007. 119.° da República e 48.° de Brasília Disponível em: www.dodf.gov.br. Acesso em: 11 dez. 201";"Conclusão de uma ação.";"Realização de um evento.";"Repetição de uma prática.";"Continuidade de um processo.";"Transferência de responsabilidade.";"d";"A resposta correta é a alternativa D. Continuidade de um processo."
"ENEM_2020_Q025";"multipla";"Literatura";"Literatura Brasileira";"Coesão e coerência";"Fácil";"ENEM";"2020";"10";"![](https://enem.dev/2020/questions/25/600a478d-bf8d-46fb-9e38-cd71bcf3464c.png) A obra de Joseph Kosuth data de 1965 e se constitui por uma fotografia de cadeira, uma cadeira exposta e um quadro com o verbete “Cadeira”. Trata-se de um exemplo de arte conceitual que revela o paradoxo entre verdade e imitação, já que a arte KOSUTH J. _One and Three Chairs_. Museu Reina Sofia, Espanha, 1965. Disponível em: www.museoreinasofia.es. Acesso em: 4 jun. 2018 (adaptado).";"Não é a realidade, mas uma representação dela.";"Fundamenta-se na repetição, construindo variações.";"Não se define, pois depende da interpretação do fruidor.";"Resiste ao tempo, beneficiada por múltiplas formas de registro.";"Redesenha a verdade, aproximando-se das definições lexicais.";"a";"A resposta correta é a alternativa A. Não é a realidade, mas uma representação dela."
"ENEM_2020_Q026";"multipla";"Literatura";"Literatura Portuguesa";"Coesão e coerência";"Médio";"ENEM";"2020";"15";"![](https://enem.dev/2020/questions/26/8abef0c5-b053-4973-9ace-4fa17bf73d53.png) A realidade virtual é uma tecnologia de informação que, conforme sugere a imagem, tem como uma de suas principais funções Disponível em: www.iotforall.com. Acesso em: 22 jun. 2018.";"Promover a manipulação eficiente de conhecimentos e informações de difícil compreensão no mundo físico.";"Conduzir escolhas profissionais da área de ciência da computação, oferecendo um leque de opções de atuação.";"Transferir conhecimento da inteligência artificial para as áreas tradicionais, como as das ciências exatas e naturais.";"Levar o ser humano a experimentar mentalmente outras realidades, para as quais é transportado sem sair de seu próprio lugar.";"Delimitar tecnologias exclusivas de jogos virtuais, a fim de oferecer maior emoção ao jogador por meio de outras realidades.";"d";"A resposta correta é a alternativa D. Levar o ser humano a experimentar mentalmente outras realidades, para as quais é transportado sem sair de seu próprio lugar."
"ENEM_2020_Q027";"multipla";"Espanhol";"Língua Estrangeira (Espanhol)";"Modernismo";"Médio";"ENEM";"2020";"15";"Caminhando contra o vento, Sem lenço e sem documento No sol de quase dezembro Eu vou O sol se reparte em crimes Espaçonaves, guerrilhas Em cardinales bonitas Eu vou Em caras de presidentes Em grandes beijos de amor Em dentes, pernas, bandeiras Bombas e Brigitte Bardot O sol nas bancas de revista Me enche de alegria e preguiça Quem lê tanta notícia Eu vou VELOSO, C. Alegria, alegria. In: **Caetano Veloso**. São Paulo.";"Descritivo e argumentativo, pois o enunciador detalha cada lugar por onde passa, argumentando contra a violência urbana.";"Dissertativo e argumentativo, pois o enunciador apresenta seu ponto de vista sobre as notícias relativas à cidade.";"Expositivo e injuntivo, pois o enunciador fala de seus estados físicos e psicológicos e interage com a mulher amada.";"Narrativo e descritivo, pois o enunciador conta sobre suas andanças pelas ruas da cidade ao mesmo tempo que a descreve.";"Narrativo e injuntivo, pois o enunciador ensina o interlocutor como andar pelas ruas da cidade contanto sobre sua própria experiência.";"d";"A resposta correta é a alternativa D. Narrativo e descritivo, pois o enunciador conta sobre suas andanças pelas ruas da cidade ao mesmo tempo que a descreve."
"ENEM_2020_Q028";"multipla";"Inglês";"Língua Estrangeira (Inglês)";"Modernismo";"Médio";"ENEM";"2020";"15";"Leandro Aparecido Ferreira, o MC Fioti, compôs em 2017 a música _Bum bum tam tam_, que gerou, em nove meses, 480 milhões de visualizações no Youtube. É o funk brasileiro mais ouvido na história do site. A partir de uma gravação da flauta que achou na internet, MC Fioti fez tudo sozinho: compôs, cantou e produziu em uma noite só, “Comecei a pesquisar alguns tipos de flauta, coisas antigas. E nisso eu achei a “flautinha do Sebantian Bach”, conta. A descoberta foi por acaso: Fioti não sabia quem era o música alemão e não sabe tocar o instrumento. A “flauta envolvente” da música é um trecho da Partida em lá menor, escrita pelo alemão Johann Sebastian Bach por volta de 1723. Disponível em: https//g1.globo.com. Acesso em: 8 jun. 2018. \[adaptado\]";"Influência permanente da cultura eurocêntrica nas produções musicais brasileiras";"Homenagem aos referenciais estéticos que deram origem às produções da música popular";"Necessidade de divulgar a música de concerto nos meios populares nas periferias das grandes cidades";"Utilização desintencional de uma música excessivamente distante da realidade cultural dos jovens brasileiros";"Inter-relação de elementos culturais vindos de realidades distintas na construção de uma nova proposta musical"""", dizia a questão.";"e";"A resposta correta é a alternativa E. Inter-relação de elementos culturais vindos de realidades distintas na construção de uma nova proposta musical"", dizia a questão."
"ENEM_2020_Q029";"multipla";"Espanhol";"Língua Estrangeira (Espanhol)";"Reading comprehension";"Médio";"ENEM";"2020";"15";"**Seu delegado** Eu sou viúvo e tenho um filho homem Arrumei uma viúva e fui me casar A minha sogra era muito teimosa Com o meu filho foi se matrimoniar Desse matrimônio nasceu um garoto Desde esse dia que eu ando é louco Esse garoto é filho do meu filho E o filho da minha sogra é irmão da minha muher Ele é meu neto e eu sou cunhado dele A minha nora é minha sogra Meu filho meu sogro é Nesse confusão já nem sei quem sou Acaba esse garoto sendo meu avô. TRIO FORROZÃO. Agitando a rapaziada. Rio de Janeiro. Natasha Records. 2009.";"Ironizar as relações familiares modernas.";"Reforçar o humor da situação representada.";"Expressar perplexidade em relação ao parente.";"Atribuir à criança a causa da dúvida existencial.";"Questionar os lugares predeterminados da família";"b";"A resposta correta é a alternativa B. Reforçar o humor da situação representada."
"ENEM_2020_Q030";"multipla";"Inglês";"Língua Estrangeira (Inglês)";"Reading comprehension";"Médio";"ENEM";"2020";"15";"![](https://enem.dev/2020/questions/30/bc547f7a-bd4f-429d-b888-d64bbd7fbd0b.png) Disponível em: www.bhaz.com.br. Acesso em: 14 jun. 2018.";"Silêncio imposto às mulheres, que não podem denunciar o assédio sofrido.";"Metáfora de que as mulheres precisam defender-se do assédio masculino.";"Constrangimento pelo qual passam as mulheres e sua tentativa de esconderem-se.";"Necessidade que as mulheres têm de passarem despercebidas para evitar o assédio.";"Incapacidade de as mulheres protegerem-se da agressão verbal dos assediadores.";"b";"A resposta correta é a alternativa B. Metáfora de que as mulheres precisam defender-se do assédio masculino."
"ENEM_2020_Q031";"multipla";"Literatura";"Comunicação e Tecnologia";"Modernismo";"Médio";"ENEM";"2020";"15";"**Mulher tem coração clinicamente partido após morte de cachorro** Como explica o _The New England Journal of Medicine_, a paciente, chamada Joanie Simpson, tinha sinais de infarto, como dores no peito e pressão alta, e apresentava problemas nas artérias coronárias. Ao fazerem um ecocardiograma, os médicos encontraram o problema: cardiomiopatia de Takotsubo, conhecido como síndrome do coração partido. Essa condição médica tipicamente acontece com mulheres em fase pós-menstrual e pode ser precedida por um evento muito estressante ou emotivo. Nesses casos, o coração apresenta um movimento discinético transitório da parede anterior do ventrículo esquerdo, com acentuação da cinética da base ventricular, de acordo com um artigo médico brasileiro que relata um caso semelhante. Simpson foi encaminhada para casa após dois dias e passou a tomar medicamentos regulares. Ao _Washington Post_, ela contou que estava quase inconsolável após a perda do seu animal de estimação, um cão de raça yorkshire terrier. Recuperada após cerca de um ano, ela diz que não abrirá mão de ter um animal de estimação porque aprecia a companhia e o amor que os cachorros dão os humanos. O caso aconteceu em Houston, nos Estados Unidos. Disponível em: https://exame.abril.com.br. Acesso em: 1 dez. 2017.";"Conto, pois exibe a história de vida de Joanie Simpson.";"Depoimento, pois expõe o sofrimento da dona do animal.";"Reportagem, pois discute cientificamente a cardiomiopatia.";"Relato, pois narra um fato estressante vivido pela paciente.";"Notícia, pois divulga fatos sobre a síndrome do coração partido.";"e";"A resposta correta é a alternativa E. Notícia, pois divulga fatos sobre a síndrome do coração partido."
"ENEM_2020_Q032";"multipla";"Literatura";"Literatura Portuguesa";"Comprensión lectora";"Médio";"ENEM";"2020";"15";"Chiquito tinha quase trinta quando conheceu Mariana num baile de casamento na Forquilha, onde moravam uns parentes dele. Por lá foi ficando, remanchando. Fez mal à moça, como costumavam dizer, tiveram de casar às pressas. Morou uns tempos com o sogro, descombinaram. Foi só conta de colher o milho e vender. Mudou pra casa do velho Chico Lourenço \[seu pai\]. Fumaça própria só viu subir um par de anos depois, quando o pai repartiu as terras. De tão parecidos, pai e filho nunca combinaram direito. Cada qual mais topetudo, muitas vezes dona Aparecida ouvia o marido reclamar da natureza forte do filho. Ela escutava com paciência e respondia dum jeito sempre igual: – “Quem herda, não rouba”. Vinha um brilho nos olhos, o velho se acalmava. ROMANO, O. **Casos de Minas**. Rio de Janeiro: Paz e Terra, 1982.";"Criticar a natureza forte do filho.";"Justificar o gênio difícil de Chiquito.";"Legitimar o direito do filho à herança.";"Conter o ânimo violento de Chico Lourenço.";"Condenar a agressividade do marido contra o filho.";"b";"A resposta correta é a alternativa B. Justificar o gênio difícil de Chiquito."
"ENEM_2020_Q033";"multipla";"Espanhol";"Língua Estrangeira (Espanhol)";"Análise sintática";"Médio";"ENEM";"2020";"15";"**TEXTO I** O caminho habitual para o trabalho, aquele em que a gente já nem repara direito, pode ficar mais belo com um poema. O projeto #UmLambePorDia nasceu desta intenção: trazer mais cor e alegria para a cidade por meio de cartazes coloridos ao estilo lambe-lambe. Quem teve a ideia foi o escritor Leonardo Beltrão, em Belo Horizonte. “Em meio a olhares cada vez mais viciados, acabamos nos esquecendo da beleza envolvida em cada esquina e no próprio poder transformador da palavra”. Assim, a cada dia um cartaz é colocado por aí, para nos lembrar de reparar na cidade, na vida que corre ao redor e também em nós mesmos. **TEXTO II** ![](https://enem.dev/2020/questions/33/b55ca6dc-ef55-4bdb-b9d7-a91df9eb6d6f.png) Disponível em: www.vidasimples.uol.com.br. Acesso em: 6 dez. 2017 (adaptado).";"Disseminação da arte poética em um veículo não convencional.";"Manutenção da expectativa das pessoas ao andarem pelas ruas.";"Necessidade de exposição de poemas pequenos em diferentes suportes.";"Característica corriqueira do suporte lambe-lambe, muito comum nas ruas.";"Exposição da beleza escondida das esquinas da cidade de Belo Horizonte.";"a";"A resposta correta é a alternativa A. Disseminação da arte poética em um veículo não convencional."
"ENEM_2020_Q034";"multipla";"Português";"Artes e Cultura";"Mídias digitais";"Médio";"ENEM";"2020";"15";"A vida às vezes é como um jogo brincado na rua: estamos no último minuto de uma brincadeira bem quente e não sabemos que a qualquer momento pode chegar um mais velho e avisar que a brincadeira já acabou e está na hora do jantar. A vida afinal acontece muito de repente – nunca ninguém nos avisou que aquele era mesmo o último Carnaval da Vitória. O Carnaval também chegava sempre de repente. Nós, as crianças, vivíamos num tempo fora do tempo, sem nunca sabermos dos calendários de verdade. \[…\] O “dia da véspera do Carnaval”, como dizia a avó Nhé, era dia de confusão com roupas e pinturas a serem preparadas, sonhadas e inventadas. Mas quando acontecia era um dia rápido, porque os dias mágicos passam depressa deixando marcas fundas na nossa memória, que alguns chamam também de coração. ONDJAKI. **Os da minha rua**. Rio de Janeiro: Língua Geral, 2007.";"Perspectiva infantil assumida pela voz narrativa.";"Suspensão da linearidade temporal da narração.";"Tentativa de materializar lembranças da infância.";"Incidência da memória sobre as imagens narradas.";"Alternância entre impressões subjetivas e relatos factuais.";"a";"A resposta correta é a alternativa A. Perspectiva infantil assumida pela voz narrativa."
"ENEM_2020_Q035";"multipla";"Português";"Artes e Cultura";"Coesão e coerência";"Médio";"ENEM";"2020";"15";"Em 2000 tivemos a primeira experiência do futebol feminino em um jogo de videogame, o Mia Hamm Soccer. Doze anos depois, uma petição on-line pedia que a EA Sports incluísse o futebol feminino no Fifa 13. Contudo, só em 2015, com uma nova petição on-line, que arrecadou milhares de assinaturas, tivemos o futebol feminino incluído no Fifa 16. Vendo um nicho de mercado inexplorado, a EA Sports produziu o jogo com 12 seleções femininas e o apresentou como inovação. A empresa sabe que mais de 40% dos praticantes de futebol nos EUA são meninas. Para elas, ver o futebol feminino representado em um jogo de videogame é extremamente importante. Ter o futebol feminino no Fifa 16 é um grande passo para a sua popularização na luta pela igualdade de gênero, num contexto machista, sexista, misógino e homofóbico. Disponível em: www.ludopedio.com.br. Acesso em: 5 jun. 2018 (adaptado).";"Disseminarem uma modalidade, promovendo a igualdade de gênero.";"Superarem jogos malsucedidos no mercado, lançados anteriormente.";"Inovarem a modalidade com novas ofertas de jogos ao mercado.";"Explorarem nichos de mercado antes ignorados, produzindo mais lucro.";"Reforçarem estereótipos de gênero masculino ou feminino nos esportes.";"a";"A resposta correta é a alternativa A. Disseminarem uma modalidade, promovendo a igualdade de gênero."
"ENEM_2020_Q036";"multipla";"Espanhol";"Língua Estrangeira (Espanhol)";"Reading comprehension";"Médio";"ENEM";"2020";"15";"LUTA: prática corporal imprevisível, caracterizada por determinado estado de contato proposital, que possibilita a duas ou mais pessoas se enfrentarem numa constante troca de ações ofensivas e/ou defensivas, regidas por regras, com o objetivo mútuo sobre um alvo móvel personificado no oponente. GOMES, M. S. P. _et al_. Ensino das lutas: dos princípios condicionais aos grupos situacionais. **Movimento**, n. 2, abr.-jun. 2010 (adaptado).";"Contato corporal intenso entre o aluno e seu oponente.";"Contenda entre os alunos que se agridem fisicamente.";"Confronto corporal em que os vencedores são previamente identificados.";"Combate corporal intencional com ações regulamentadas entre os oponentes.";"Conflito resolvido pelos alunos por meio de regras previamente estabelecidas.";"d";"A resposta correta é a alternativa D. Combate corporal intencional com ações regulamentadas entre os oponentes."
"ENEM_2020_Q037";"multipla";"Português";"Gramática e Linguística";"Reading comprehension";"Médio";"ENEM";"2020";"15";"O conceito de saúde formulado na histórica VIII Conferência Nacional de Saúde, no ano de 1986, ficou conhecido como um “conceito ampliado” de saúde, conforme ilustrado na figura. Esse conceito foi fruto de intensa mobilização em diversos países da América Latina nas décadas de 1970 e 1980, como resposta à crise dos sistemas públicos de saúde. BATISTELLA, C. **Abordagens contemporâneas do conceito de saúde**. Disponível em: www.dihs.ensp.fiocruz.br. Acesso em: 23 set. 2020. ![](https://enem.dev/2020/questions/37/66ad553a-1aa0-423d-ba1c-c52e70be284d.png)";"Adoção de um estilo de vida ativo por parte dos indivíduos.";"Disponibilidade de emprego no mercado de trabalho.";"Condição habitacional presente nas cidades.";"Acesso ao sistema educacional.";"Forma de organização social.";"e";"A resposta correta é a alternativa E. Forma de organização social."
"ENEM_2020_Q038";"multipla";"Português";"Comunicação e Tecnologia";"Arte contemporânea";"Médio";"ENEM";"2020";"15";"**Relatos de viagem: nas curvas da Nacional 222,** **em Portugal** Em abril deste ano, fomos a Portugal para uma viagem de um mês que esperávamos há uma ano. Pois no dia 4 de maio, chegávamos ao Aeroporto Francisco Sá Carneiro, no Porto. Que linda a “antiga, muy nobre, sempre leal e invicta” cidade do Porto! “Encantei-me”, diriam eles… pelas belas paisagens, construções históricas com lindas fachadas, parques e praças muito bem cuidados. Os tripeiros, sinônimo de portuenses, têm orgulho de sua cidade, apelidada de Invicta – nunca foi invadida. E valorizam tudo o que há de bom ali, como “a melhor estrada para se dirigir do mundo”, a Nacional 222. Pois na manhã do 25 de abril, dia da Revolução dos Cravos, resolvemos conhecer a tal maravilha. A cada 10 km tínhamos que encostar: corríamos, dançávamos, tomávamos chocolate quente, sopa, tudo que fosse quentinho. E lá íamos para mais uma etapa. Uma aventura deliciosa. Depois de três horas – mais ou menos o dobro do tempo necessário, não fossem as paradas para aquecimento -, chegamos a casa! Congelados, mas maravilhados e invictos! Disponível em: https://oglobo.globo.com. Acesso em: 6 dez. 2017 (adaptado).";"Que linda a 'antiga, muy nobre, sempre leal e invicta' cidade do Porto!"""".";"Encantei-me', diriam eles... pelas belas paisagens, construções históricas com lindas fachadas [...]"""".";"Os tripeiros, sinônimo de portuenses, têm orgulho de sua cidade [...]"""".";"E valorizam tudo o que há de bom ali, como 'a melhor estrada para se dirigir do mundo' [...]"""".";"Pois na manhã do 25 de abril, dia da Revolução dos Cravos, resolvemos conhecer a tal maravilha"""".";"a";"A resposta correta é a alternativa A. ""Que linda a 'antiga, muy nobre, sempre leal e invicta' cidade do Porto!""."
"ENEM_2020_Q039";"multipla";"Português";"Artes e Cultura";"Reading comprehension";"Médio";"ENEM";"2020";"15";"**Hino à Bandeira** Em teu seio formoso retratas Este céu de puríssimo azul, A verdura sem par destas matas, E o esplendor do Cruzeiro do Sul. Contemplando o teu vulto sagrado, Compreendemos o nosso dever, E o Brasil por seus filhos amado, Poderoso e feliz há de ser! Sobre a imensa Nação Brasileira, Nos momentos de festa ou de dor, Paira sempre sagrada bandeira Pavilhão da justiça e do amor! **BILAC, O**.: **BRAGA, F**. Disponível em: www2.planalto.gov.br. _Acesso em: 10 dez. 2017 (fragmento)_.";"Remete a um momento futuro.";"Promove a união dos cidadãos.";"Valoriza os seus elementos.";"Emprega termos religiosos.";"Recorre à sua história.";"c";"A resposta correta é a alternativa C. Valoriza os seus elementos."
"ENEM_2020_Q040";"multipla";"Literatura";"Literatura Portuguesa";"Arte contemporânea";"Médio";"ENEM";"2020";"15";"— O senhor pensa que eu tenho alguma fábrica de dinheiro? (O diretor diz essas coisas a ele, mas olha para todos como quem quer dar uma explicação a todos. Todas as caras sorriem.) Quando seu filho esteve doente, eu o ajudei como pude. Não me peça mais nada. Não me encarregue de pagar as suas contas: já tenho as minhas, e é o que me basta… (Risos.) O diretor tem o rosto escanhoado, a camisa limpa. A palavra possui um tom educado, de pessoa que convive com gente inteligente, causeuse. O rosto do Dr. Rist resplandece, vermelho e glabro. Um que outro tem os olhos no chão, a atitude discreta. Naziazeno espera que ele lhe dê as costas, vá reatar a palestra interrompida, aquelas observações sobre a questão social, comunismo e integralismo. MACHADO, D. **Os ratos**, São Paulo: Círculo do Livro, s/d";"Sujeição moral amplificada pela pobreza.";"Crise econômica em expansão nas cidades.";"Salta de diálogo entre patrões e empregados.";"Perspicácia marcada pela formação intelectual.";"Tensão política gerada pelas ideologias vigentes.";"a";"A resposta correta é a alternativa A. Sujeição moral amplificada pela pobreza."
