"id";"tipo";"disciplina";"tema";"subtema";"dificuldade";"fonte";"ano";"enunciado";"alternativa_a";"alternativa_b";"alternativa_c";"alternativa_d";"alternativa_e";"resposta_correta";"explicacao";"resposta"
"4230";"dissertativa";"Matemática";"Geometria analítica";"Cônicas";"Médio";"Vestibular";"2023";"Identifique e descreva a cônica definida pela equação x²/9 + y²/4 = 1. Determine os focos e excentricidade.";"";"";"";"";"";"";"Equação x²/a² + y²/b² = 1 com a²=9>b²=4 → elipse com eixo maior no eixo x. a=3, b=2. c² = a²-b² = 9-4 = 5 → c = √5. Focos: (±√5, 0). Excentricidade: e = c/a = √5/3 ≈ 0,745 (0<e<1, característico de elipse). A elipse tem centro na origem, semixo maior 3, semieixo menor 2.";"Elipse; a=3, b=2; focos: (±√5, 0); e = √5/3 ≈ 0,745"
"4231";"dissertativa";"Física";"Termodinâmica";"Refrigeração";"Médio";"Vestibular";"2024";"Explique o princípio de funcionamento de uma geladeira, identificando as partes do ciclo de refrigeração e aplicando a primeira e segunda leis da termodinâmica.";"";"";"";"";"";"";"A geladeira é uma máquina frigorífica (inverso da máquina térmica): bombeia calor da fonte fria (interior) para a quente (ambiente). Ciclo: (1) Compressor: trabalho elétrico comprime o refrigerante gasoso → aumenta temperatura e pressão; (2) Condensador (atrás): refrigerante quente cede calor ao ambiente, condensando; (3) Válvula de expansão: pressão cai, refrigerante resfria muito; (4) Evaporador (interior): refrigerante frio absorve calor dos alimentos, evaporando. 1ª lei: Q_fria + W = Q_quente. 2ª lei: precisamos de trabalho externo (elétrico) para bombear calor do frio para o quente (espontâneo seria o contrário).";"Compressor → condensador → expansão → evaporador. W (elétrico) bombeia calor do frio para o quente (2ª lei)"
"4232";"dissertativa";"Química";"Polímeros";"Kevlar e fibras especiais";"Difícil";"Vestibular";"2023";"O Kevlar é uma fibra de aramida usada em coletes à prova de balas. Explique sua estrutura química (ligações amida) e por que é mais resistente que o aço.";"";"";"";"";"";"";"Kevlar: poli(p-fenileno tereftalamida), poliamida aromática. Cadeias poliméricas de anéis benzênicos ligados por grupos amida (-CO-NH-). Alinhadas paralelamente, formam ligações de hidrogênio intermoleculares extremamente fortes. Estrutura cristalina altamente ordenada. Por que mais resistente que aço? Kevlar tem resistência à tração ~3 GPa e densidade ~1,44 g/cm³; aço tem ~1,5 GPa e ~7,8 g/cm³. Relação resistência/peso do Kevlar é 5× maior que o aço. Fibras absorvem e distribuem a energia do impacto pelas ligações de hidrogênio. Aplicações: coletes, capacetes, cordas, pneus.";"Poliamida aromática; ligações amida + hidrogênio entre cadeias → alta resistência; relação resistência/peso 5× maior que aço"
"4233";"dissertativa";"Biologia";"Fisiologia";"Sistema cardiovascular";"Médio";"Vestibular";"2024";"Explique como o corpo regula a pressão arterial, envolvendo barorreceptores, sistema renina-angiotensina e sistema nervoso autônomo.";"";"";"";"";"";"";"Regulação da pressão arterial: (1) Barorreceptores (aorta, carótida): detectam aumento de pressão → enviam sinal ao bulbo → sistema nervoso parassimpático reduz frequência cardíaca + simpático dilata vasos. (2) Sistema renina-angiotensina-aldosterona (SRAA): queda de pressão → rim libera renina → angiotensinogênio → angiotensina II (vasoconstritora) → aldosterona (reabsorção de Na⁺ e água) → aumenta volume sanguíneo e pressão. (3) ADH (vasopressina): hipotálamo/hipófise, retém água nos rins. Hipertensão: regulação desequilibrada; medicamentos atuam nessas vias (betabloqueadores, IECA, diuréticos).";"Barorreceptores → SNA. SRAA: renina → angiotensina II → vasoconstrição + aldosterona. ADH: retém água. Hipertensão: desequilíbrio dessas vias"
"4234";"dissertativa";"Filosofia";"Filosofia Social";"Alienação";"Médio";"Vestibular";"2023";"Marx desenvolveu o conceito de alienação do trabalho. Explique esse conceito e como ele se manifesta no capitalismo contemporâneo.";"";"";"";"";"";"";"Para Marx, a alienação é a separação do trabalhador do produto de seu trabalho, do processo produtivo, dos outros trabalhadores e da sua própria essência humana (trabalho como realização). No capitalismo: o trabalhador produz mercadorias que não lhe pertencem; não controla o processo produtivo; é reduzido a um fator de produção. No capitalismo contemporâneo: trabalho precário e uberizado aprofunda a alienação; mesmo trabalhadores 'qualificados' não controlam o produto final de organizações complexas; consumismo compensa a alienação do trabalho com consumo de mercadorias; redes sociais criam nova alienação (dados como mercadoria).";"Alienação: separação do produto, do processo, dos outros e de si mesmo. Hoje: precarização, uberização, consumismo compensador"
"4235";"dissertativa";"Sociologia";"Saúde";"SUS e saúde pública";"Médio";"Vestibular";"2024";"Analise o Sistema Único de Saúde (SUS) como política pública, seus princípios constitucionais, conquistas e desafios de financiamento.";"";"";"";"";"";"";"O SUS (CF/88 + Lei 8.080/1990) representa a universalização do direito à saúde no Brasil. Princípios: universalidade (saúde para todos), integralidade (promoção, prevenção, tratamento), equidade (mais para quem precisa mais), descentralização, participação social. Conquistas: maior sistema público de saúde do mundo; programa de imunização (maior do planeta); distribuição de medicamentos; transplantes; combate ao tabagismo. Desafios: subfinanciamento crônico (EC 95/2016 congelou gastos); filas e déficit de médicos; desigualdade na qualidade entre regiões; gestão; Emenda do Teto de Gastos.";"Princípios: universalidade, integralidade, equidade. Conquistas: vacinação, medicamentos. Desafios: subfinanciamento, filas, desigualdade regional"
"4236";"dissertativa";"Literatura";"Literatura Brasileira";"Haiku e poesia oriental";"Médio";"Vestibular";"2023";"O haiku é uma forma poética japonesa que influenciou poetas brasileiros. Explique as características do haiku e como Paulo Leminski incorporou essa tradição em sua obra.";"";"";"";"";"";"";"Haiku: poema japonês de 3 versos (5-7-5 sílabas), contemplação da natureza e do momento presente, kigo (palavra de estação), wabi-sabi (beleza do impermanente e imperfeito), satori (iluminação). Paulo Leminski (Curitiba, 1944-89) foi tradutor de Bashô (mestre do haiku) e incorporou o haiku em sua poética: brevidade, síntese extrema, cotidiano, humor e ironia. 'capivara/no córrego/a natureza sendo ela mesma.' Leminski une haiku ao concretismo, à cultura pop, à MPB (parceiro de Caetano) e ao budismo zen. Sua obra é síntese singular: clássico japonês + modernismo + beat + popular.";"Haiku: 3 versos, natureza, brevidade, impermanência. Leminski: tradutor de Bashô, síntese haiku+concretismo+MPB+humor"
"4237";"dissertativa";"Matemática";"Álgebra";"Polinômios";"Médio";"Vestibular";"2024";"Dado o polinômio p(x) = x³ - 6x² + 11x - 6, verifique que x=1, x=2 e x=3 são raízes e escreva p(x) na forma fatorada.";"";"";"";"";"";"";"p(1) = 1-6+11-6 = 0 ✓. p(2) = 8-24+22-6 = 0 ✓. p(3) = 27-54+33-6 = 0 ✓. Como as três raízes são 1, 2, 3: p(x) = (x-1)(x-2)(x-3). Verificação: (x-1)(x-2) = x²-3x+2. (x²-3x+2)(x-3) = x³-3x²-3x²+9x+2x-6 = x³-6x²+11x-6 ✓.";"p(x) = (x-1)(x-2)(x-3)"
"4238";"dissertativa";"Física";"Termodinâmica";"Motores de combustão interna";"Médio";"Vestibular";"2023";"Descreva o ciclo de 4 tempos de um motor a explosão (ciclo Otto), identificando as etapas termodinâmicas e discutindo por que os motores reais são menos eficientes que o ciclo ideal.";"";"";"";"";"";"";"Ciclo Otto (4 tempos): (1) Admissão: pistão desce, admite mistura ar+gasolina; (2) Compressão: pistão sobe, comprime a mistura (processo adiabático); (3) Explosão/expansão: faísca ignita mistura → expansão adiabática faz pistão descer (trabalho útil); (4) Escapamento: pistão sobe, expele gases. Termodinâmica: dois processos adiabáticos + dois isocóricos (explosão e exaustão). Ineficiências reais: atrito mecânico, turbulência, transferência de calor pelas paredes, combustão incompleta, viscosidade do óleo. O rendimento real é ~25-30% vs. ciclo ideal.";"Admissão→compressão→explosão→escapamento. Ineficiências: atrito, calor perdido, combustão incompleta"
"4239";"dissertativa";"Química";"Farmacêutica";"Ação dos medicamentos";"Médio";"Vestibular";"2024";"Explique como funciona o ácido acetilsalicílico (aspirina) no organismo, sua síntese e possíveis efeitos colaterais.";"";"";"";"";"";"";"Síntese: ácido salicílico + anidrido acético → aspirina (ácido acetilsalicílico) + ácido acético (reação de esterificação). Mecanismo: inibe irreversivelmente a enzima COX (ciclooxigenase) que produz prostaglandinas — mediadores da inflamação, febre e dor. Efeitos: anti-inflamatório, analgésico, antipirético, antiplaquetário (em doses baixas). Efeitos colaterais: ulceração gástrica (prostaglandinas protegem o estômago), sangramento (inibe plaquetas), Síndrome de Reye em crianças. Contraindicado na gestação e em crianças com viroses.";"Aspirina inibe COX irreversivelmente → sem prostaglandinas → anti-inflamatório. Efeitos: úlcera, sangramento"
"4240";"dissertativa";"Biologia";"Ecologia";"Mudanças climáticas e biodiversidade";"Médio";"Vestibular";"2023";"Analise como as mudanças climáticas globais ameaçam a biodiversidade, com exemplos de impactos já documentados.";"";"";"";"";"";"";"Impactos das mudanças climáticas na biodiversidade: (1) Deslocamento de espécies — recuam para latitudes/altitudes maiores; ursos polares perdem habitat; (2) Alteração fenológica — desfasamento entre floração e polinizadores; (3) Branqueamento de corais — temperatura > 1°C por semanas expulsa zooxantelas; Grande Barreira de Coral perdeu 50% dos corais; (4) Extinções — anfíbios (quitridiomicose agravada) são os mais afetados; (5) Invasão de espécies exóticas com expansão de suas áreas; (6) Secas e incêndios — Amazônia em ponto de inflexão (tipping point). A taxa de extinção atual é 100-1000× acima da taxa de fundo geológico.";"Deslocamento de espécies, branqueamento de corais, extinções (anfíbios), alteração fenológica, invasões. Taxa extinção 100× acima do normal"
"4241";"dissertativa";"Filosofia";"Filosofia Política";"Anarquismo";"Médio";"Vestibular";"2024";"Explique o pensamento anarquista de Bakunin e Kropotkin e como eles se diferem do marxismo em relação ao Estado.";"";"";"";"";"";"";"Anarquismo: recusa de toda forma de autoridade coercitiva e do Estado. Bakunin: a tomada do Estado pelo proletariado criará nova dominação, não libertação — o poder corrompe. Necessário destruir o Estado simultaneamente à revolução. Kropotkin: anarco-comunismo baseado no apoio mútuo e cooperação espontânea — a natureza humana é cooperativa, não competitiva. Diferença com Marx: Marx propõe 'Estado operário transitório' (ditadura do proletariado) que 'murchará' gradualmente; Bakunin vê isso como ingenuidade ou hipocrisia — qualquer Estado se autoperpetua. A ruptura histórica: expulsão de Bakunin da 1ª Internacional (1872).";"Anarquismo: abolição imediata do Estado. Bakunin: Estado corrompe. Kropotkin: cooperação mútua. vs. Marx: Estado transitório → murchará"
"4242";"dissertativa";"Sociologia";"Meio Ambiente";"Justiça ambiental";"Médio";"Vestibular";"2023";"O conceito de justiça ambiental destaca que populações vulneráveis sofrem desproporcionalmente os impactos ambientais. Analise essa questão no contexto brasileiro.";"";"";"";"";"";"";"Justiça ambiental (surgiu nos EUA, 1980s): comunidades negras e pobres suportam o maior ônus de lixões, indústrias poluentes e desastres ambientais. No Brasil: (1) Comunidades ribeirinhas e indígenas afetadas por hidrelétricas (Belo Monte); (2) Populações negras vivem perto de lixões e indústrias (zona Norte de SP, Baixada Fluminense); (3) Agricultores familiares expostos a agrotóxicos; (4) Populações quilombolas com terras ameaçadas pelo agronegócio; (5) Comunidades costeiras afetadas pelo derramamento de óleo (NE, 2019). A luta ambiental é inseparável da luta por direitos e igualdade.";"Povos vulneráveis (negros, indígenas, pobres) sofrem mais com poluição e desastres. Brasil: Belo Monte, agrotóxicos, lixões em periferias"
"4243";"dissertativa";"Literatura";"Literatura Brasileira";"Rubem Fonseca";"Médio";"Vestibular";"2024";"Rubem Fonseca é um dos principais representantes do conto brasileiro contemporâneo. Analise sua estética (brutalismo) e os temas presentes em seus contos.";"";"";"";"";"";"";"Rubem Fonseca (n. 1925): fundador do 'brutalismo' ou 'ficção suja' brasileira. Estética: linguagem crua e direta, violência explícita, sexo, marginalidade, personagens das classes alta e baixa da sociedade carioca em conflito. Influenciado por Hemingway, a hard-boiled fiction americana. Temas: violência urbana, desigualdade social extrema, crime, degeneração moral, frustrações burguesas. Obras: 'Feliz Ano Novo', 'O Cobrador', 'A Grande Arte'. 'O Cobrador': personagem pobre 'cobra' da classe alta com violência o que a sociedade lhe deve. Criticado pela censura militar: 'Feliz Ano Novo' foi proibido em 1976.";"Brutalismo: linguagem crua, violência, sexo, marginalidade. Desigualdade social, crime urbano. 'O Cobrador': vingança dos excluídos"
"4244";"dissertativa";"Matemática";"Trigonometria";"Equações trigonométricas";"Médio";"Vestibular";"2023";"Resolva a equação sen(x) = √3/2 no intervalo [0°, 360°] e explique como encontrar todas as soluções usando o círculo trigonométrico.";"";"";"";"";"";"";"sen(x) = √3/2. No círculo trigonométrico, seno é positivo no 1º e 2º quadrantes. x = arcsen(√3/2) = 60°. No 2º quadrante: x = 180° - 60° = 120°. Soluções em [0°, 360°]: x = 60° e x = 120°. Para todas as soluções: x = 60° + 360°k ou x = 120° + 360°k, k ∈ ℤ. No círculo: os pontos onde a ordenada é √3/2 ≈ 0,866.";"x = 60° e x = 120° no intervalo [0°, 360°]"
"4245";"dissertativa";"Física";"Mecânica";"Energia potencial gravitacional";"Médio";"Vestibular";"2024";"Um objeto de 5 kg é lançado verticalmente para cima com velocidade inicial de 20 m/s. (g=10 m/s²). a) Qual é a altura máxima? b) Qual é a energia mecânica total? c) Qual é a velocidade a 10 m de altura?";"";"";"";"";"";"";"a) Na altura max, v=0. Ec_inicial = Ep_max: ½×5×400 = 5×10×h → h = 1000/50 = 20 m. b) Em = Ec + Ep = 1000 + 0 = 1000 J (na base). c) Em = Ec(10m) + Ep(10m): 1000 = ½×5×v² + 5×10×10 = 2,5v² + 500. 2,5v² = 500 → v² = 200 → v = 10√2 ≈ 14,1 m/s.";"a) h=20m; b) Em=1000J; c) v=10√2 ≈ 14,1 m/s"
"4246";"dissertativa";"Química";"Bioquímica";"Vitaminas";"Fácil";"Vestibular";"2023";"Explique a diferença entre vitaminas lipossolúveis e hidrossolúveis, com exemplos de cada grupo, suas funções e os riscos de deficiência ou excesso.";"";"";"";"";"";"";"Lipossolúveis (A, D, E, K): solúveis em lipídios, armazenadas no tecido adiposo e fígado. Risco de hipervitaminose (excesso) por acúmulo. Vitamina A (visão), D (absorção de cálcio, ossos), E (antioxidante), K (coagulação). Hidrossolúveis (complexo B, C): solúveis em água, não acumuladas no organismo, excesso eliminado na urina. Necessitam reposição regular. Vitamina C (colágeno, imunidade), B12 (neurológica, hematopoiese). Deficiências: vitamina D → raquitismo; vitamina C → escorbuto; B12 → anemia perniciosa.";"Lipossolúveis (ADEK): armazenadas, risco de excesso. Hidrossolúveis (B,C): excretadas, reposição diária. Deficiências: raquitismo, escorbuto"
"4247";"dissertativa";"Biologia";"Genética";"Genética de populações";"Médio";"Vestibular";"2024";"Explique o Princípio de Hardy-Weinberg e as condições para que uma população esteja em equilíbrio. Qual é a importância desse princípio para a genética de populações?";"";"";"";"";"";"";"Hardy-Weinberg (1908): em uma população ideal, as frequências alélicas e genotípicas permanecem constantes de geração em geração. Equilíbrio HW: p² + 2pq + q² = 1 (onde p e q são frequências dos alelos). Condições: população infinita (sem deriva), sem mutação, sem migração, acasalamento aleatório (panmixia), sem seleção natural. Na prática, essas condições raramente se mantêm. Importância: serve de referência para detectar evolução — se as frequências mudam, alguma força evolutiva está atuando. Usado na genética forense, epidemiologia genética e estudo de doenças recessivas.";"HW: p²+2pq+q²=1; sem mutação, migração, seleção, deriva. Referência para detectar evolução em populações reais"
"4248";"dissertativa";"Filosofia";"Estética";"Arte contemporânea";"Médio";"Vestibular";"2023";"Walter Benjamin argumentou que a reprodutibilidade técnica destruiu a 'aura' da obra de arte. Explique esse argumento e avalie sua relevância na era digital.";"";"";"";"";"";"";"Benjamin ('A Obra de Arte na Era da Reprodutibilidade Técnica', 1935): a aura é a qualidade de presença única e autenticidade da obra de arte original — ligada a um aqui e agora específico, à tradição e ao ritual. A reprodução técnica (fotografia, cinema) destruiria a aura: cópias iguais perdem o original. Benjamin vê isso com ambiguidade: negativo (perda da autenticidade), positivo (democratização da arte, potencial político). Na era digital: Netflix, Spotify, museus virtuais, NFTs (tentativa de recriar a aura digital), deepfakes — a reprodutibilidade é total e instantânea. A aura se torna commodity nos NFTs, irônica inversão.";"Aura = autenticidade/presença única; reprodução técnica destrói a aura. Digital: reprodução total; NFT = tentativa de recriar aura digital"
"4249";"dissertativa";"Sociologia";"Trabalho";"Sindicalismo";"Médio";"Vestibular";"2024";"Analise o histórico do movimento sindical no Brasil, desde a República Velha até a CUT, discutindo sua relevância contemporânea.";"";"";"";"";"";"";"Histórico: República Velha — sindicalismo anarquista e comunista entre imigrantes (greve de 1917). Era Vargas: corporativismo estatal — sindicatos controlados pelo Estado (imposto sindical, peleguismo). Ditadura Militar: sindicatos reprimidos. Novo Sindicalismo (1970s-80s, ABC Paulista): metalúrgicos (Lula), greves, combativo e independente. CUT (1983): Central Única dos Trabalhadores, vinculada ao PT. Reforma Trabalhista 2017: fim do imposto sindical obrigatório → enfraquecimento financeiro. Relevância atual: desafio da uberização e trabalho precário que fragmenta a classe trabalhadora, dificultando organização coletiva.";"Vargas: sindicatos corporativistas. Novo sindicalismo: CUT, Lula, greves ABC. 2017: reforma enfraquece. Hoje: uberização fragmenta"
"4250";"dissertativa";"Literatura";"Literatura Brasileira";"Manoel de Barros";"Médio";"Vestibular";"2023";"Manoel de Barros é conhecido por valorizar o 'inútil', as coisas sem valor aparente. Analise sua proposta estética e como ela questiona valores utilitaristas da modernidade.";"";"";"";"";"";"";"Manoel de Barros (Mato Grosso, 1916-2014): poeta do pantanal e da infância. Estética da 'inutilidade': 'O que não tem nome e não tem utilidade, / isso é que tem mais importância' — valoriza o descartado, o inseto, o lodo, a lata velha, a criança, o absurdo. Linguagem: neologismos, sintaxe desorganizada, humor poético, voz de criança. Questionamento dos valores utilitaristas: modernidade capitalista valoriza só o que é produtivo e lucrativo; Barros reivindica beleza no inútil, no esquecido — ética do cuidado do ordinário. Influenciado pela poesia concreta e pelo budismo zen.";"'Inutilidade' como resistência ao utilitarismo. Valoriza o descartado, a infância, o pantanal. Linguagem: neologismos, humor, voz infantil"
"3306";"multipla";"Matemática";"Trigonometria";"Tabela trigonométrica";"Fácil";"Vestibular";"2024";"O valor de tg(45°) é:";"0";"√3/2";"1";"√3";"1/2";"c";"tg(45°) = sen(45°)/cos(45°) = (√2/2)/(√2/2) = 1. Valores importantes: tg(0°)=0, tg(30°)=√3/3, tg(45°)=1, tg(60°)=√3.";""
"3307";"multipla";"Física";"Mecânica";"Número de Mach";"Médio";"Vestibular";"2023";"O número de Mach é a razão entre a velocidade de um objeto e a velocidade do som no meio. Um avião voando a Mach 2 tem velocidade:";"Igual à velocidade do som";"Duas vezes a velocidade do som";"Metade da velocidade do som";"Igual à velocidade da luz";"Independente do som";"b";"Mach 2 significa o objeto se move a 2× a velocidade do som (~340 m/s no ar), portanto ~680 m/s. Mach 1 = velocidade do som; Mach > 1 é supersônico.";""
"3308";"multipla";"Química";"Orgânica";"Fermentação";"Fácil";"Vestibular";"2024";"A fermentação lática, usada para produzir iogurte, tem como produto final:";"Etanol e CO₂";"Ácido lático";"Ácido acético";"Glicose";"Oxigênio";"b";"Fermentação lática: glicose → ácido lático (sem CO₂). Usada por bactérias do ácido lático para produzir iogurte, queijo, chucrute. Fermentação alcoólica: glicose → etanol + CO₂.";""
"3309";"multipla";"Biologia";"Fisiologia";"Regulação da temperatura";"Fácil";"Vestibular";"2023";"Animais que mantêm a temperatura corporal constante independente do ambiente são denominados:";"Pecilotérmicos";"Ectotérmicos";"Homeotérmicos";"Poiquilotérmicos";"Mesotérmicos";"c";"Homeotérmicos (ou endotérmicos): regulam internamente a temperatura (aves e mamíferos). Pecilotérmicos/ectotérmicos: temperatura varia com o ambiente (peixes, anfíbios, répteis).";""
"3310";"multipla";"História";"Brasil Contemporâneo";"Abertura democrática";"Médio";"Vestibular";"2024";"A 'Lei da Anistia' de 1979, promulgada durante o governo Figueiredo, foi controversa porque:";"Anistiou apenas os militares";"Anistiou tanto opositores políticos como agentes do Estado que cometeram crimes de tortura";"Não libertou nenhum preso político";"Foi aprovada por referendum popular";"Criou o multipartidarismo";"b";"A Lei da Anistia (1979) foi 'ampla, geral e irrestrita': anistiou opositores políticos exilados e presos, mas também anistiou os torturadores do regime militar — protegendo-os de julgamento. Isso é controverso até hoje.";""
"3311";"multipla";"Português";"Literatura";"Trovadorismo";"Médio";"Vestibular";"2023";"O Trovadorismo foi a primeira manifestação literária da língua portuguesa. O gênero lírico mais característico desse período é a:";"Ode";"Cantiga de amor";"Soneto";"Epopeia";"Crônica";"b";"O Trovadorismo (sécs. XII-XIV) produziu cantigas: de amor (eu-lírico masculino que sofre pela dama), de amigo (eu-lírico feminino), de escárnio e maldizer (sátiras), pastorelas e tenções.";""
"3312";"multipla";"Matemática";"Plano cartesiano";"Quadrantes";"Fácil";"Vestibular";"2024";"O ponto (-3, 4) pertence ao:";"1º quadrante";"2º quadrante";"3º quadrante";"4º quadrante";"Eixo y";"b";"2º quadrante: x negativo e y positivo. (-3, 4): x=-3<0 e y=4>0. Portanto está no 2º quadrante.";""
"3313";"multipla";"Física";"Cinemática";"Aceleração";"Fácil";"Vestibular";"2023";"Se a velocidade de um objeto muda de 10 m/s para 30 m/s em 5 segundos, a aceleração média é:";"2 m/s²";"4 m/s²";"6 m/s²";"8 m/s²";"10 m/s²";"b";"a = Δv/Δt = (30-10)/5 = 20/5 = 4 m/s².";""
"3314";"multipla";"Química";"Soluções";"Osmose";"Médio";"Vestibular";"2024";"A osmose é a passagem de solvente (água) através de membrana semipermeável de solução:";"Mais concentrada para a menos concentrada";"Menos concentrada para a mais concentrada";"Com temperatura menor para a maior";"De alta pressão para baixa pressão";"Com pH neutro para ácido";"b";"Na osmose, o solvente (água) passa do meio hipotônico (menos concentrado) para o hipertônico (mais concentrado) através de membrana semipermeável, tendendo a equilibrar as concentrações.";""
"3315";"multipla";"Biologia";"Botânica";"Órgãos das plantas";"Fácil";"Vestibular";"2023";"Qual é a função principal do floema nas plantas?";"Absorver água e sais minerais do solo";"Transportar a seiva elaborada (orgânica) produzida na fotossíntese";"Fornecer suporte mecânico à planta";"Realizar trocas gasosas";"Armazenar água na folha";"b";"O floema transporta a seiva elaborada (açúcares e nutrientes orgânicos produzidos na fotossíntese) das folhas para os demais órgãos da planta.";""
"3316";"multipla";"Sociologia";"Gênero";"Teoria de gênero";"Médio";"Vestibular";"2024";"Judith Butler, em 'Problemas de Gênero', propõe que gênero é:";"Determinado biologicamente pelo sexo";"Uma performance cultural e repetitiva, não uma essência inata";"Um produto do sistema capitalista";"Imutável e determinado pelo nascimento";"Igual ao conceito de sexo biológico";"b";"Butler propõe que gênero não é uma essência natural, mas um conjunto de atos performativos repetidos que criam a ilusão de uma identidade de gênero estável. Gênero é construído culturalmente, não dado biologicamente.";""
