"id";"tipo";"disc";"tema";"subtema";"dif";"fonte";"ano";"xp";"enunciado";"a";"b";"c";"d";"e";"ok";"exp"
"ENEM_2022_Q071";"multipla";"História";"Comunicação e Tecnologia";"Comprensión lectora";"Difícil";"ENEM";"2022";"20";"O princípio básico do Estado de direito é o da eliminação do arbítrio no exercício dos poderes públicos, com a consequente garantia de direitos dos indivíduos perante esses poderes. Estado de direito significa que nenhum indivíduo, presidente ou cidadão comum está acima da lei. Os governos democráticos exercem a autoridade por meio da lei e estão eles próprios sujeitos as constrangimentos impostos pela lei. **CANOTILHO, J. J. G. Estado de direito, Lisboa: Gradiva, 1999 (adaptado).**";"Supressão de eleições de representantes políticos.";"Intervenção em áreas de vulnerabilidade pela Igreja.";"Disseminação de projetos sociais em universidades.";"Ampliação dos processos de concentração de renda.";"Regulamentação das relações de trabalho pelo Legislativo.";"a";"A resposta correta é a alternativa A. Supressão de eleições de representantes políticos."
"ENEM_2022_Q072";"multipla";"Sociologia";"Artes e Cultura";"Romantismo";"Difícil";"ENEM";"2022";"20";"**Brasileiros levam mais tempo de casa para o trabalho** Pesquisa do IBGE aponta que a situação é maio grave no Sudeste: 13% das pessoas levam mais de um hora para chegar ao trabalho. Nas regiões metropolitanas de São Paulo e do Rio, o IBGE registrou os maiores percentuais de trabalhadores que levam mais de uma hora no trajeto até o emprego. Quem vê o Marcelo chegar ao trabalho nem imagina a maratona que ele enfrenta todos os dias antes das 5 h. “Acordo 4 h 30, saio de casa 5 h, pego trem 5 h 20, chego na Central umas 6 h 50, pego ônibus e chego no trabalho mais ou menos 7 h 10”, conta. Segundo especialista, são os mais pobres os que moram mais longe do emprego. **Disponivel em: www.portaldotransito.com.br. Acesso em: 23 nov 2021 (adaptado)**";"Fluxo de retorno.";"Migração interna.";"Mudança sazonal.";"Movimento pendular.";"Deslocamento forçado.";"d";"A resposta correta é a alternativa D. Movimento pendular."
"ENEM_2022_Q073";"multipla";"História";"Língua Estrangeira (Espanhol)";"Romantismo";"Difícil";"ENEM";"2022";"20";"A história do Primeiro de Maio de 1890 — na França e na Europa, o primeiro de todos os Primeiros de Maio – é, sob vários aspectos, exemplar. Resultante de um ato político deliberado, essa manifestação ilustra o lado voluntário da construção de uma classe — a classe operária — à qual os socialistas tentam dar uma unidade política e cultural através daquela pedagogia da festa cujo princípio, eficácia e limites há muito tempo tinham sido experimentados pela Revolução Francesa. **PERROT, M. Os excluídos da história: operários, mulheres e prisioneiros. Rio de Janeiro: Paz e Terra, 1988.**";"Valorizar um sentimento burguês.";"Afirmar uma identidade coletiva.";"Edificar uma memória nacional.";"Criar uma comunidade cívica.";"Definir uma tradição popular.";"b";"A resposta correta é a alternativa B. Afirmar uma identidade coletiva."
"ENEM_2022_Q074";"multipla";"História";"Interpretação e Produção de Texto";"Análise sintática";"Difícil";"ENEM";"2022";"20";"![](https://enem.dev/2022/questions/74/03a69ed2-9038-4cca-8947-88663cbe1d23.png) **PEREIRA, E. B. et al. Atlas brasileiro de energia solar. São José dos Campos: Inpe, 2006**";"Declividade do relevo.";"Extensão longitudinal.";"Nebulosidade atmosférica.";"Irregularidade pluviométrica.";"Influência da continentalidade.";"c";"A resposta correta é a alternativa C. Nebulosidade atmosférica."
"ENEM_2022_Q075";"multipla";"História";"Literatura Portuguesa";"Mídias digitais";"Difícil";"ENEM";"2022";"20";"O povo Kambeba é o povo da águas. Os mais velhos costumam contar que o povo nasceu de uma gota-d’água que caiu do céu em uma grande chuva. Nessa gota estavam duas gotículas: o homem e a mulher. “Por essa narrativa e cosmologia indígena de que nós somos o povo das águas é que o rio nos tem fundamental importância”, diz Márcia Wayna Kambeba, mestre em Geografia e escritora. Todos os dias, ela ia com o pai observar o rio. Ia em silêncio e, antes que tomasse para si a palavra, era interrompida. “Ouço o rio”, o pai dizia. Depois de cerca de duas horas a ouvir as águas do Solimões, ela mergulhava. “Confie no rio e aprenda com ele”. “Fui entender mais tarde, com meus estudos e vivências, que meu pai estava me apresentando à sabedoria milenar do rio”. **Rios amazônicos influenciam no agro e em reservatórios do Sudeste. Disponível em: www.uol.com.br. Acesso em: 14 out. 2021.**";"Objeto tombado e museográfico.";"Herança religiosa e sacralizada.";"Cenário bucólico e paisagístico";"Riqueza individual e efêmera";"Patrimônio cultural e afetivo.";"e";"A resposta correta é a alternativa E. Patrimônio cultural e afetivo."
"ENEM_2022_Q076";"multipla";"História";"Língua Estrangeira (Espanhol)";"Modernismo";"Difícil";"ENEM";"2022";"20";"Lá embaixo está o açude Itans, com seu formigueiro a cavar a terra. É mesmo impressionante o esforço daquele formigar de homens ao sol, lavados em suor, que não param em longas filas pacientes acompanhando centenas de burricos que sobem e descem, numa ciranda comovente e silenciosa, cada burrico com duas caixas de terra no lombo. É o labor organizado para a salvação da terra e do homem. Depois do semideserto que tanto nos acabrunhou o espírito por falta de chuvas, o esforço destes milhares de sertanejos, todos vestidos de brim mescla e calçando alpercatas, no combate consciente à esterilidade da natureza, com famílias alojadas em pequeninas casas de taipas e telha – embrião de futura cidade – impressionava-nos profundamente. **VALLE, F. M. História do Açude Itans, município de Caicó (RN). Brasília, 1994 (adaptado)**";"Engenheiros na execução de canais fluviais.";"Coronéis na ampliação de antigas fazendas.";"Operários na distribuição dos recursos hídricos.";"Trabalhadores na formação de novos espaços.";"Negociantes na organização de redes comerciais.";"d";"A resposta correta é a alternativa D. Trabalhadores na formação de novos espaços."
"ENEM_2022_Q077";"multipla";"História";"Gramática e Linguística";"Comprensión lectora";"Difícil";"ENEM";"2022";"20";"Para os Impérios Coloniais, o problema das doenças que atingiam os escravos era algo com que cotidianamente deparavam os senhores. Em vista disso, uma série de obras dedicadas à administração de escravos foi publicada com vista a implementar uma moderna gestão da mão de obra escravista em convergência com O Iluminismo. Nesse contexto, o saber médico adquiria um papel extremamente relevante. Este era encarado como um instrumento fundamental ao desenvolvimento colonial, dada a percepção do impacto que as doenças tropicais causavam na população branca e nos povos escravizados. **ABREU, J. L. N. A Colônia enferma e a saúde dos povos: a medicina das “luzes” e as informações sobre as enfermidades da América portuguesa. História, Ciências, Saúde – Manguinhos, n. 3, jul.-set. 2007 (adaptado).**";"Econômicos das elites.";"Naturalistas dos viajantes.";"Abolicionistas dos letrados.";"Tradicionalistas dos nativos.";"Emancipadores das metrópoles.";"a";"A resposta correta é a alternativa A. Econômicos das elites."
"ENEM_2022_Q078";"multipla";"História";"Língua Estrangeira (Espanhol)";"Coesão e coerência";"Difícil";"ENEM";"2022";"20";"![](https://enem.dev/2022/questions/78/1032a7bb-17e5-4711-ad16-aa16988017fa.png) **Disponível em: http://imguol.com. Acesso em: 30 mar. 2014 (adaptado).**";"1 : 12 500.";"1 : 125 000.";"1 : 1 250 000.";"1 : 12 500 000.";"1 : 125 000 000.";"e";"A resposta correta é a alternativa E. 1 : 125 000 000."
"ENEM_2022_Q079";"multipla";"História";"Comunicação e Tecnologia";"Modernismo";"Difícil";"ENEM";"2022";"20";"Hoje sou um ser inanimado, mas já tive vida pulsante em seivas vegetais, ful um ser vivo; é bem verdade que do reino vegetal, mas isso não me tirou a percepção de vida vivida como tamborete. Guardo apreço pelos meus criadores, as mãos que me fizeram, me venderam, 6 pelas mulheres que me usaram para suas vendas e de tantas outras maneiras. Essas pessoas, sim, tiveram suas subjetividades, singularidades e pluralidades, que estão incorporadas a mim. É preciso considerar que a nossa história, de móveis de museus, está para além da mera vinculação aos estilos e à patrimonialização que recebemos como bem material vinculado ao patrimônio imaterial. A nossa história está ligada aos dons individuais das pessoas e suas práticas sociais. Alguns indivíduos consagravam-se por terem determinados requisitos, tais como o conhecimento de modelos clássicos ou destreza nos desenhos. **FREITAS, J. M.; OLIVEIRA, L. R. Memórias de um tamborete de baiana: as muitas vozes em um objeto de museu. Revista Brasileira de Pesquisa (Auto)Blográfica, n. 14, maio-ago. 2020 (Adaptado).**";"Habilidades artísticas e culturais dos sujeitos.";"Vocações religiosas e pedagógicas dos mestres.";"Naturezas antropológica e etnográfica dos expositores.";"Preservações arquitetônica e visual dos conservatórios.";"Competências econômica e financeira dos comerciantes.";"a";"A resposta correta é a alternativa A. Habilidades artísticas e culturais dos sujeitos."
"ENEM_2022_Q080";"multipla";"História";"Literatura Portuguesa";"Modernismo";"Difícil";"ENEM";"2022";"20";"Advento da _Polis_, nascimento da filosofia: entre as duas ordens de fenômenos, os vínculos são demasiado estreitos para que o pensamento racional não apareça, em suas origens, solidário das estruturas sociais e mentais próprias da cidade grega. Assim recolocada na história, a filosofia despoja-se desse caráter de revelação absoluta que às vezes lhe foi atribuído, saudando, na jovem ciência dos jônios, a razão intemporal que veio encarnar-se no Tempo. A escola de Mileto não viu nascer a Razão; ela construiu uma Razão, uma primeira forma de racionalidade. Essa razão grega não é a razão experimental da ciência contemporânea. **VERNANT, J. P. Origens do pensamento grego. Rio de Janeiro: Difel, 2002.**";"Os epicuristas, envolvidos com o ideal de vida feliz.";"Os estoicos, dedicados à superação dos infortúnios.";"Os sofistas, comprometidos com o ensino da retórica.";"Os peripatéticos, empenhados na dinâmica do ensino.";"Os poetas rapsodos, responsáveis pela narrativa do mito.";"c";"A resposta correta é a alternativa C. Os sofistas, comprometidos com o ensino da retórica."
"ENEM_2022_Q081";"multipla";"História";"Língua Estrangeira (Espanhol)";"Reading comprehension";"Médio";"ENEM";"2022";"15";"**Decreto-Lei n. 1 949, de 27/17/1937** Art. 1.o Fica criado o Departamento de Imprensa e Propaganda (DIP), diretamente subordinado ao presidente da República. Art. 2.o O DIP tem por fim: **h)** coordenar e incentivar as relações da imprensa com os poderes públicos no sentido de maior aproximação da mesma com os fatos que se ligam aos interesses nacionais; **n)** autorizar mensalmente a devolução dos depósitos efetuados pelas empresas jornalísticas para importação de papel para imprensa , uma vez demonstrada, a seu juízo, a eficiência e a utilidade pública dos jornais ou periódicos por elas administrados ou dirigidos. **BRASIL apud CARONE, E. A Terceira República. (1937-1945). São Paulo: Difel, 1982. (Adaptado).**";"Diversificação da opinião pública.";"Mercantilização da cultura popular.";"Controle das organizações sindicais.";"Cerceamento da liberdade de expressão.";"Privatização dos meios de comunicação";"d";"A resposta correta é a alternativa D. Cerceamento da liberdade de expressão."
"ENEM_2022_Q082";"multipla";"História";"Língua Estrangeira (Espanhol)";"Coesão e coerência";"Médio";"ENEM";"2022";"15";"![](https://enem.dev/2022/questions/82/9d037d23-4819-4184-9aab-bb87c3b40c73.png) **Geoestatísticas de recursos naturais da Amazônia Legal. Rio de Janeiro: IBGE, 2011 (adaptado).**";"Abalos sísmicos periódicos.";"Jazidas de minerais metálicos.";"Reservas de combustíveis fósseis.";"Aquíferos sedimentares profundos.";"Estruturas geológicas metamórficas.";"b";"A resposta correta é a alternativa B. Jazidas de minerais metálicos."
"ENEM_2022_Q083";"multipla";"História";"Literatura Brasileira";"Comprensión lectora";"Médio";"ENEM";"2022";"15";"Nascidas o Líbano, as duas irmãs não puderam ser registradas no país, porque lá é exigido que os nascidos sejam filhos de pais e mães libaneses. Seus pais, de nacionalidade síria, também não puderam registrá-las no país de origem. Na Síria, crianças só são registradas por pais oficialmente casados, o que não era o caso deles. **Disponível em: https://agenciabrasi.ebc.com.br. Acesso em: 7 nov. 2021.**";"Exiladas.";"Apátridas.";"Foragidas.";"Refugiadas.";"Clandestinas.";"b";"A resposta correta é a alternativa B. Apátridas."
"ENEM_2022_Q084";"multipla";"História";"Comunicação e Tecnologia";"Comprensión lectora";"Médio";"ENEM";"2022";"15";"**TEXTO I** Uma filosofia da percepção que queira reaprender a ver o mundo restituirá à pintura e às artes em geral seu lugar verdadeiro. **MERLEAU-PONTY, M. Conversas: 1948. São Paulo: Martins Fontes, 2004.** TEXTO II Os grandes autores de cinema nos pareceram confrontáveis não apenas com pintores, arquitetos, músicos, mas também com pensadores. Eles pensam com imagens, em vez de conceitos. **DELEUZE, G. Cinema 1: a imagem-movimento. São Paulo: Brasiliense, 1983 (adaptado).**";"Admitindo o belo como fenômeno transcendental.";"Reafirmando a vivência estética como juízo de gosto.";"Considerando o olhar como experiência de conhecimento.";"Apontando as formas de expressão como auxiliares da razão.";"Estabelecendo a inteligência como implicação das representações.";"c";"A resposta correta é a alternativa C. Considerando o olhar como experiência de conhecimento."
"ENEM_2022_Q085";"multipla";"História";"Literatura Portuguesa";"Análise sintática";"Médio";"ENEM";"2022";"15";"**TEXTO I** Manda o Santo Ofício da Inquisição que ninguém, seja qual for seu estado, idade ou condição, pare com carroça, caleça ou montaria nem atrapalhe com mesas ou cadeiras o centro das ruas, que vão da Inquisição a São Domingos, nem atravesse a procissão em ponto algum da ida ou da volta, amanhã, 19 do corrente, em que se celebrará auto de fé. E também que nem nesse dia nem nos dos açoites ouse alguém atirar nos réus maçãs, pedras, laranjas nem outra coisa qualquer. **PALMA, R. Anais da Inquisição de Lima. São Paulo: Edusp; Giordano, 1992 (adaptado).** **TEXTO II** Como acontece em todos os ritos, o sentido do auto da fé é conferido pela sequência dos atos que o compõem. Os lugares, as posturas, os gestos, as palavras são fixados previamente em toda a sua complexidade. Por isso, o auto da fé apresenta momentos fortes – durante a preparação, a encenação, o ato e a recepção – que convém seguir em seus pormenores. **BETHENCOURT, F. História das Inquisições: Portugal, Espanha e Itália – séculos XV-XIX. São Paulo: Cia. das Letras, 2000**";"Abrandar cerimônias de punição.";"Favorecer anseios de violência.";"Criticar políticas de disciplina.";"Produzir padrões de conduta.";"Ordenar cultos de heresia.";"d";"A resposta correta é a alternativa D. Produzir padrões de conduta."
"ENEM_2022_Q086";"multipla";"História";"Língua Estrangeira (Inglês)";"Análise sintática";"Médio";"ENEM";"2022";"15";"Empédocles estabelece quatro elementos corporais – fogo, ar, água e terra –, que são eternos e que mudam aumentando e diminuindo mediante mistura e separação; mas os princípios propriamente ditos, pelos quais são movidos, são o Amor e o Ódio. Pois é preciso que os elementos permaneçam alternadamente em movimento, sendo ora misturados pelo Amor, ora separados pelo Ódio. SIMPLÍCIO. Física, 25, 21. In: **Os pré-socráticos**. São Paulo: Nova Cultural, 1996.";"Exalta a investigação filosófica.";"Transcende ao mundo sensível.";"Evoca a discussão cosmogônica.";"Fundamenta as paixões humanas.";"Corresponde à explicação mitológica.";"c";"A resposta correta é a alternativa C. Evoca a discussão cosmogônica."
"ENEM_2022_Q087";"multipla";"História";"Língua Estrangeira (Inglês)";"Comprensión lectora";"Médio";"ENEM";"2022";"15";"Macrocefalia urbana pode ser entendida como a massiva concentração das atividades econômicas em algumas metrópoles que propicia o desencadeamento de processos descompassados: redirecionamento e convergência de fluxos migratórios, déficit no numero de empregos, ocupação desordenada em determinadas regiões da cidade e estigmatizarão de estratos sociais , que comprometem substancialmente a segurança pública urbana. SANTOS, M. **O espaço dividido:** os dois circuitos da economia urbana dos países subdesenvolvidos. São Paulo: Edusp. 2004.";"Limitação da Área ocupada";"Êxodo da população do campo";"Ampliação do risco habitacional";"Deficiência do transporte alternativo";"Crescimento da taxa de fecundidade";"b";"A resposta correta é a alternativa B. Êxodo da população do campo"
"ENEM_2022_Q088";"multipla";"História";"Interpretação e Produção de Texto";"Mídias digitais";"Médio";"ENEM";"2022";"15";"Entretanto, nosso amigo Basso tem o ânimo alegre. Isso resulta da filosofia: estar alegre diante da morte, forte e contente qualquer que seja o estado do corpo, sem desfalecer, ainda que desfaleça. **Sêneca, L. Cartas morais. Lisboa: Calouste Gulbenkian, 1990.**";"Valorização de disputas dialógicas";"Rejeição das convenções sociais";"Inspiração de natureza religiosa";"Exaltação do sofrimento";"Moderação das paixões";"e";"A resposta correta é a alternativa E. Moderação das paixões"
"ENEM_2022_Q089";"multipla";"História";"Língua Estrangeira (Inglês)";"Comprensión lectora";"Médio";"ENEM";"2022";"15";"Quando os espanhóis chegaram à América, estava em seu apogeu o império teocrático dos Incas, que estendia seu poder sobre o que hoje chamamos Peru, Bolívia e Equador, abarcava parte da Colômbia e do Chile e alcançava até o norte argentino e a selva brasileira; a confederação dos Astecas tinha conquistado um alto nível de eficiência no vale do México, e no Yucután, na América Central, a esplêndida civilização dos Maias persistia nos povos herdeiros, organizados para o trabalho e para a guerra. Os Maias tinham sido grandes astrônomos, mediram o tempo e o espaço com assombrosa precisão, e tinham descoberto o valor do número zero antes de qualquer povo da história. No museu de Lima, podem ser vistos centenas de crânios que receberam placas de ouro e prata por parte dos cirurgiões Incas. GALEANO, E. **As veias abertas da América Latina.** Porto Alegre: L&PM, 2012.";"Bens religiosos inspirados na matriz cristã.";"Materiais bélicos pilhados em batalhas coloniais.";"Heranças culturais constituídas de saberes próprios.";"Costumes laborais moldados em estilos estrangeiros.";"Práticas medicinais alicerçadas no conhecimento científico.";"c";"A resposta correta é a alternativa C. Heranças culturais constituídas de saberes próprios."
"ENEM_2022_Q090";"multipla";"História";"Língua Estrangeira (Espanhol)";"Mídias digitais";"Médio";"ENEM";"2022";"15";"Em Vitória (ES), no bairro Goiabeiras, encontramos as paneleiras, mulheres que são conhecidas pelos saberes/fazeres das tradicionais panelas de barro, ícones da culinária capixaba. A tradição passada de mãe para filha é de origem indígena e sofreu influência de outras etnias, como a afro e a luso. Dessa mistura, acredita-se que a fabricação das panelas de barro já tenha 400 anos. A fabricação das panelas de barro se dá em várias etapas, desde a obtenção de matéria-prima à confecção das panelas. As matérias-primas tradicionalmente utilizadas são provenientes do meio natural, como: argila, retirada do barreiro no Vale do Mulembá; madeira, atualmente proveniente das sobras da construção civil; e tinta, extraída da casca do manguezal, o popular mangue-vermelho. **TRISTÃO, M. A educação ambiental e o pós-colonialismo. Revista de Educação, n. 53, ago. 2014.**";"Manutenção dos modos de vida.";"Conservação dos plantios da roça.";"Atualização do modelo de gestão.";"Participação na sociedade de consumo.";"Especialização nas etapas de produção.";"a";"A resposta correta é a alternativa A. Manutenção dos modos de vida."
"ENEM_2022_Q090";"multipla";"História";"Literatura Brasileira";"Mídias digitais";"Médio";"ENEM";"2022";"15";"Em Vitória (ES), no bairro Goiabeiras, encontramos as paneleiras, mulheres que são conhecidas pelos saberes/fazeres das tradicionais panelas de barro, ícones da culinária capixaba. A tradição passada de mãe para filha é de origem indígena e sofreu influência de outras etnias, como a afro e a luso. Dessa mistura, acredita-se que a fabricação das panelas de barro já tenha 400 anos. A fabricação das panelas de barro se dá em várias etapas, desde a obtenção de matéria-prima à confecção das panelas. As matérias-primas tradicionalmente utilizadas são provenientes do meio natural, como: argila, retirada do barreiro no Vale do Mulembá; madeira, atualmente proveniente das sobras da construção civil; e tinta, extraída da casca do manguezal, o popular mangue-vermelho. **TRISTÃO, M. A educação ambiental e o pós-colonialismo. Revista de Educação, n. 53, ago. 2014.**";"Manutenção dos modos de vida.";"Conservação dos plantios da roça.";"Atualização do modelo de gestão.";"Participação na sociedade de consumo.";"Especialização nas etapas de produção.";"a";"A resposta correta é a alternativa A. Manutenção dos modos de vida."
"ENEM_2022_Q091";"multipla";"Biologia";"Literatura Brasileira";"Modernismo";"Médio";"ENEM";"2022";"15";"A figura ilustra esquematicamente um processo de remediação de solos contaminados com tricloroeteno (TCE), um agente desengraxante. Em razão de vazamentos de tanques de estocagem ou de manejo inapropriado de resíduos industriais, ele se encontra presente em águas subterrâneas, nas quais forma uma fase líquida densa não aquosa (DNAPL) que se deposita no fundo do aquífero. Essa tecnologia de descontaminação emprega o íon persulfato (S2 O8 2−), que é convertido no radical •SO4 − por minerais que contêm Fe(III). O esquema representa de forma simplificada o mecanismo de ação química sobre o TCE e a formação dos produtos de degradação. ![](https://enem.dev/2022/questions/91/0c8a2451-b60e-4a4f-9eb8-4cac8fe9536d.png) BERTAGI, L. T.; BASÍLIO, A. O.; PERALTA-ZAMORA, P. Aplicações ambientais de persulfato: remediação de águas subterrâneas e solos contaminados. Química Nova, n. 9, 2021 (adaptado)";"Oxirredução";"Substituição";"Precipitação";"Desidratação";"Neutralização";"a";"A resposta correta é a alternativa A. Oxirredução"
"ENEM_2022_Q092";"multipla";"História";"Interpretação e Produção de Texto";"Coesão e coerência";"Médio";"ENEM";"2022";"15";"De acordo com a Organização Mundial da Saúde, a filariose e a leishmaniose são consideradas doenças tropicais infecciosas e constituem uma preocupação para a saúde pública por ser alto o índice de mortalidade a elas associado.";"Incineração do lixo orgânico.";"Construção de rede de esgoto.";"Uso de vermífugo pela população.";"Controle das populações dos vetores.";"Consumo de carnes vermelhas bem cozidas.";"d";"A resposta correta é a alternativa D. Controle das populações dos vetores."
"ENEM_2022_Q093";"multipla";"Biologia";"Comunicação e Tecnologia";"Comprensión lectora";"Médio";"ENEM";"2022";"15";"Em 2017, foi inaugurado, no estado da Bahia, o Parque Solar Lapa, composto por duas usinas (Bom Jesus da Lapa e Lapa) e capaz de gerar cerca de 300 GWh de energia por ano. Considere que cada usina apresente potência igual a 75 MW, com o parque totalizando uma potência instalada de 150 MW. Considere ainda que a irradiância solar média é de 1 500 W/m² e que a eficiência dos painéis é de 20%. **Parque Solar Lapa entra em operação**. Disponível em: www.canalbioenergia.com.br. Acesso em: 9 jun. 2022 (adaptado).";"1 000 000 m²";"500 000 m²";"250 000 m²";"100 000 m²";"20 000 m²";"b";"A resposta correta é a alternativa B. 500 000 m²"
"ENEM_2022_Q094";"multipla";"Biologia";"Língua Estrangeira (Espanhol)";"Reading comprehension";"Médio";"ENEM";"2022";"15";"![](https://enem.dev/2022/questions/94/a62bc797-e3bd-4754-bc9b-433469b0a49f.png) Os riscos apresentados pelos produtos dependem de suas propriedades e da reatividade quando em contato com outras substâncias. Para prevenir os riscos devido à natureza química dos produtos, devemos conhecer a lista de substâncias incompatíveis e de uso cotidiano em fábricas, hospitais e laboratórios, a fim de observar cuidados na estocagem, manipulação e descarte. O quadro elenca algumas dessas incompatibilidades, que podem levar à ocorrência de acidentes. Considere que houve o descarte indevido de dois conjuntos de substâncias: (1) ácido clorídrico concentrado com cianeto de potássio; (2) ácido nítrico concentrado com sacarose. Disponível em: www.fiocruz.br. Acesso em: 6 dez. 2017 (adaptado).";"Liberação de gás tóxico e reação oxidativa forte.";"Reação oxidativa forte e liberação de gás tóxico.";"Formação de sais tóxicos e reação oxidativa forte.";"Liberação de gás tóxico e liberação de gás oxidante.";"Formação de sais tóxicos e liberação de gás oxidante.";"a";"A resposta correta é a alternativa A. Liberação de gás tóxico e reação oxidativa forte."
