"id";"tipo";"disc";"tema";"subtema";"dif";"fonte";"ano";"xp";"enunciado";"a";"b";"c";"d";"e";"ok";"exp"
"ENEM_2010_Q096";"multipla";"Português";"Gramática e Linguística";"Mídias digitais";"Médio";"ENEM";"2010";"15";"![](https://enem.dev/2010/questions/96/64ed268e-140b-44f4-b421-94d66774f861.jpg)";"A opção pelo emprego da forma verbal “era” em lugar de “foi”.";"A ausência de artigo antes da palavra “árvore”.";"O emprego da redução “tá” em lugar da forma verbal “está”.";"O uso da contração “desse” em lugar da expressão “de esse”.";"A utilização do pronome “que” em início de frase exclamativa.";"c";"A resposta correta é a alternativa C. O emprego da redução “tá” em lugar da forma verbal “está”."
"ENEM_2010_Q097";"multipla";"Inglês";"Língua Estrangeira (Inglês)";"Modernismo";"Médio";"ENEM";"2010";"15";"A biosfera, que reúne todos os ambientes onde se desenvolvem os seres vivos, se divide em unidades menores chamadas ecossistemas, que podem ser uma tem múltiplos mecanismos que regulam o número de organismos dentro dele, controlando sua reprodução, crescimento e migrações. DUARTE, M. **O guia dos curiosos.** São Paulo: Companhia das Letras, 1995.";"Emotiva, porque o autor expressa seu sentimento em relação à ecologia.";"Fática, porque o texto testa o funcionamento do canal de comunicação.";"Poética, porque o texto chama a atenção para os recursos de linguagem.";"Conativa, porque o texto procura orientar comportamentos do leitor.";"Referencial, porque o texto trata de noções e informações conceituais.";"e";"A resposta correta é a alternativa E. Referencial, porque o texto trata de noções e informações conceituais."
"ENEM_2010_Q098";"multipla";"Inglês";"Língua Estrangeira (Inglês)";"Modernismo";"Médio";"ENEM";"2010";"15";"**Câncer 21/06 a 21/07** O eclipse em seu signo vai desencadear mudanças na sua autoestima e no seu modo de agir. O corpo indicará onde você falha – se anda engolindo sapos, a área gástrica se ressentirá. este novo ciclo exige uma “desintoxicação”. Seja comedida em suas ações, já que precisará de energia para se recompor. Há preocupação com a família, e a comunicação entre os irmãos trava. Lembre-se: palavra preciosa é palavra dita na hora certa. Isso ajuda também na vida amorosa, que será testada. Melhor conter as expectativas e ter calma, avaliando as próprias carências de modo maduro. Sentirá vontade de intimidade com os assuntos da alma. **Revista Cláudia.** No 7, ano 48, jul. 2009.";"Vender um produto anunciado.";"Informar sobre astronomia.";"Ensinar os cuidados com a saúde.";"Expor a opinião de leitores em um jornal.";"Aconselhar sobre amor, família, saúde, trabalho.";"e";"A resposta correta é a alternativa E. Aconselhar sobre amor, família, saúde, trabalho."
"ENEM_2010_Q099";"multipla";"Espanhol";"Língua Estrangeira (Espanhol)";"Romantismo";"Médio";"ENEM";"2010";"15";"**S.O.S Português** Por que pronunciamos muitas palavras de um jeito diferente da escrita? Pode-se refletir sobre esse aspecto da língua com base em duas perspectivas. Na primeira delas, fala e escrita são dicotômicas, o que restringe o ensino da língua ao código. Daí vem o entendimento de que a escrita é mais complexa que a fala, e seu ensino restringe-se ao conhecimento das regras gramaticais, sem a preocupação com situações de uso. Outra abordagem permite encarar as diferenças como um produto distinto de duas modalidades da língua: a oral e a escrita. A questão é que nem sempre nos damos conta disso. S.O.S Português. **Nova Escola.** São Paulo: Abril, Ano XXV, nº- 231, abr. 2010 (fragmento adaptado).";"Regional, pela presença de léxico de determinada região do Brasil.";"Literário, pela conformidade com as normas da gramática.";"Técnico, por meio de expressões próprias de textos científicos.";"Coloquial, por meio do registro de informalidade.";"Oral, por meio do uso de expressões típicas da oralidade.";"c";"A resposta correta é a alternativa C. Técnico, por meio de expressões próprias de textos científicos."
"ENEM_2010_Q100";"multipla";"Português";"Artes e Cultura";"Mídias digitais";"Médio";"ENEM";"2010";"15";"Na busca constante pela sua evolução, o ser humano vem alternando a sua maneira de pensar, de sentir e de criar. Nas últimas décadas do século XVIII e no início do século XIX, os artistas criaram obras em que predominam o equilíbrio e a simetria de formas e cores, imprimindo um estilo caracterizado pela imagem da respeitabilidade, da sobriedade, do concreto e do civismo. Esses artistas misturaram o passado ao presente, retratando os personagens da nobreza e da burguesia, além de cenas míticas e histórias cheias de vigor. RAZOUK, J. J. (Org.). **Histórias reais e belas nas telas.** Posigraf: 2003.";"[alternativa visual]";"[alternativa visual]";"[alternativa visual]";"[alternativa visual]";"[alternativa visual]";"c";"Gabarito oficial: alternativa C. Consulte a resolução completa no gabarito oficial do INEP."
"ENEM_2010_Q101";"multipla";"Português";"Comunicação e Tecnologia";"Arte contemporânea";"Médio";"ENEM";"2010";"15";"![](https://enem.dev/2010/questions/101/28db87e9-37b3-49bb-ac74-ecdb20dad7ef.png)";"Influenciar o comportamento do leitor, por meio de apelos que visam à adesão ao consumo.";"Definir regras de comportamento social pautadas no combate ao consumismo exagerado.";"Defender a importância do conhecimento de informática pela população de baixo poder aquisitivo.";"Facilitar o uso de equipamentos de informática pelas classes sociais economicamente desfavorecidas";"Questionar o fato de o homem ser mais inteligente que a máquina, mesmo a mais moderna.";"a";"A resposta correta é a alternativa A. Influenciar o comportamento do leitor, por meio de apelos que visam à adesão ao consumo."
"ENEM_2010_Q102";"multipla";"Português";"Artes e Cultura";"Comprensión lectora";"Médio";"ENEM";"2010";"15";"**Testes** Dia desses resolvi fazer um teste proposto por um _site_ da internet. O nome do teste era tentador: “O que Freud diria de você”. Uau. Respondi a todas as perguntas e o resultado foi o seguinte: “Os acontecimentos da sua infância a marcaram até os doze anos, depois disso você buscou conhecimento intelectual para seu amadurecimento”. Perfeito! Foi exatamente o que aconteceu comigo. Fiquei radiante: eu havia realizado uma consulta paranormal com o pai da psicanálise, e ele acertou na mosca. Estava com tempo sobrando, e curiosidade é algo que não me falta, então resolvi voltar ao teste e responder tudo diferente do que havia respondido antes. Marquei umas alternativas esdrúxulas, que nada tinham a ver com minha personalidade. E fui conferir o resultado, que dizia o seguinte: “Os acontecimentos da sua infância a marcaram até os 12 anos, depois disso você buscou conhecimento intelectual para seu amadurecimento”. MEDEIROS, M. **Doidas e santas.** Porto Alegre, 2008 (adaptado).";"“Marquei umas alternativas esdrúxulas, que nada tinham a ver”.";"“Os acontecimentos da sua infância a marcaram até os doze anos”.";"“Dia desses resolvi fazer um teste proposto por um site da internet”.";"“Respondi a todas as perguntas e o resultado foi o seguinte”.";"“Fiquei radiante: eu havia realizado uma consulta paranormal com o pai da psicanálise”.";"e";"A resposta correta é a alternativa E. “Fiquei radiante: eu havia realizado uma consulta paranormal com o pai da psicanálise”."
"ENEM_2010_Q103";"multipla";"História";"Comunicação e Tecnologia";"Coesão e coerência";"Médio";"ENEM";"2010";"15";"**Transtorno do comer compulsivo** O transtorno do comer compulsivo vem sendo reconhecido, nos últimos anos, como uma síndrome caracterizada por episódios de ingestão exagerada e compulsiva de alimentos, porém, diferentemente da bulimia nervosa, essas pessoas não tentam evitar ganho de peso com os métodos compensatórios. Os episódios vêm acompanhados de uma sensação de falta de controle sobre o ato de comer, sentimentos de culpa e de vergonha. Muitas pessoas com essa síndrome são obesas, apresentando uma história de variação de peso, pois a comida é usada para lidar com problemas psicológicos. O transtorno do comer compulsivo é encontrado em cerca de 2% da população em geral, mais frequentemente acometendo mulheres entre 20 e 30 anos de idade. Pesquisas demonstram que 30% das pessoas que procuram tratamento para obesidade ou para perda de peso são portadoras de transtorno do comer compulsivo. Disponível em: http://www.abcdasaude.com.br. Acesso em: 1 maio 2009 (adaptado).";"Descrever e fornecer orientações sobre a síndrome da compulsão alimentícia.";"Narrar a vida das pessoas que têm o transtorno do comer compulsivo.";"Aconselhar as pessoas obesas a perder peso com métodos simples.";"Expor de forma geral o transtorno compulsivo por alimentação. E";"Encaminhar as pessoas para a mudança de hábitos alimentícios.";"d";"A resposta correta é a alternativa D. Expor de forma geral o transtorno compulsivo por alimentação. E"
"ENEM_2010_Q104";"multipla";"História";"Literatura Brasileira";"Mídias digitais";"Médio";"ENEM";"2010";"15";"A gentileza é algo difícil de ser ensinado e vai muito além da palavra educação. Ela é difícil de ser encontrada, generosas e desprendidas, que se interessam em contribuir para o bem do outro e da sociedade. É uma atitude desobrigada, que se manifesta nas situações cotidianas e das maneiras mais prosaicas. SIMURRO, S. A. B. **Ser gentil é ser saudável.** Disponível em: http://www.abqv.org.br. Acesso em: 22 jun. 2006 (adaptado).";"Apresenta fatos que estabelecem entre si relações de causa e de consequência.";"Descreve condições para a ocorrência de atitudes educadas.";"Indica a finalidade pela qual a gentileza pode ser praticada.";"Enumera fatos sucessivos em uma relação temporal.";"Mostra oposição e acrescenta ideias.";"e";"A resposta correta é a alternativa E. Mostra oposição e acrescenta ideias."
