"id";"tipo";"disc";"tema";"subtema";"dif";"fonte";"ano";"xp";"enunciado";"a";"b";"c";"d";"e";"ok";"exp"
"ENEM_2010_Q078";"multipla";"Biologia";"Literatura Portuguesa";"Mídias digitais";"Difícil";"ENEM";"2010";"20";"Duas irmãs que dividem o mesmo quarto de estudos combinaram de comprar duas caixas com tampas para guardarem seus pertences dentro de suas caixas, evitando, assim, a bagunça sobre a mesa de estudos. Uma delas comprou uma metálica, e a outra, uma caixa de madeira de área e espessura lateral diferentes, para facilitar a identificação. Um dia as meninas foram estudar para a prova de Física e, ao se acomodarem na mesa de estudos, guardarem seus celulares ligados dentro de suas caixas. Ao longo desse dia, uma delas recebeu ligações telefônicas, enquanto os amigos da outra tentavam ligar e recebiam a mensagem de que o celular estava fora da área de cobertura ou desligado.";"Madeira, e o telefone não funcionava porque a madeira não é um bom condutor de eletricidade.";"Metal, e o telefone não funcionava devido à blindagem eletrostática que o metal proporcionava.";"Metal, e o telefone não funcionava porque o metal refletia todo tipo de radiação que nele incidia.";"Metal, e o telefone não funcionava porque a área lateral da caixa de metal era maior.";"Madeira, e o telefone não funcionava porque a espessura desta caixa era maior que a espessura da caixa de metal.";"b";"A resposta correta é a alternativa B. Metal, e o telefone não funcionava devido à blindagem eletrostática que o metal proporcionava."
"ENEM_2010_Q079";"multipla";"Biologia";"Comunicação e Tecnologia";"Comprensión lectora";"Difícil";"ENEM";"2010";"20";"As mobilizações para promover um planeta melhor para as futuras gerações são cada vez frequentes. A maior parte dos meios de transporte de massa é atualmente movida pela queima de um combustível fóssil. A título de exemplificação do ônus causado por essa prática, basta saber que um carro produz, em média, cerca de 200g de dióxido de carbono por km percorrido. Revista Aquecimento Global. Ano 2, no 8. Publicação do Instituto Brasileiro de Cultura Ltda.";"No processo há liberação de oxigênio, sob a forma de O2";"O coeficiente estequiométrico para a água é de 8 para 1 do octano.";"No processo há consumo de água, para que haja liberação de energia.";"O coeficiente estequiométrico para o oxigênio é de 12,5 para 1 do octano.";"O coeficiente estequiométrico para o gás carbônico é de 9 para 1 do octano";"d";"A resposta correta é a alternativa D. O coeficiente estequiométrico para o oxigênio é de 12,5 para 1 do octano."
"ENEM_2010_Q080";"multipla";"Biologia";"Literatura Brasileira";"Modernismo";"Difícil";"ENEM";"2010";"20";"Os pesticidas modernos são divididos em várias classes, entre as quais se destacam os organofosforados, materiais que apresentam efeito tóxico agudo para os seres humanos. Esses pesticidas contêm um átomo central de fósforo ao qual estão ligados outros átomos ou grupo de átomos como oxigênio, enxofre, grupos metoxi ou etoxi ou um radical orgânico de cadeia longa. Os organofosforados são divididos em três subclasses: Tipo A, na qual o enxofre não se incorpora na molácula; Tipo B, na qual o oxigênio, que faz dupla ligação com fósforo, é substituído pelo enxofre; e Tipo C, no qual dois oxigênios são substituídos por enxofre. BAIRD, C. Química Ambiental. Bookmam. 2005.";"[alternativa visual]";"[alternativa visual]";"[alternativa visual]";"[alternativa visual]";"[alternativa visual]";"e";"Gabarito oficial: alternativa E. Consulte a resolução completa no gabarito oficial do INEP."
"ENEM_2010_Q081";"multipla";"Biologia";"Comunicação e Tecnologia";"Coesão e coerência";"Médio";"ENEM";"2010";"15";"Durante uma obra em um clube, um grupo de trabalhadores teve de remover uma escultura de ferro maciço colocada no fundo de uma piscina vazia. Cinco trabalhadores amarraram cordas à escultura e tentaram puxá-la para cima, sem sucesso.";"Escultura flutuará, desta forma, os homens não precisarão fazer força para remover a escultura do fundo.";"Escultura ficará como peso menor. Desta forma, a intensidade da força necessária para elevar a escultura será menor.";"Água exercerá uma força na escultura proporcional a sua massa, e para cima. Esta força se somará à força que os trabalhadores fazem para anular a ação da força peso da escultura.";"Água exercerá uma força na escultura para baixo, e esta passará a receber uma força ascendente do piso da piscina. Esta força ajudará a anular a ação da força peso na escultura.";"Água exercerá uma força na escultura proporcional ao seu volume, e para cima. Esta força se somará à força que os trabalhadores fazem, podendo resultar em uma força ascendente maior que o peso da escultura.";"e";"A resposta correta é a alternativa E. Água exercerá uma força na escultura proporcional ao seu volume, e para cima. Esta força se somará à força que os trabalhadores fazem, podendo resulta..."
"ENEM_2010_Q082";"multipla";"Biologia";"Artes e Cultura";"Reading comprehension";"Médio";"ENEM";"2010";"15";"As baterias de Ni-Cd muito utilizadas no nosso cotidiano não devem ser descartadas em lixos comuns uma vez que uma considerável quantidade de cádmio é volatilizada e emitida para o meio ambiente quando as baterias gastas são incineradas como componente do lixo. Com o objetivo de evitar a emissão de cádmio para a atmosfera durante a combustão é indicada que seja feita a reciclagem dos materiais dessas baterias. Uma maneira de separar o cádmio dos demais compostos presentes na bateria é realizar o processo de lixiviação ácida.Nela, tanto os metais (Cd, Ni e, eventualmente, Co) como os hidróxidos de ions metálicos Cd(OH)2(s), Ni(OH)2(s), Co(OH)2(s) presentes na bateria, reagem com uma mistura ácida e são solubilizados. Em função da baixa seletividade (todos os ions metálicos são solubilizados), após a digestão ácida, é realizada uma etapa de extração dos metais com solventes orgânicos de acordo com a reação: ![](https://enem.dev/2010/questions/82/4176d2dd-3976-430c-85f8-68f6380b5dbb.jpg) Onde: M2+ = Cd2+ , Ni2+ ou Co2+ HR = C16H34\-PO2H : identificado no gráfico por X HR = C12H12\-PO2H : identificado no gráfico por Y O gráfico mostra resultado de extração utilizando os solventes orgânicos X e Y em diferentes pH. ![](https://enem.dev/2010/questions/82/8560bd4b-a670-4304-b5a1-8a6003323e93.jpg)";"As moléculas X e Y atuam como extratores catiônicos uma vez que a parte polar da molécula troca o íon H+ pelo cátion do metal.";"As moléculas X e Y atuam como extratores aniônicos uma vez que a parte polar da molécula troca o íon H+ pelo cátion do metal.";"As moléculas X e Y atuam como extratores catiônicos uma vez que a parte polar da molécula troca o íon PO2-2 pelo cátion do metal.";"As moléculas X e Y atuam como extratores aniônicos uma vez que a parte polar da molécula troca o íon PO2-2 pelo cátion do metal.";"As moléculas X e Y fazem ligações com os ions metálicos resultando em compostos com caráter apolar o que justifica a eficácia da extração.";"a";"A resposta correta é a alternativa A. As moléculas X e Y atuam como extratores catiônicos uma vez que a parte polar da molécula troca o íon H+ pelo cátion do metal."
"ENEM_2010_Q083";"multipla";"Biologia";"Gramática e Linguística";"Arte contemporânea";"Médio";"ENEM";"2010";"15";"Ao colocar um pouco de açúcar ma água e mexer até a obtenção de uma só fase, prepara-se uma solução. O mesmo acontece ao se adicionar um pouquinho de sal à água e misturar bem. Uma substância capaz de dissolver o soluto é denominada solvente; por exemplo, a água é um solvente para o açúcar, para o sal e para várias outras substâncias. A figura a seguir ilustra essa citação. ![](https://enem.dev/2010/questions/83/8b75906e-8371-440b-b712-7c31b6241295.png)";"0,02";"0,2";"2";"200";"2000";"b";"A resposta correta é a alternativa B. 0,2"
"ENEM_2010_Q084";"multipla";"Biologia";"Gramática e Linguística";"Reading comprehension";"Médio";"ENEM";"2010";"15";"Um grupo de cientistas liderado por pesquisadores do instituto de Tecnologia da Califórnia (Caltech), nos Estados Unidos, construiu o primeiro metamaterial que apresenta valor negativo do índice de refração relativo para a luz visível. Denomina-se metamaterial um material óptico artificial, tridimensional, formado por pequenas estruturas menores do que o comprimento de onda da luz, o que lhe dá propriedades e comportamentos que não são encontrados em materiais naturais. Esse material tem sido chamado de “canhoto”. Disponível em: http://www.invocaçãotecnologica.com.br. Acesso em: 28 abr. (adaptado).";"[alternativa visual]";"[alternativa visual]";"[alternativa visual]";"[alternativa visual]";"[alternativa visual]";"d";"Gabarito oficial: alternativa D. Consulte a resolução completa no gabarito oficial do INEP."
"ENEM_2010_Q085";"multipla";"Biologia";"Artes e Cultura";"Reading comprehension";"Médio";"ENEM";"2010";"15";"Decisão de asfaltamento da rodovia MG-010, acompanha da introdução de espécies exóticas, e a prática de incêndios criminosos, ameaçam o sofisticado ecossistema do campo rupestre da reserva da Serra do Espinhaço. As plantas nativas desta região, altamente adaptadas a uma alta concentração de alumínio, que inibe o crescimento das raízes e dificultam a absorção de nutrientes e água, estão sendo substituídas por espécies invasoras que não teriam naturalmente adaptação para este ambiente, no entanto elas estão dominando as margens da rodovia, equivocadamente chamada de “estrada ecológica”. Possivelmente a entrada de espécies de plantas exóticas neste ambiente foi provocada pelo uso, neste empreendimento, de um tipo de asfalto (cimento-solo), que possui uma mistura rica em cálcio, que causou modificações químicas aos solos adjacentes à rodovia MG-010. Scientific American. Brasil. Ano 7, nº 79. 2008 (adaptado).";"Inibe a toxicidade do alumínio, elevando o pH dessas áreas.";"Inibe a toxicidade do alumínio, reduzindo o pH dessas áreas.";"Aumenta a toxicidade do alumínio, elevando o pH dessas áreas.";"Aumenta a toxicidade do alumínio, reduzindo o pH dessas áreas.";"Neutraliza a toxicidade do alumínio, reduzindo o pH dessas áreas.";"a";"A resposta correta é a alternativa A. Inibe a toxicidade do alumínio, elevando o pH dessas áreas."
"ENEM_2010_Q086";"multipla";"Biologia";"Língua Estrangeira (Espanhol)";"Comprensión lectora";"Médio";"ENEM";"2010";"15";"![](https://enem.dev/2010/questions/86/ca1e9c9f-e762-49d8-aa6e-724bdbd3ae78.png) Três dos quatro tipos de testes atualmente empregados para a detecção de príons patogênicos, em tecidos cerebrais do gado morto, são mostrados nas figuras a seguir. Uma vez identificados um animal morto infectado, funcionários das agências de saúde pública e fazendeiros podem removê-lo do suprimento alimentar ou rastrear os alimentos infectados que o animal possa ter consumido.";"Animal A, lâmina B e gel A.";"Animal A, lâmina A e gel B.";"Animal B, lâmina A e gel B.";"Animal B, lâmina B e gel A.";"Animal A, lâmina B e gel B.";"c";"A resposta correta é a alternativa C. Animal B, lâmina A e gel B."
"ENEM_2010_Q087";"multipla";"Biologia";"Língua Estrangeira (Espanhol)";"Coesão e coerência";"Médio";"ENEM";"2010";"15";"De 15% a 20% da área de um canavial precisa ser renovada anualmente. Entre o período de corte e o de plantação de novas canas, os produtores estão optando por plantar leguminosas, pois elas fixam nitrogênio no solo, um adubo natural para a cana. Essa opção de rotação é agronomicamente favorável, de forma que municípios canavieiros são hoje grandes produtores de soja, amendoim e feijão. As encruzilhadas da fome. Planeta. São Paulo, ano 36, no 430, jul. 2008 (adaptado).";"A decomposição da cobertura morta dessas culturas resulta em economia na aquisição de adubos industrializados.";"O plantio de cana-de-açúcar propicia um solo mais adequado para o cultivo posterior da soja, do amendoim e do feijão.";"As leguminosas absorvem do solo elementos químicos diferentes dos absorvidos pela cana, restabelecendo o equilíbrio do solo.";"A queima dos restos de vegetais do cultivo da cana-de-açúcar transforma-se em cinzas, sendo reincorporadas ao solo, o que gera economia na aquisição de adubo.";"A soja, o amendoim e o feijão, além de possibilitarem a incorporação ao solo de determinadas moléculas disponíveis na atmosfera, são grãos comercializados no mercado produtivo.";"e";"A resposta correta é a alternativa E. A soja, o amendoim e o feijão, além de possibilitarem a incorporação ao solo de determinadas moléculas disponíveis na atmosfera, são grãos comercializ..."
"ENEM_2010_Q088";"multipla";"Biologia";"Artes e Cultura";"Reading comprehension";"Médio";"ENEM";"2010";"15";"Diversos comportamentos e funções fisiológicas do nosso corpo são periódicos, sendo assim, são classificados como ritmo biológico. Quando o ritmo biológico responde a um período aproximado de 24 horas, ele é denominado ritmo circadiano. Esse ritmo diário é mantido pelas pistas ambientais de claro-escuro e determina comportamentos como o ciclo do sono-vigília e o da alimentação. Uma pessoa, em condições normais, acorda às 8 h e vai dormir às 21 h, mantendo seu ciclo de sono dentro do ritmo dia e noite. Imagine que essa mesma pessoa tenha sido mantida numa sala totalmente escura por mais de quinze dias. Ao sair de lá, ela dormia às 18 h e acordava às 3 h da manhã. Além disso, dormia mais vezes durante o dia, por curtos períodos de tempo, e havia perdido a noção da contagem dos dias, pois, quando saiu, achou que havia passado muito mais tempo no escuro. Brandão, M. L. Psicofisiologia. São Paulo: Atheneu, 2000 (adaptado).";"Apresentou aumento do seu período de sono contínuo e passou a dormir durante o dia, pois seu ritmo biológico foi alterado apenas no período noturno.";"Apresentou pouca alteração do seu ritmo circadiano, sendo que sua noção de tempo foi alterada somente pela sua falta de atenção à passagem do tempo.";"Estava com seu ritmo já alterado antes de entrar na sala, o que significa que apenas progrediu para um estado mais avançado de perda do ritmo biológico no escuro.";"Teve seu ritmo biológico alterado devido à ausência de luz e de contato com o mundo externo, no qual a noção de tempo de um dia é modulada pela presença ou ausência do sol.";"Deveria não ter apresentado nenhuma mudança do seu período de sono porque, na realidade, continua com seu ritmo normal, independentemente do ambiente em que seja colocada.";"d";"A resposta correta é a alternativa D. Teve seu ritmo biológico alterado devido à ausência de luz e de contato com o mundo externo, no qual a noção de tempo de um dia é modulada pela presen..."
"ENEM_2010_Q089";"multipla";"Biologia";"Língua Estrangeira (Inglês)";"Arte contemporânea";"Médio";"ENEM";"2010";"15";"Deseja-se instalar uma estação de geração de energia elétrica em um município localizado no interior de um pequeno vale cercado de altas montanhas de difícil acesso. A cidade é cruzada por um rio, que é fonte de água para consumo, irrigação das lavouras de subsistência e pesca. Na região, que possui pequena extensão territorial, a incidência solar é alta o ano todo. A estação em questão irá abastecer apenas o município apresentado.";"Termoelétrica, pois é possível utilizar a água do rio no sistema de refrigeração.";"Eólica, pois a geografia do local é própria para a captação desse tipo de energia.";"Nuclear, pois o modo de resfriamento de seus sistemas não afetariam a população.";"Fotovoltaica, pois é possível aproveitar a energia solar que chega à superfície do local.";"Hidrelétrica, pois o rio que corta o município é suficiente para abastecer a usina construída.";"d";"A resposta correta é a alternativa D. Fotovoltaica, pois é possível aproveitar a energia solar que chega à superfície do local."
"ENEM_2010_Q090";"multipla";"Biologia";"Artes e Cultura";"Romantismo";"Médio";"ENEM";"2010";"15";"O lixão que recebia 130 toneladas de lixo e contaminava a região com seu chorume (líquido derivado da decomposição de compostos orgânicos) foi recuperado, transformando-se em um aterro sanitário controlado, mudando a qualidade de vida e a paisagem e proporcionando condições dignas de trabalho para os que dele subsistiam. Revista Promoção da Saúde da Secretaria de Políticas da Saúde. Ano 1, nº 4, dez. 2000 (adaptado).";"O lixo é recolhido e incinerado pela combustão a altas temperaturas.";"O lixo hospitalar é separado para ser enterrado e sobre ele, colocada cal virgem.";"O lixo orgânico e inorgânico é encoberto, e o chorume canalizado para ser tratado e neutralizado.";"O lixo orgânico é completamente separado do lixo inorgânico, evitando a formação de chorume.";"O lixo industrial é separado e acondicionado de forma adequada, formando uma bolsa de resíduos.";"c";"A resposta correta é a alternativa C. O lixo orgânico e inorgânico é encoberto, e o chorume canalizado para ser tratado e neutralizado."
"ENEM_2010_Q090";"multipla";"Biologia";"Interpretação e Produção de Texto";"Reading comprehension";"Médio";"ENEM";"2010";"15";"O lixão que recebia 130 toneladas de lixo e contaminava a região com seu chorume (líquido derivado da decomposição de compostos orgânicos) foi recuperado, transformando-se em um aterro sanitário controlado, mudando a qualidade de vida e a paisagem e proporcionando condições dignas de trabalho para os que dele subsistiam. Revista Promoção da Saúde da Secretaria de Políticas da Saúde. Ano 1, nº 4, dez. 2000 (adaptado).";"O lixo é recolhido e incinerado pela combustão a altas temperaturas.";"O lixo hospitalar é separado para ser enterrado e sobre ele, colocada cal virgem.";"O lixo orgânico e inorgânico é encoberto, e o chorume canalizado para ser tratado e neutralizado.";"O lixo orgânico é completamente separado do lixo inorgânico, evitando a formação de chorume.";"O lixo industrial é separado e acondicionado de forma adequada, formando uma bolsa de resíduos.";"c";"A resposta correta é a alternativa C. O lixo orgânico e inorgânico é encoberto, e o chorume canalizado para ser tratado e neutralizado."
"ENEM_2010_Q091";"multipla";"Português";"Gramática e Linguística";"Análise sintática";"Médio";"ENEM";"2010";"15";"**Los animales** En la Unión Europea desde el 1o de octubre de 2004 el uso de un pasaporte es obligatorio para los animales que viajan con su dueño en cualquier compañía. AVISO ESPECIAL: en España los animales deben haber sido vacunados contra la rabia antes de su dueño solicitar la documentación. Consultar a un veterinario. Disponível em: http://www.agencedelattre.com. Acesso em: 2 maio 2009 (adaptado).";"O consultaras autoridades para verificar a possibilidade de viagem.";"Ter um certificado especial tirado em outubro de 2004.";"Tirar o passaporte do animal e logo vaciná-lo.";"Vacinar o animal contra todas as doenças.";"Vacinar o animal e depois solicitar o passaporte dele.";"e";"A resposta correta é a alternativa E. Vacinar o animal e depois solicitar o passaporte dele."
"ENEM_2010_Q092";"multipla";"Literatura";"Literatura Portuguesa";"Reading comprehension";"Médio";"ENEM";"2010";"15";"**Bilingüismo en la Educación Media Continuidad, no continuismo** Aun sin escuela e incluso a pesar de la escuela, paraguayos y paraguayas se están comunicando en guaraní. La comunidad paraguaya ha encontrado en la lengua guaraní una funcionalidad real que asegura su reproducción y continuidad. Esto, sin embargo, no basta. La inclusión de la lengua guaraní en el proceso de educación escolar fue sin duda un avance de la Reforma Educativa. Gracias precisamente a los programas escolares, aun en contextos urbanos, el bilingüismo ha sido potenciado. Los guaraníhablantes se han acercado con mayor fuerza a la adquisición del castellano, y algunos castellanohablantes perdieron el miedo al guaraní y superaron los prejuicios en contra de él. Dejar fuera de la Educación Media al guaraní sería echar por la borda tanto trabajo realizado, tanta esperanza acumulada. Cualquier intento de marginación del guaraní en la educación paraguaya merece la más viva y decidida protesta, pero esta postura ética no puede encubrir el continuismo de una forma de enseñanza del guaraní que ya ha causado demasiados estragos contra la lengua, contra la cultura y aun contra la lealtad que las paraguayas y paraguayos sienten por su querida lengua. El guaraní, lengua de comunicación sí y mil veces sí; lengua de imposición, no. MELIÀ. B. Disponível em: http://www.staff.uni-mainz.de. Acesso em: 27 abr. 2010 (adaptado).";"O guarani continua sendo usado pelos paraguaios, mesmo sem a escola e apesar dela.";"O ensino médio no Paraguai, sem o guarani, desmereceria todo o trabalho realizado e as esperanças acumuladas.";"A língua guarani encontrou uma funcionalidade real que assegura sua reprodução e continuidade, mas só isso não basta.";"A introdução do guarani nas escolas potencializou a difusão da língua, mas é necessário que haja uma postura ética em seu ensino.";"O bilinguismo na maneira de ensinar o guarani tem causado estragos contra a língua, a cultura e a lealdade dos paraguaios ao guarani.";"d";"A resposta correta é a alternativa D. A introdução do guarani nas escolas potencializou a difusão da língua, mas é necessário que haja uma postura ética em seu ensino."
"ENEM_2010_Q093";"multipla";"Português";"Interpretação e Produção de Texto";"Análise sintática";"Médio";"ENEM";"2010";"15";"**Bilingüismo en la Educación Media Continuidad, no continuismo** Aun sin escuela e incluso a pesar de la escuela, paraguayos y paraguayas se están comunicando en guaraní. La comunidad paraguaya ha encontrado en la lengua guaraní una funcionalidad real que asegura su reproducción y continuidad. Esto, sin embargo, no basta. La inclusión de la lengua guaraní en el proceso de educación escolar fue sin duda un avance de la Reforma Educativa. Gracias precisamente a los programas escolares, aun en contextos urbanos, el bilingüismo ha sido potenciado. Los guaraníhablantes se han acercado con mayor fuerza a la adquisición del castellano, y algunos castellanohablantes perdieron el miedo al guaraní y superaron los prejuicios en contra de él. Dejar fuera de la Educación Media al guaraní sería echar por la borda tanto trabajo realizado, tanta esperanza acumulada. Cualquier intento de marginación del guaraní en la educación paraguaya merece la más viva y decidida protesta, pero esta postura ética no puede encubrir el continuismo de una forma de enseñanza del guaraní que ya ha causado demasiados estragos contra la lengua, contra la cultura y aun contra la lealtad que las paraguayas y paraguayos sienten por su querida lengua. El guaraní, lengua de comunicación sí y mil veces sí; lengua de imposición, no. MELIÀ. B. Disponível em: http://www.staff.uni-mainz.de. Acesso em: 27 abr. 2010 (adaptado).";"Falta de continuidade do ensino do guarani nos programas escolares.";"Preconceito existente contra o guarani principalmente nas escolas.";"Esperança acumulada na reforma educativa da educação média.";"Inclusão e permanência do ensino do guarani nas escolas.";"Continuísmo do ensino do castelhano nos centros urbanos.";"d";"A resposta correta é a alternativa D. Inclusão e permanência do ensino do guarani nas escolas."
"ENEM_2010_Q094";"multipla";"Literatura";"Literatura Brasileira";"Arte contemporânea";"Médio";"ENEM";"2010";"15";"Dejar de fumar engorda, pero seguir haciéndolo, también. Esa es la conclusión a la que han llegado investigadores de la Universidad de Navarra que han hecho un seguimiento de 7.565 personas durante 50 meses. Los datos “se han ajustado por edad, sexo, índice de masa corporal inicial y estilo de vida”, ha explicado el director del ensayo, Javier Basterra-Gortari, por lo que “el único factor que queda es el tabaquismo”. El estudio se ha publicado en la Revista Española de Cardiología. “El tabaco es un anorexígeno \[quita el apetito\], y por eso las personas que dejan de fumar engordan”, añade Basterra-Gortari. Eso hace mucho más relevante el hallazgo del estudio. Puesto en orden, los que más peso ganan son los que dejan de fumar, luego, los que siguen haciéndolo, y, por último, los que nunca han fumado, indica el investigador. “Por eso lo mejor para mantener una vida saludable es no fumar nunca”, añade. BENITO, E. Disponível em: http://www.elpais.com/articulo/sociedad. Acesso em: 23 abr. 2010 (fragmento).";"Estilo de vida interfere no ganho de peso.";"Estudo mostra expectativa de vida dos fumantes.";"Pessoas que fumam podem se tornar anoréxicas.";"Fumantes engordam mais que não fumantes.";"Tabagismo como fator de emagrecimento.";"d";"A resposta correta é a alternativa D. Fumantes engordam mais que não fumantes."
"ENEM_2010_Q095";"multipla";"Espanhol";"Língua Estrangeira (Espanhol)";"Coesão e coerência";"Médio";"ENEM";"2010";"15";"![](https://enem.dev/2010/questions/95-espanhol/fbbc0a02-918d-4b22-8db1-2c42cfcb18e9.png) **Revista Glamour Latinoamérica**. México, mar. 2010.";"Atrair a atenção do público alvo dessa propaganda.";"Popularizar a prática de exercícios esportivos.";"Agradar aos compradores ingleses desse tênis.";"Incentivar os espanhóis a falarem outras línguas.";"Enfatizar o conhecimento de mundo do autor do texto.";"a";"A resposta correta é a alternativa A. Atrair a atenção do público alvo dessa propaganda."
